Store,Address,state
PERNIAGAAN NAZILI,"LOT 246, KAMPUNG MERKANG 16800 PASIR PUTEH KELANTAN",KELANTAN
PASARAYA ECONO BATU LINTANG,"LOT 27397B, KAMPUNG BUKIT SUNGAI PASIR 08000 SUNGAI PETANI KEDAH",KEDAH
SING KWONG SUPERMARKET (BATU 8),"SUBLOT 61-63 OF LOT 341, BLOCK 33 AND LOT 1337 BOTH OF KEMENA LAND DISTRICT, 97000 BINTULU 97000 BINTULU SARAWAK",SARAWAK
99 SPEEDMART SDN BHD (TMN MEGAH RIA 2) - 3015,"NO : 27 & 29 (GROUND FLOOR), JALAN KEMPAS 17 TAMAN MEGAH RIA KAMPUNG MASJID LAMA 81750 MASAI JOHOR",JOHOR
PASARAYA MILLENNIUM (MANTIN) SDN BHD,"5G,7G,9G,11G JALAN BESAR MANTIN 71700 MANTIN NEGERI SEMBILAN",NEGERI SEMBILAN
M&M GROCER,"LOT 4490, TINGKAT BAWAH BLOCK 6, LAWAS LAND DISTRICT, JALAN PULAU SALAM, 98850 LAWAS 98850 LAWAS SARAWAK",SARAWAK
ECONO JAYA TAMAN KELADI,"NO.32,33,34 LORONG TEJA 10 TAMAN KELADI 08000 SUNGAI PETANI KEDAH",KEDAH
TF VALUE-MART SDN BHD (TELUK INTAN-2),TF VALUE MART SDN BHD (TELUK INTAN-2) PT NO.25581 TAMAN MELOR 3 JALAN SUNGAI MANIK 36000 TELUK INTAN PERAK,PERAK
99 SPEEDMART SDN BHD (TMN PERLING JB 2 ) - 2279,"NO: 6 & 8 (GROUND FLOOR), JALAN PERSISIRAN PERLING, TAMAN PERLING, 81200 SKUDAI JOHOR",JOHOR
MYDIN WHOLESALE HYPERMARKET TUNJONG,LOT PT 666 JALAN KUALA KRAI BANDAR BARU TUNJUNG 16010 KOTA BHARU KELANTAN,KELANTAN
TSB SUPERSTORE (JALAN PEGAWAI),"1492-1500, TAMAN SULTAN BADLISHAH, JALAN PEGAWAI, 05050 ALOR SETAR, KEDAH 05050 ALOR SETAR KEDAH",KEDAH
SEGI FRESH SERI ISKANDAR,"NO. 6-G, 7-G, 8-G, & 9-G JALAN ISKANDAR BISTARI 2 TAMAN ISKANDAR BISTARI 32610 SERI ISKANDAR PERAK",PERAK
ENG HOCK TONG TRADING,"NO. 9, JALAN PRIMA 2 PUSAT PERNIAGAAN SERAI PRIMA 34300 BAGAN SERAI PERAK",PERAK
SERVAY EXPRESS - SELKN,"LOT NO. A & B, KG LIMAUAN KINARUT JALAN PAPAR LAMA 89500 PAPAR SABAH",SABAH
SEGI FRESH NIBONG TEBAL,NO. 2G & 6G LORONG SERI EMAS INDAH 2 TAMAN SERI EMAS INDAH 14300 NIBONG TEBAL PENANG,PENANG
99 SPEEDMART SDN BHD (PP BUKIT GAMBIR) - 1829,NO: 35 & 37 PUSAT PERDAGANGAN 1 BUKIT GAMBIR 84800 LEDANG JOHOR,JOHOR
99 SPEEDMART SDN BHD (LINTANG BESTARI) - 2202,NO : 4 & 6 (GROUND FLOOR) LINTANG BESTARI 1 PUSAT BANDAR FASA 2 34200 PARIT BUNTAR PERAK,PERAK
BATARAS SUPERSTORE KUDAT TAMAN ORKID,"SHOP 1-5, TMN. ORKID, P.O BOX 77 89057 KUDAT SABAH",SABAH
HAJAH WAN YUNAH MINI MART,"NO. 46, JALAN BESAR, 36100 BAGAN DATUK PERAK",PERAK
CKS GROCER - HILLTOP,"LOT 4, (DBKK NO.1-0-5), GROUND FLOOR, KOLAM CENTRE PHASE 3 JALAN LINTAS 88300 LUYANG SABAH",SABAH
BORONG DIN AS CASH & CARRY SDN. BHD. (TMN PERTIWI INDAH),"NO. 2, 4, & 6 TAMAN PERTIWI INDAH JALAN KANGAR-ALOR SETAR 01000 KANGAR PERLIS",PERLIS
TUNAS MANJA SUPERMARKET SDN BHD (JERANTUT),"LOT PT9344, HADAPAN RHB BANK JALAN TAHAN 27000 JERANTUT PAHANG",PAHANG
99 SPEEDMART SDN BHD (TAMAN UNIVERSITI BATU PAHAT) - 2196,NO: 13 & 14 (GROUND FLOOR) JALAN UNIVERSITI 2 TAMAN UNIVERSITI 86400 PARIT RAJA JOHOR,JOHOR
GOH BROTHERS MINI MARKET,"JA 5006, JA 5007 TAMAN SRI SUNGAI RAMBAI 77400 SUNGAI RAMBAI MELAKA",MELAKA
ECONSAVE CASH & CARRY (KG) SDN BHD (KAMUNTING),LOT 5830 JALAN PER SATU KAWASAN PERUSAHAAN KAMUNTING 34600 KAMUNTING PERAK,PERAK
FRESH 365 - TANJUNG BUNGAH,"2E, JALAN TANJUNG BUNGAH, 11200 TANJUNG BUNGAH, PULAU PINANG 11200 TANJUNG BUNGAH PENANG",PENANG
96 MINI MARKET - BATU 39,"NO. 1 JALAN PERPADUAN 1/1, TAMAN PERPADUAN 45200 SABAK BERNAM SELANGOR",SELANGOR
BILLION SHOPPING CENTRE (SEBERANG JAYA) SDN BHD,"PLOT 7 & 8, MUKIM 1, JALAN TODAK 3, PUSAT BANDAR SEBERANG JAYA 13700 SEBERANG PERAITENGAH PENANG",PENANG
GMART BINTANGOR,LOT 921 BINATANG TOWN DISTRICT & LOT 274 BINATANG TOWN DISTRICT 96500 BINTANGOR SARAWAK,SARAWAK
99 SPEEDMART SDN BHD (KUALA KANGSAR) - 2387,"NO: 282 & 283 (G), LALUAN MERANTI TMN KUALA KANGSAR 33000 TMN KUALA KANGSAR PERAK",PERAK
ECONSAVE CASH & CARRY (KBS) SDN BHD (KAMPUNG BARU SUBANG),"LOT 3761, JALAN 2D KAMPUNG BARU SUBANG, SEKSYEN U6 40150 SHAH ALAM SELANGOR",SELANGOR
HELYN ENTERPRISE - SAPULUT,KG. LOTONG TALANGKAI 89957 SAPULUT SABAH,SABAH
ZULFIA SUPERSTORE SDN BHD,"LOT NO 5,6,7 & 8 LIGHT INDUSTRIAL BANDAR EMAS INDUSTRI PETI SURAT 976 89808 BEAUFORT 89808 BEAUFORT SABAH",SABAH
BATARAS CASH & CARRY TAMPARULI,"TL 45,COMMERCIAL,JLN PADANG 89250 TAMPARULI SABAH",SABAH
PASARAYA ECONO (KUBANG SEMANG),"NO. 1365, 1365A & 1365B, MUKIM 20 KUBANG SEMANG 14400 BUKIT MERTAJAM PENANG",PENANG
KUEK BROTHERS CO,NO. 13 PASAR BARU FASA 2 ASAJAYA ULU 94600 ASAJAYA SARAWAK,SARAWAK
TMG MART SDN BHD (ECO ARDENCE),"NO. 5,7,9,11,13 & 15 (TINGKAT BAWAH) JALAN ECO ARDENCE, C U12/36C ECO ARDENCE, SEKSYEN U12 40170 SHAH ALAM SELANGOR",SELANGOR
MEMPAGA FRESH SDN BHD (BENTA),"NO 26, TINGKAT ATAS DAN BAWAH TAMAN DESA BENTA JALAN DESA BENTA 2 27300 BENTA PAHANG",PAHANG
KIM HOCK SUPERMARKET SDN. BHD. (SIBU JAYA),"SUBLOT 27-36 IN LOT 1192, BLOCK 1, MENYAN LAND 96000 SIBU SARAWAK",SARAWAK
LOTUSS SG PETANI,"LOTUSS SG PETANI 300, JALAN HEIGHT LAGENDA HEIGHT 08000 SG PETANI KEDAH",KEDAH
99 SPEEDMART SDN BHD (BUKIT RAHMAN PUTRA) - 1137,"NO: 7 & 9, JALAN BRP 6/12 BUKIT RAHMAN PUTRA 68100 SHAH ALAM SELANGOR",SELANGOR
TMG EXPRESS 3000 SDN BHD (BENTONG DESA DAMAI),"LOT 17-19, JALAN BENTONG-RAUB, MUKIM BENTONG 28700 BENTONG PAHANG",PAHANG
U SENG MINI MARKET & STORE,NO.457 JALAN BESAR PAKA DUNGUN 23100 DUNGUN TERENGGANU,TERENGGANU
TRELEAF MART (KUBANG JELA),"LOT 8267, GM1000, KAMPUNG KUBANG JELA, MUKIM MANIR, 21200 KUALA TERENGGANU TERENGGANU",TERENGGANU
R6 MART (TASIK UTAMA),NO 15 JALAN TU 41 TAMAN TASIK UTAMA 75450 AYER KEROH MELAKA,MELAKA
B36-PASARAYA SAVE-DESA PENGKALAN BANDARAYA,NO.7 & 9 PENGKALAN BANDARAYA 10 DESA PENGKALAN BANDARAYA 31500 LAHAT PERAK,PERAK
99 SPEEDMART SDN BHD (TMN BUKIT MUTIARA ) - 2142,"NO: 59 & 61 (GROUND FLOOR), JALAN BUKIT MUTIARA 21, TAMAN BUKIT MUTIARA, 81100 JOHOR BAHRU JOHOR",JOHOR
KA LONG MINI MARKET,"B32-34, JALAN KAMPUNG PADANG 2, TAMAN IMPIANKU 25200 KUANTAN PAHANG",PAHANG
SEGI FRESH IJOK,"NO. 6,8,10 JALAN IJOK UTAMA 4 TAMAN IJOK UTAMA 46520 BATANG BERJUNTAI SELANGOR",SELANGOR
PASARAYA EKONOMI SCH,"61-66, BATU 2, JALAN LANGGAR, 05460 ALOR SETAR, KEDAH 05460 ALOR SETAR KEDAH",KEDAH
BATU 11 MART,"LOT 1825, BATU 11 KETEREH 16450 KOTA BHARU KELANTAN",KELANTAN
SEGI FRESH TANJUNG MALIM,"PT 17028, 17029, 17030, 17031, 17032, 17033 & 17034 JALAN PERMAI 1 TAMAN KETOYONG PERMAI 35900 TANJUNG MALIM PERAK",PERAK
PASAR BORONG MATAHARI (NILAI),"LOT 20730, JALAN BBN 1/2H, PUSAT BANDAR PUTRA POINT 71800 NILAI NEGERI SEMBILAN",NEGERI SEMBILAN
RS TAWAKAL ENTERPRISE,NO 18/2 LORONG TAWAKAL SRI GADING 83300 BATU PAHAT JOHOR,JOHOR
99 SPEEDMART SDN BHD (BDR TUN RAZAK) - 3066,"NO : 13 & 14 (GROUND FLOOR), KEDAI TDK, PUSAT BANDAR, BANDAR TUN RAZAK, 26900 BANDAR TUN ABDUL RAZAK PAHANG",PAHANG
CHOP LEE HONG SUPERMARKET,NO. 89-90 (LOT 334 & 335 MTD) JALAN KAPITAN LIM CHIING KIAT 98050 BARAM SARAWAK,SARAWAK
KIM HOCK SUPERMARKET @GAFU SUPERMARKET -SIBU,"SUBLOT 5-17 ( NEW LOT 4111-4123) HELD IN PARENT LOT 1852, BLOCK 3 SIBU TOWN DISTRICT 96000 SIBU SARAWAK",SARAWAK
CHOP SWEE HIN CHAN (M) SDN BHD,"NO. 4,5,6 & 7, HEAWOOD GARDEN 31100 SUNGAI SIPUT PERAK",PERAK
LOTUSS PUCHONG,"LOTUSS PUCHONG NO. 148-149, PUSAT BANDAR PUCHONG 3 OFF JALAN PUCHONG 47100 PUCHONG SELANGOR",SELANGOR
KK SUPER MART (TAMAN SRI SAUJANA),"NO.51, JALAN SS 2/6, TAMAN SRI SAUJANA, 81900 KOTA TINGGI, JOHOR. 81900 KOTA TINGGI JOHOR",JOHOR
99 SPEEDMART SDN BHD (TAMAN SEREMBAN JAYA 3) - 1992,NO : 529 (GROUND FLOOR) JALAN SJ 9/1 TAMAN SEREMBAN JAYA 70450 SEREMBAN NEGERI SEMBILAN,NEGERI SEMBILAN
HWA THAI SUPERMARKET (PUTERI MART),JALAN BELADAU 17 TAMAN PUTERI WANGSA 81800 ULU TIRAM JOHOR,JOHOR
QIZTINA ENTERPRISE - ASAP,PUNAN LAND DISTRICT SG. ASAP @ DEPAN SIMPANG UMA KULIT SUNGAI ASAP 96950 BELAGA SARAWAK,SARAWAK
H&L RETAIL SDN BHD (AIMAN MALL),"GROUND FLOOR NO.29, AIMAN MALL JALAN DATO MOHD MUSA 94300 KOTA SAMARAHAN SARAWAK",SARAWAK
HOCK HIN 2015,"LOT 73, JALAN PAHLAWAN, SARATOK BAZAAR 95400 SARATOK 95400 SARATOK SARAWAK",SARAWAK
PASARAYA WELL-MART DS1,"BLOCK B-G-03A, APARTMENT IDAMAN JALAN PJU 10/1 DAMANSARA DAMAI 47830 PETALING JAYA SELANGOR",SELANGOR
KK SUPER MART (TAMAN MEGAH),"NO.1, JALAN MEGAH 29, TAMAN MEGAH CHERAS 43200 KAJANG SELANGOR",SELANGOR
MYGROCER (VJW 1576),NO 5 JALAN PTP 1/6 TAMAN PERINDUSTRIAN TASIK PERDANA 47120 PUCHONG SELANGOR,SELANGOR
SEGI FRESH (SALAK TINGGI),"SEGI FRESH SALAK TINGGI NO. 38, 40, & 42, JALAN SEROJA 7 TAMAN SEROJA 43900 SALAK TINGGI SELANGOR",SELANGOR
99 SPEEDMART SDN BHD (SULTAN SULEIMAN1) -,"NO. 107, LINTANG SULTAN MOHAMAD 1B, PUSAT PERDAGANGAN BANDAR SULTAN SULEIMAN 42000 PELABUHAN KLANG SELANGOR",SELANGOR
Q MART (BUKIT BAYAS),"LOT 68 & 69, JALAN PASIR PANJANG 21100 KUALA TERENGGANU TERENGGANU",TERENGGANU
DOREMART SIBU HANNS,"NO.24-30, 46 &47 & COMMON AREA, G/F LOT 660 BLOCK 7 SIBU TOWN DISTRICT 96000 SIBU SARAWAK",SARAWAK
99 SPEEDMART SDN BHD (TMN SEMELING INDAH)-2846,NO: A1 & A2 (GROUND FLOOR) JALAN SEMELING MAJU 1 TAMAN SEMELING SETIA 08100 BEDONG KEDAH,KEDAH
99 SPEEDMART SDN BHD (TMN FAJAR KLUANG) - 2120,"NO : 12 & 14 (GROUND FLOOR), JALAN KAMPUNG TENGAH 2 TAMAN FAJAR JAYA 86000 KLUANG JOHOR",JOHOR
99 SPEEDMART SDN BHD (MITC PERDANA) - 1981,"NO: 24 & 26 (GROUND FLOOR), JALAN LINGKARAN MITC KOMPLEKS PERNIAGAAN MITC PERDANA 75450 HANG TUAH JAYA MELAKA",MELAKA
PASARAYA JAYA GADING (CHERATING),"A19, A21, A23, A25, A27 JALAN CHERATING INDAH 1 26080 KUANTAN PAHANG",PAHANG
99 SPEEDMART SDN BHD (TAMAN SURIAN) - 2925,NO: 11 & 12 (GROUND FLOOR) JALAN SURIAN 11 TAMAN SURIAN 71700 MANTIN NEGERI SEMBILAN,NEGERI SEMBILAN
BATARAS SUPERSTORE RANAU,"KG.SINARUT, TAMAN DAHLIA P.O BOX 67, 89307 RANAU SABAH",SABAH
UPWELL SUPERMARKET SDN BHD - BAU,"LOT 704, BAU TOWN DISTRICT SUBLOT 1-7, JALAN SERINGGOK 94000 BAU SARAWAK",SARAWAK
BATU BERENDAM FAMILY STORE SDN BHD,GUDANG JKR 1336 BATU BERENDAM 75350 BATU BERENDAM MELAKA,MELAKA
SERVAY EVERGREEN SDN BHD - SHPT,"BLOCK.K, LOT 1, LORONG GRAND PLAZA 3, GRAND PLAZA PUTATAN 89500 PUTATAN SABAH",SABAH
MYGROCER (VHE 2057),NO 5 JALAN PTP 1/6 TAMAN PERINDUSTRIAN TASIK PERDANA 47120 PUCHONG SELANGOR,SELANGOR
SEGI FRESH TRONOH,"NO. 27G, 29G & 31G PERSIARAN BARU, TAMAN TRONOH BARU 31750 TRONOH PERAK",PERAK
PASARAYA HALALANA,"LOT 2519, LOT A & B, KAMPUNG ANA 16210 TUMPAT KELANTAN",KELANTAN
99 SPEEDMART SDN BHD (TMN CAHAYA MASAI) - 2285,"NO: 35 & 37 (GROUND FLOOR), JALAN INTAN 13 TAMAN CAHAYA MASAI KAMPUNG MASJID LAMA 81700 PASIR GUDANG JOHOR",JOHOR
ICON MART (BP) SDN. BHD. (TMN MURNI),"NO. 45, JALAN KUNING, TAMAN MURNI, 83000 BATU PAHAT JOHOR",JOHOR
FRESH HUB TAMAN MANIS,"NO 27, 28 & 29 JALAN MANIS 2 TAMAN MANIS KELAPA SAWIT 81030 KULAI JOHOR",JOHOR
ECO-SHOP LUMUT,"NO. 11, 12, 13, 14, 15 GRD FLR, JALAN LUMUT MEWAH 2/1 TAMAN LUMUT MEWAH 32040 LUMUT PERAK",PERAK
PASAR RAYA ANAK KURAU,NO. 1 & 3 GROUND FLOOR LINTANG AMAN 1 TAMAN KURAU AMAN 34350 KUALA KURAU PERAK,PERAK
99 SPEEDMART SDN BHD (TAMAN RIA) - 1687,"NO: 5 & 6, BATU 2 1/2 JALAN SEREMBAN TMN RIA 71000 PORT DICKSON NEGERI SEMBILAN",NEGERI SEMBILAN
NSK TRADE CITY (CHERAS) SDB BHD - BATU 9,"KOMPLEKS MEMBELI BELAH NSK CHERAS, LOT 33924, LEBUHRAYA CHERAS-KAJANG 43200 CHERAS SELANGOR",SELANGOR
99 SPEEDMART SDN BHD (BANDAR JASIN BESTARI FASA 3) - 2907,NO: JC 3008 & JC 3009 (GROUND FLOOR) JALAN BJB 3/2 BANDAR JASIN BESTARI FASA 3 77200 BEMBAN MELAKA,MELAKA
OCO MART,NO-14-A(1670) TINGKAT BAWAH JALAN SATU TAMAN PADANG MIDIN 21400 KUALA TERENGGANU TERENGGANU,TERENGGANU
MS MEMPAGA SEGAR (FELDA MEMPAGA) SDN BHD,"NO 2, KEDAI BIRO EKONOMI, FELDA MEMPAGA 3, KARAK 28600 FELDA MEMPAGA PAHANG",PAHANG
99 SPEEDMART SDN BHD (TMN SURIA)-2653,NO: 69 & 70 (GROUND FLOOR) JALAN RAYA GURUN TAMAN SURIA 08300 GURUN KEDAH,KEDAH
MALAR PROVISION SHOP (KEDAI RUNCIT MALAR),35 JALAN BADIK 16 TMN PUTERI WANGSA 81800 ULU TIRAM JOHOR,JOHOR
EVERWIN CENTRE (DESA WIRA) SDN BHD,"LOT 6402-6410 (SL30-38), BLK 225, KNLD TAMAN DESA WIRA, JALAN BATU KAWA 93250 KUCHING SARAWAK",SARAWAK
SS GROCER SDN BHD (GRISEK) - HQ,"JG 3-3A, 3 - 5, 3 -6, JALAN JG3 JALAN BESAR 84700 GERSIK JOHOR",JOHOR
99 SPEEDMART SDN BHD (TAMAN SEMBRONG BARU) - 1967,NO : 180 (GROUND FLOOR) JALAN BESAR TAMAN SEMBRONG BARU 83700 YONG PENG JOHOR,JOHOR
PASARAYA EKONOMI A-WANG (GERIK) SDN BHD - LAWIN,"LOT 3078, MUKIM KENERING 33300 LAWIN PERAK",PERAK
INDAI MART (BEKENU),"LOT 222 & 223, JLN BEKENU-MIRI, BEKENU TOWN 98150 BEKENU SARAWAK",SARAWAK
99 SPEEDMART SDN BHD (PALOH) - 2020,NO: 95 & 97 (GROUND FLOOR) JALAN 1 TAMAN SRI PALOH 86600 PALOH JOHOR,JOHOR
99 SPEEDMART SDN BHD (PULAU SEBANG) - 1861,"NO: AG 5431 (GROUND FLOOR) JALAN BESAR, PULAU SEBANG BATU 22 1/2 73000 TAMPIN MELAKA",MELAKA
GT CASH & CARRY ENTERPRISE (WAKAF STAN),"LOT 944, JALAN WAKAF STAN, KG. PDG PADUKA 16150 KUBANG KERIAN KELANTAN",KELANTAN
FAMILY W GROCER (MISSION ROAD),"NO.37, 39 & 52 (GROUND FLOOR), MISSION ROAD 96000 SIBU SARAWAK",SARAWAK
PASARAYA ECONO (TANAH MERAH PENDANG),"PLOT 9-12 GROUND FLOOR & PLOT 9A-12A GROUND FLOOR TANAH MERAH COMMERCIAL CENTRE JALAN BANDAR BARU 6,PEKAN TANAH MERAH 06700 PENDANG KEDAH",KEDAH
ECONSAVE CASH & CARRY (SM) SDN BHD (SEMENYIH),NO.16-20 JALAN PASAR SEKSYEN 7 43500 SEMENYIH SELANGOR,SELANGOR
BILLION SHOPPING CENTRE (JELAPANG) SDN BHD - CAMERON HIGHLANDS,"LG2, PRESINT 1, CAMERON CENTRUM CAMERON HIGHLANDS 39100 BRINCHANG PAHANG",PAHANG
TRIMAJU COLDSTORAGE SDN BHD (KABONG),LOT 217 KABONG TOWN DISTRICT KABONG BAZAAR 94650 KABONG SARAWAK,SARAWAK
MDS MART WHOLESALE SDN BHD,"LOT 4311, BLOCK 7, SIBU TOWN DISTRICT 97000 SIBU SARAWAK",SARAWAK
G-MART BORNEO RETAIL SDN BHD - RANAU,"G*MART-RANAU, NT11745, LOT 1-6, RANAU COMMERCIAL SHOPLOT, 3KM, JALAN RANAU, SANDAKAN 89300 SANDAKAN SABAH",SABAH
ECO-SHOP TASEK PERAK,NO. 707 & 709 GROUND & FIRST FLOOR JALAN KUALA KANGSAR TAMAN TASEK JAYA 31400 IPOH PERAK,PERAK
SEGI FRESH JERAM,"NO.7-G, 9-G & 11-G JALAN SEJAHTERA 1 TAMAN SEJAHTERA 45800 KUALA SELANGOR SELANGOR",SELANGOR
SEGI FRESH ARA DAMANSARA,"J-G-06, J-G-08, BLOK J NO. 2, JALAN PJU 1A/41B, PUSAT DAGANGAN NZX ARA JAYA, PJU 1A 47301 PETALING JAYA SELANGOR",SELANGOR
PASARMINI KINTA - KLANG,"12 & 14, JALAN BENDAHARA 8KS07, TAMAN SEJATI, OFF JALAN SUNGAI JATI, 41200 KLANG SELANGOR",SELANGOR
NAM LEONG - PUSA A,"LOT 217,BLOCK 5 SABLOR LAND DISTRICT 94950 PUSA SARAWAK",SARAWAK
FRESH HUB (SERI IMPIAN),"NO 37,38 & 39 JALAN SERI IMPIAN 1/2 TAMAN SERI IMPIAN 86000 KLUANG JOHOR",JOHOR
99 SPEEDMART SDN BHD (TG KARANG1) - 1043,"15 & 17, JALAN PB 1/1, PUSAT BANDAR TANJONG KARANG, 45500 TANJONG KARANG SELANGOR",SELANGOR
EMART XPRESS SDN BHD - SUKMA RIA,"LOT 1467, 1468 & 1469, BLOCK 14, SALAK LAND DISTRICT JALAN SULTAN TENGAH, PETRA JAYA 93050 KUCHING SARAWAK",SARAWAK
PASARAYA WELL-MART SA3,"NO.7&8, GROUND FLOOR SHOPLOT BUKIT SUBANG, COMMERCIAL CENTRE JALAN METAFASA U16/5, TAMAN BUKIT SUBANG 40160 SHAH ALAM SELANGOR",SELANGOR
EVERWIN MART SDN BHD,"SUBLOT 18 COMPRISED IN LOTS 2019 & 2020 BOTH IN BLOCK 18, MUKAH LAND DISTRICT 96400 MUKAH SARAWAK",SARAWAK
PASAR MINI AZMAN,NO. 38 JALAN POKAN JOHOL 73100 JOHOL NEGERI SEMBILAN,NEGERI SEMBILAN
FRIENDLY BEST MART (TEMENGGONG) SDN BHD (TMN SERI TEMENGGONG),"5,7,9,11, JALAN SRI TEMENGGONG 26/1, TMN SERI TEMENGGONG, JALAN TEMENGGONG AHMAD, 84000 MUAR JOHOR",JOHOR
XIRI (K.BERANG) MUKIM MANIR,"LOT 8217, MUKIM MANIR, KAMPUNG KUBANG JELA 21200 KUALA TERENGGANU TERENGGANU",TERENGGANU
BIG 10 GROCER (BUKIT BARU) SDN BHD,"NO 32, 32-1, 34, 34-1, 36, 36-1, 38,38-1, 40, 40-1, 42, 42-1, 44, 44-1, 46, 46-1, GF & 1ST FLOOR JALAN PNBBU 5, PUSAT NIAGA BUKIT BARU UTAMA 75150 BUKIT BARU MELAKA",MELAKA
PACIFIC GROCER & DEPARTMENT STORE (MENTAKAB STAR CITY),"LORONG BENDAHARA 1, MENTAKAB STAR CITY, 28400 MENTAKAB PAHANG",PAHANG
TMG EXPRESS 3000 (BATU TIONG) SDN BHD,"PT 18151, 18152 & 18153, GROUND FLOOR KAMPUNG BATU TIONG, JALAN BESAR DUNGUN 23000 KUALA DUNGUN TERENGGANU",TERENGGANU
MEGAMART SDN BHD (SEGAMAT),"NO 16,17,18,19,20 JALAN PUTRA 1/5 BANDAR IOI 85000 SEGAMAT JOHOR",JOHOR
99 SPEEDMART SDN BHD (TMN PUTRIMAS ) - 3124,"NO : 144 (GROUND FLOOR), JALAN PUTRI 1, TAMAN PUTRIMAS, 86200 SIMPANG RENGGAM JOHOR",JOHOR
99 SPEEDMART SDN BHD (CHAAH) - 1953,"NO: 3B (GROUND FLOOR), JALAN YONG PENG TAMAN SAUJANA 85400 CHAAH JOHOR",JOHOR
SEGI FRESH RANTAU PANJANG,"NO. 25, 27, 29, 31 & 33 JALAN RANTAU PANJANG 3/KU4 BATU 4 42200 KLANG SELANGOR",SELANGOR
99 SPEEDMART SDN BHD (TAMAN PERINDUSTRIAN I-PARK SAC) - 3064,NO: 115 & 116 (GROUND FLOOR) JALAN I-PARK SAC 1/1 TAMAN PERINDUSTRIAN I-PARK SAC 81400 SENAI JOHOR,JOHOR
SEGI FRESH GERIK,"NO. 35, 36, 37 & 38 JALAN REFLESIA 1 TAMAN REFLESIA FASA 1 33300 GERIK PERAK",PERAK
FAMILY W GROCER (BELADIN),GF SUBLOT 4 TO 10 OF PARENT LOT 80 BLOCK 18 SEBLOR LAND DISTRICT 94950 BELADIN SARAWAK,SARAWAK
WLS ENTERPRISE SDN BHD - KS,"PT 116, KAMPUNG SERENDAH 16450 KETEREH KELANTAN",KELANTAN
ILHAM IKHTIAR TEGUH RESOURCES,"LOT 4824, KAMPUNG BARU HUJUNG REPEK 16310 BACHOK KELANTAN",KELANTAN
B22-PASARAYA SAVE-LAPANGAN JAYA,"36 & 38, JALAN LAPANGAN 6 PUSAT PERNIAGAAN LAPANGAN JAYA 31350 IPOH PERAK",PERAK
BIG 10 GROCER (SEREMBAN) SDN BHD,NO 20 - 30 (GF & 1ST FLOOR) JALAN PKBB 2 PUSAT KOMERSIAL BUKT BLOSSOM 70100 SEREMBAN NEGERI SEMBILAN,NEGERI SEMBILAN
99 SPEEDMART SDN BHD (BANDAR BARU KUNDANG) - 1539,"NO: 43-B & 43-C, JALAN PEKAN 2 KAMPUNG BARU KUNDANG BANDAR SETIA ALAM 48020 RAWANG SELANGOR",SELANGOR
PASARAYA AL-NAIM SDN. BHD.,"BANGUNAN SERBAGUNA BINTONG, HADAPAN MASMUDA, TAMAN NIAGA BINTONG, JALAN TELUK JAMBUL, 01000 KANGAR PERLIS 01000 KANGAR PERLIS",PERLIS
ECO-SHOP SUNGAI SIPUT,"NO. 777 & 778 GROUND & FIRST FLOOR, KAMPUNG MUHIBBAH FASA 2B, 31100 SUNGAI SIPUT PERAK",PERAK
BEE GAR TRADING SDN BHD (JALAN KLINIK),"PT 281 282 283, JALAN KLINIK 17500 TANAH MERAH KELANTAN",KELANTAN
THE STORE (JALAN BESAR BANTING),"LOT 1256, JALAN BESAR 42700 BANTING SELANGOR",SELANGOR
99 SPEEDMART SDN BHD (TAMAN SEJAHTERA) – 3147,"NO: 13 & 14 (GROUND FLOOR) JALAN SEJAHTERA 1, TAMAN SEJAHTERA, 08200 SIK KEDAH",KEDAH
PASARAYA HOME U (GERONG),"LOT 1955, CABANG TIGA GERONG PALEKBANG GERONG 16040 TUMPAT KELANTAN",KELANTAN
KIM SOON MINI MART SDN BHD (TMN BUKIT KEMPAS),"114, JALAN BUKIT KEMPAS 1/18, TAMAN BUKIT KEMPAS 81200 JOHOR BAHRU JOHOR",JOHOR
99 SPEEDMART SDN BHD (TMN MUTIARA ) - 2043,"NO: 7 & 9 (GROUND FLOOR), JALAN MUTIARA, TAMAN MUTIARA, 83500 PARIT SULONG JOHOR",JOHOR
ECO-SHOP HUTAN MELINTANG,"NO. 1 GRD, 1ST, 2ND & 3RD FRL LORONG AGENDA 1 MEDANIAGA LAGENDA 36400 HUTAN MELINTANG PERAK",PERAK
99 SPEEDMART SDN BHD (KIABURI PLAZA) - SBH 15717,GROUND FLOOR LOT NO. N4 & N5 KIABURI PLAZA JALAN TAMBUNAN RANAU 89308 RANAU SABAH,SABAH
99 SPEEDMART SDN BHD (TMN PEGAGA)-2780,NO: 72 (GROUND FLOOR) JALAN PEGAGA TAMAN PEGAGA 09600 LUNAS KEDAH,KEDAH
GIANT HYPERMARKET GHBK (BANDAR KINRARA),"LOT 449, JALAN BK 5A/1 BANDAR KINRARA 47100 PUCHONG SELANGOR",SELANGOR
99 SPEEDMART SDN BHD (KAMPUNG KILUGUS) - SBH 28722,NT SERIAL NO. 184927044 KAMPUNG KILUGUS JALAN BEAUFORT-MENUMBOK 89740 KUALA PENYU SABAH,SABAH
MYGROCER (VHC 9745) HQ,NO 5 JALAN 1/6 TAMAN PERINDUSTRIAN TASIK PERDANA 47120 PUCHONG SELANGOR,SELANGOR
LOTUSS (IPOH GARDEN),NO. 2 JALAN JAMBU TAMAN TEH TENG SENG 31400 IPOH PERAK,PERAK
B04-PASARAYA SAVE-SILIBIN,"403, JALAN SILIBIN TAMAN SERI TAHAN 30100 IPOH PERAK",PERAK
SERVAY EVERGREEN SDN BHD - SJKU,"DOUBLE STOREY SHOP BUILDING ON TL247500296, PEKAN KUNAK 91100 KUNAK SABAH",SABAH
99 SPEEDMART SDN BHD (SRI LALANG) - 2158,"NO: 11A & 15 (GROUND FLOOR), JALAN RIA 2 TAMAN RIA 86000 SRI LALANG JOHOR",JOHOR
G-MART BORNEO RETAIL SDN BHD - TAMBUNAN,"G*MART-TAMBUNAN STORE, LOT 1-4, BLOCK G TAMBUNAN NEW TOWNSHIP PHASE IV 89657 TAMBUNAN SABAH",SABAH
PERNIAGAAN IZZATULLAH (SG. LEREK),NO. A139 KAMPUNG SUNGAI LEREK 21450 PERMAISURI TERENGGANU,TERENGGANU
LOTUSS (PLENTONG),"LOT 34 JALAN MASAI, BATU 10 MASAI 81750 JOHOR BAHRU JOHOR",JOHOR
DMART SEGI PASOH 01,FELDA PASOH 01 SIMPANG PERTANG 72300 PASOH NEGERI SEMBILAN,NEGERI SEMBILAN
99 SPEEDMART SDN BHD (BRINCHANG) - 2962,"NO: 4 (GROUND FLOOR), JALAN BESAR BRINCHANG, 39100 BRINCHANG PAHANG",PAHANG
99 SPEEDMART SDN BHD (TMN BISTARI UTAMA)-2607,NO: 17A & 18A (GROUND FLOOR) JALAN BISTARI JAYA UTAMA TAMAN BISTARI UTAMA 08100 BEDONG KEDAH,KEDAH
99 SPEEDMART SDN BHD (TAMAN SAUJANA PUTRA) - 2495,NO: 2 & 3 (GROUND FLOOR) JALAN PUTRA 1 TAMAN SAUJANA PUTRA 84000 KESANG JOHOR,JOHOR
BATARAS SUPERSTORE TELIPOK,"""LOT 19, 20, 21, 23, 23A, WISMA TELIPOK RIA PHASE 1 TELIPOK 89200 TUARAN SABAH",SABAH
KK SUPER MART (TAMAN PERMATA LUMUT),"NO. 41 & 42, JALAN PERMATA 1, TAMAN PERMATA 32200 LUMUT PERAK",PERAK
TSB MINISTORE (SIMPANG EMPAT),"2,3,4 TAMAN SIMPANG JAYA, SIMPANG EMPAT, 06650 ALOR SETAR, KEDAH 06650 ALOR SETAR KEDAH",KEDAH
LOTUSS SEMENYIH,"LOTUSS SEMENYIH NO. 1, JALAN TPS 1/1 TAMAN PELANGI SEMENYIH 43500 SEMENYIH SELANGOR",SELANGOR
SERVAY EXPRESS - SEBRPP,"GROUND FLOOR, NO 20, JALAN BUNGA RAYA, PAPAR SABAH AND HELD UNDER TITLE NO. TOWN LEASE 027500947, DISTRICT OF PAPAR 88200 PAPAR SABAH",SABAH
ECO-SHOP GERIK,"NO. 2, 3 & 4 (GRD & 1ST FLR, JALAN IDAMAN 1 TAMAN IDAMAN 33300 GERIK PERAK",PERAK
99 SPEEDMART SDN BHD (TAMAN SERI MANGGIS) - 2886,NO: GD 160 & GD 161 (GROUND FLOOR) JALAN SERI MANGGIS FASA 2 UTAMA TAMAN SERI MANGGIS FASA 2 78000 ALOR GAJAH MELAKA,MELAKA
99 SPEEDMART SDN BHD (TMN TEMERLOH JAYA) - 2119,"NO : 96 & 98 (GROUND FLOOR), JALAN TEMERLOH JAYA, TAMAN TEMERLOH JAYA, 28000 TEMERLOH PAHANG",PAHANG
MEMPAGA FRESH SDN BHD (DAMAK),"MEMPAGA FRESH SDN BHD (DAMAK) 68, LORONG DU 1, TAMAN DAMAK UTAMA 27030 JERANTUT PAHANG",PAHANG
C-MART (SUNGAI PETANI),"NO 1, JALAN JATI KOMPLEKS AMANJAYA 08000 SUNGAI PETANI KEDAH",KEDAH
99 SPEEDMART SDN BHD (TMN KEMUDI) - 3283,"NO: A-2 & A-3 (GROUND FLOOR), FASA 4, TAMAN KEMUDI JALAN KUALA KEDAH 06600 KUALA KEDAH KEDAH",KEDAH
GS MART (HQ),"LOT. 1937, JALAN KUKUP LAUT KUKUP JOHOR DARUL TAKZIM 82300 KUKUP JOHOR",JOHOR
BB SUPERMARKET,"NO, 121-128 (SL13122-13129) FRD & 1ST FLR, CENTRAL CITY PHASE 19, JALAN KUCHING-SAMARAHAN EXPRESSWAY, 94300 KOTA SAMARAHAN 94300 KOTA SAMARAHAN SARAWAK",SARAWAK
ECONMART EXPRESS SDN BHD - KLANG,"NO. 222-224, PERSIARAN PEGAGA, TAMAN BAYU PERDANA, 41200 KLANG SELANGOR",SELANGOR
PASARAYA JIASON (NUSA DAMAI) SDN BHD (BDR PENAWAR),"1-01 TO 10-01, JALAN CENGAL 1, TAMAN DESARU UTAMA, 81930 BANDR PENAWAR JOHOR",JOHOR
99 SPEEDMART SDN BHD (RANAU TOWN) - SBH 24620,"GROUND FLOOR, LOT 6 & 7 RANAU PLAZA 2, JALAN KEMBAR PEKAN PEKAN RANAU 89308 RANAU SABAH",SABAH
GIMART,"NO.4, BERHADAPAN SEK KEB IPOH, GUAL IPOH 17500 TANAH MERAH KELANTAN",KELANTAN
118 FRESHMART (SIMPANG PELANGAI),"NO: 1729, KAMPUNG SEMERTING, SIMPANG PELANGAI 28740 BENTONG PAHANG",PAHANG
ECONSAVE CASH & CARRY (JJ) SDN BHD (JENJAROM),NO. 1 (ECONSAVE) JALAN UTAMA 2 TAMAN SERI JAROMAS 42600 JENJAROM SELANGOR,SELANGOR
THE STORE (IPOH JALAN DATO ONN JAAFAR),JALAN DATO ONN JAAFAR 30300 IPOH PERAK,PERAK
CHUAN AIK CASH & CARRY SDN BHD,"POS 120A , MBP 630/1 PARIT YUSOF PEKAN BARU SUNGAI BALANG 83600 MUAR JOHOR",JOHOR
DMART SEGI PALONG 08,FELDA PALONG 08 73470 GEMAS NEGERI SEMBILAN,NEGERI SEMBILAN
PASAR MINI MUHAMMAD,"NO. 5 & 7, TAMAN ARKED SERI RAMBAI 75250 BUKIT RAMBAI MELAKA",MELAKA
NAM LEONG - CHINA STREET,"NO.29, LOT 102 CHINA STREET NO.29, LOT 102, CHINA STREET, 98000 MIRI, SARAWAK 98000 MIRI SARAWAK",SARAWAK
99 SPEEDMART SDN BHD (TMN NUSA SENTRAL 1) - 2247,"NO 182 & 184 (GROUND FLOOR), JALAN SENTRAL 1 TAMAN NUSA SENTRAL KAMPUNG MASJID LAMA 79100 NUSAJAYA JOHOR",JOHOR
BLIMBEY ENTERPRISE,"LOT 8070,8072B JALAN PASIR MAS KAMPUNG JELATOK 17500 TANAH MERAH KELANTAN",KELANTAN
KEDAI RUNCIT COOPMART,HADAPAN PAJABAT FELCRA KAWASAN PERUPOK KUBOR PANJANG 06760 PENDANG KEDAH,KEDAH
SERVAY EXPRESS SDN BHD - SETN,"C-STORE SETN PARCEL OF THE LAND HELD UNDER CL1651298222 LOCATED 6 KM, JALAN LAGUD TENOM KENINGAU IN THE DISTRICT OF TENOM, 89907 TENOM 89907 TENOM SABAH",SABAH
ML BERKAT SETIA,"KG. PERPADUAN, KUDAT 89050 PULAU BANGGI SABAH",SABAH
99 SPEEDMART SDN BHD (BDR MAHKOTA BANTING) - 2830,"NO: 8-G-92 & 8-G-94 (GROUND FLOOR), JALAN USAHAWAN 2, BANDAR MAHKOTA BANTING, 42700 BANTING SELANGOR",SELANGOR
BATARAS SUPERSTORE KUNAK,"NO. C1, C2, C3, C4, C5, C6, C7, C8 & C9 MAGANTING PLAZA 91100 KUNAK SABAH",SABAH
EVERRISE DEPARTMENTAL STORE (4TH MILE) SDN BHD,"LOT 759, BLOCK 218, KNLD, 4TH MILE, PENRISSEN ROAD 93250 KUCHING SARAWAK",SARAWAK
TUNAS MANJA SDN BHD (BANDAR SERI COALFIELDS),"NO 23-G, 25-G, 27-G JALAN BSC 2C/5, PRECINT 2, BANDAR SERI COALFIELDS 47000 SUNGAI BULOH SELANGOR",SELANGOR
99 SPEEDMART SDN BHD (KAHANG)-2179,"NO: 1 (GROUND FLOOR), JALAN KAHANG MUHIBBAH TAMAN KAHANG MUHIBBAH 86700 KAHANG JOHOR",JOHOR
G-MART SG SDN BHD - KG TULID,"LOT 4, TULID POINT, KAMPUNG TULID, KENINGAU SABAH MEASURING APPROXIMATELY 2000SQ.FT. HELD UNDER NT.133068461 IN THE DISTRICT OF KENINGAU. 89000 KENINGAU SABAH",SABAH
PASARAYA BERKAT YUSRI (TENDONG),LOT 1189 A-D KG. TOK BUAK TENDONG 17030 TENDONG KELANTAN,KELANTAN
PACIFIC HYPERMARKET (KLUANG MALL),"G-88 & 1-88 KLUANG MALL, JALAN RAMBUTAN BANDAR KLUANG 86000 KLUANG JOHOR",JOHOR
MYGROCER (VHE 3147),NO 5 JALAN PTP 1/6 TAMAN PERINDUSTRIAN TASIK PERDANA 47120 PUCHONG SELANGOR,SELANGOR
99 SPEEDMART SDN BHD (KUDAT TOWN 1) - SBH 22419,KEDAI NO. 802 GROUND FLOOR JALAN OKK HAJI ABDUL GHANI 89050 KUDAT SABAH,SABAH
99 SPEEDMART SDN BHD (KG BIAH) - SBH 25220,NT. NO. 135348560 KG. BATU 4 BIAH JALAN NABAWAN 89000 KENINGAU SABAH,SABAH
XING WANG TRADING,"LOT 44, BELURU TOWN DISTRICT, BAKONG, BARAM 98050 MIRI SARAWAK",SARAWAK
99 SPEEDMART SDN BHD (LAVENDER HEIGHTS) - 1583,NO: 145 & 146 JALAN LAVENDER HEIGHTS 3 LAVENDER HEIGHTS BUSINESS SQUARE 70400 SENAWANG NEGERI SEMBILAN,NEGERI SEMBILAN
BILLION SHOPPING CENTRE (TELUK INTAN) SDN BHD - SERI ISKANDAR,"LOT 526, LEBUH SIBC 32610 BANDAR SERI ISKANDAR PERAK",PERAK
TUNAS MANJA SDN BHD (CAW BUKIT KUANG),"PT 7862 LOT 6953 DAN PT 7864 KG. BUKIT KUANG, TELOK KALONG 24000 KEMAMAN TERENGGANU",TERENGGANU
ECONO JAYA TAMAN RIA JAYA,"NO.12 & 13,JALAN KUDA KEPANG 1/1 TAMAN RIA JAYA 08000 SUNGAI PETANI KEDAH",KEDAH
ABANG BAWANG & ADIK KACANG SDN BHD,572 TAMAN KOTA JAYA 34700 SIMPANG PERAK,PERAK
99 SPEEDMART SDN BHD (ANTARA GAPI) - 1625,"NO: 20 & 22, JALAN GAPI 1A/2, PERNIAGAAN ANTARA GAPI, HULU YAM BHARU, 48200 SUNGAI CHIK SELANGOR",SELANGOR
