Store,Address,state
SEGI FRESH AMPANG PERAK,"NO.5-G, 7-G, 9-G & 11-G JALAN PERNIAGAAN AMPANG 4 PUSAT PERNIAGAAN AMPANG 31350 IPOH PERAK",PERAK
99 SPEEDMART SDN BHD (PP KOTA EMAS)-2138,"NO: 6 & 7 (GROUND FLOOR), JALAN EMAS 3 PUSAT PERNIAGAAN KOTA EMAS 82000 PONTIAN JOHOR",JOHOR
99 SPEEDMART SDN BHD (BANDAR KOTA TINGGI) - 2448,NO: 16 & 17 (GROUND FLOOR) JALAN KOTA KECIL 1 BANDAR KOTA TINGG 81900 KOTA TINGGI JOHOR,JOHOR
PASAR MINI CHIN MEE,"NO. 31, JALAN BESAR, PEKAN SEPANG 43900 SEPANG SELANGOR",SELANGOR
PASAR RAYA KANA HARAPAN JAYA TRADING SDN BHD (TMN PULAI UTAMA),"77, JALAN PULAI 44, TAMAN PULAI UTAMA 81300 JOHOR BAHRU JOHOR",JOHOR
B42-PASARAYA SAVE-TAMAN PERTAMA,"NO. 5, LORONG TAMAN 9 TAMAN PERTAMA 30100 IPOH PERAK",PERAK
99 SPEEDMART SDN BHD (KUALA KUBU BHARU) - 1663,NO.47 JALAN MAT KILAU KAMPUNG TUN ABDUL RAZAK 44000 KUALA KUBU BARU SELANGOR,SELANGOR
99 SPEEDMART SDN BHD (BDR PUTERI INDAH ) - 2274,"NO: 3 & 4 (GROUND FLOOR), JALAN PUTERI INDAH 1/3B, BANDAR PUTERI INDAH, TONGKANG PECHAH, 83010 BATU PAHAT JOHOR",JOHOR
SIBU YU CHIONG FOODSTUFFS DISTRIBUTORS SDN BHD,"NO. 14 & 16, JALAN UPPER LANANG, LORONG 29A 96000 SIBU SARAWAK",SARAWAK
TMG MART (BINJAI) SDN BHD,"LOT 61711, 61712, 61713, 63733, 61067, 61068, 61069, 61070, 61071 TAMAN BINJAI SEROJA, KAMPUNG BATU 3 BINJAI JALAN AIR PUTIH 24000 KEMAMAN TERENGGANU",TERENGGANU
99 SPEEDMART SDN BHD (TMN SRI HOSBA) - 3491,"NO: 168 & 169 (GROUND FLOOR), JALAN HOSBA 7 TAMAN SRI HOSBA 06000 JITRA KEDAH",KEDAH
BATARAS FRESH MART DAMAI,"NO.3, LOT 3, GROUND FLOOR, LORONG KENAWAI 6A, TAMAN SINAR BARU JALAN DAMAI, LIKAS 88300 KOTA KINABALU SABAH",SABAH
NUR IHSAN TRADING,"LOT 2 & 4, BLOK B, BANGUNAN SEDCO PEKAN TELUPID 89320 TELUPID SABAH",SABAH
GIANT MINI (JALAN SUTERA CHERAS),"NO 5-G GROUND FLOOR JLN SUTERA 1, TAMAN SUTERA RESIDENCES 43200 CHERAS SELANGOR",SELANGOR
ISHAH BINTONG (ABI),"LOT 2756, A & B BATU 1/2, JALAN ABI TOK HASHIM, DATARAN GENTING, BEHOR EMPIANG, 01000 KANGAR, PERLIS 01000 KANGAR PERLIS",PERLIS
ECONSAVE CASH & CARRY (BA) SDN BHD (BATANG KALI),"NO 1 LOT PT 6903, JALAN MAHAGONI 8, BANDAR UTAMA BATANG KALI, 44300 BATANG KALI SELANGOR",SELANGOR
99 SPEEDMART SDN BHD (KAMPUNG KULAMBAI) - SBH 26521,NT. NO 033105467 KAMPUNG KULAMBAI JALAN KUALA ABAI 89150 KOTA BELUD SABAH,SABAH
99 SPEEDMART SDN BHD (TMN MEWAH) - 2294,"NO: 32 & 32A (GROUND FLOOR), JALAN MEWAH 1, TAMAN MEWAH, 28050 KUALA KRAU PAHANG",PAHANG
TRELEAF MART (CHENDERING),"PT 2025K, PT 2026K & PT 2027K, KAW. PERUMAHAN CENDERING, KUALA IBAI 20400 KUALA TERENGGANU TERENGGANU",TERENGGANU
PAKA MART,"LOT 4299, JALAN KERISI KAMPUNG CACAR LAUT 23100 PAKA TERENGGANU",TERENGGANU
99 SPEEDMART SDN BHD (TMN SETIA JASA) - 2224,"NO: 15 & 17 (GROUND FLOOR), JALAN SJ 1 OFF JALAN MARAN, TAMAN SETIA JASA, 28000 TEMERLOH PAHANG",PAHANG
ECONPOINT SDN BHD(DAMANSARA PERDANA),"NO. 47, 49, 51, 53 & 55 JALAN KG. BARU, TAMAN SRI TENGAH 86000 KLUANG JOHOR",JOHOR
COOP MART (KOPERASI CHABAU BERHAD),T 339/340 KM 43 PEKAN SEMPANG BEKOH 77100 ASAHAN MELAKA,MELAKA
KAK WOOK MINI MARKET - SETIU,27 JALAN PASAR FELDA CHALOK BARAT 21450 PERMAISURI TERENGGANU,TERENGGANU
EVERBEST CENTRAL ENTERPRISE,"GROUND FLOOR, LOT 2439-2440, BLOCK 71, KCLD (S/L 12-13), 238-237, PEKAN BATU 10 (KOTA PADAWAN) JALAN KOTA PADAWAN, LORONG KOTA PADAWAN 10B1A2 93250 KOTA PADAWAN SARAWAK",SARAWAK
TUNAS MANJA SUPERMARKET (SUNGAI ISAP) SDN BHD,"A35 – A47, PUSAT KOMERSIAL BATU 3, JALAN SUNGAI ISAP 25150 KUANTAN PAHANG",PAHANG
SEN SEN DEPARTMENTAL STORE (MUARA TUANG),SUBLOT NO 9-16 BLOCK 26 MUARA TUANG LAND DISTRICT JALAN DATUK MOHD MUSA 94300 JALAN DATUK MOHD MUSA SARAWAK,SARAWAK
SHARJAH MARKETING SDN BHD,"KG. NANGOH, JALAN SAPI- NANGOH 90100 BELURAN SABAH",SABAH
KK SUPER MART (TAMAN SENTOSA),"NO.33, JALAN SUTERA, TAMAN SENTOSA 80150 JOHOR BAHRU JOHOR",JOHOR
99 SPEEDMART SDN BHD (TAMAN MERDEKA PERMAI) - 2339,"NO: 63 & 65 (GROUND FLOOR) JALAN MP 19 TAMAN MERDEKA PERMAI, BATU BERENDAM 75350 HANG TUAH JAYA MELAKA",MELAKA
DARUL MALAYAN GROUP SDN BHD (MOBILE TRUCK),"31, JALAN PENDAMAR 27/90, SEKSYEN 27 40400 SHAH ALAM SELANGOR",SELANGOR
HAHSHINI TRADING,"NO. 9 JALAN TAMAN KAMUNTING, BANDAR KAMUNTING 34600 KAMUNTING PERAK",PERAK
CP 91 TRADING (KEDAI RUNCIT CP 91 TRADING),NO. 19. 19A JALAN TITI SERONG JALAN ATAS 34250 TANJUNG PIANDANG PERAK,PERAK
SERVAY EXPRESS - SEMHL,"NOT 47 & 48, TAMAN OKK HJ MAHALI 89600 PAPAR SABAH",SABAH
LOTUSS (KAMPAR),LOTUSS KAMPAR JALAN KAMPAR TAMAN KAMPAR PERDANA 31900 KAMPAR PERAK,PERAK
99 SPEEDMART SDN BHD (BEAUFORT SENTRAL) - SBH 32523,LOT NO. 119 & 120 (TYPE B) GROUND FLOOR BEAUFORT SENTRAL JALAN BEAUFORT SENTRAL 1 89800 BEAUFORT SABAH,SABAH
E-SUN MART SDN BHD (SIBU),"LOT 3205, S/L 7, NO. 2 GROUND FLOOR LORONG TUN AHMAD ZAIDI ADRUCE 66A 96000 SIBU SARAWAK",SARAWAK
99 SPEEDMART SDN BHD (BDR TASIK KESUMA) - 1280,"NO: 20, JALAN KESUMA 3/3, BANDAR TASIK KESUMA, 43700 BERANANG SELANGOR",SELANGOR
PASARAYA KINI SDN BHD (MERSING BRANCH),NO 21-29 JALAN JETI BANDAR TEPIAN SUNGAI 86800 MERSING JOHOR,JOHOR
TUNAS MANJA SUPERMARKET SDN BHD (MUKIM BEBAR),"LOT PT 232, MUKIM BEBAR 26700 MUADZAM SHAH PAHANG",PAHANG
PANTAI TIMOR HYPERMARKET SDN BHD - TAMAN BENDAHARA,"LOT PT 1114, PT 1115 & PT 1242 SEKSYEN 36, TAMAN BENDAHARA, JALAN PENGKALAN CHEPA 16100 KOTA BHARU KELANTAN",KELANTAN
ND MAJU 188 ENTERPRISE,NO. 188 JALAN NURI FELDA PENGGELI TIMUR 81440 TENGGARA JOHOR,JOHOR
PASARAYA BS (PJ) SDN BHD CAW. KUALA LIPIS,"NO. 37, 38, 39, 40, 41, 42, 43, 43A, 45 & 46, TINGKAT BAWAH, JALAN PPBR 3/4, PUSAT PERDAGANGAN BUKIT RESIDEN, 27200 KUALA LIPIS PAHANG",PAHANG
KOPERASI ORANG MELAYU KERAJAAN (SKOMK) - PASARAYA I-KEEP,"PASARAYA I-KEEP NO. 2 & 4, BANGUNAN SKOMK JALAN MAHKOTA 36000 TELUK INTAN PERAK",PERAK
FRESH HUB (SEGAMAT BARU),"NO 47 ,49 JALAN PUTRA 2/23 BANDAR PUTRA 85000 SEGAMAT JOHOR",JOHOR
LOTUSS (BAHAU),"PT 4109, SEBAHAGIAN LOT 12676, GERAN 215917 LOT LAME LOT 177, GM75418, MUKIM ROMPIN DAERAH JEMPOL 72100 BAHAU NEGERI SEMBILAN",NEGERI SEMBILAN
Q MART (SURAU PANJANG),"LOT 1577-F, RUMAH KEDAI, KG. SURAU PANJANG 21070 KUALA TERENGGANU TERENGGANU",TERENGGANU
99 SPEEDMART SDN BHD (PARIT JAWA 1) - 1851,"NO: 1A & 2A (GROUND FLOOR) TAMAN PELANGI 2, JALAN PELANGI 1 JALAN ABDUL JABBAR, BANDAR PARIT JAWA 84150 MUAR JOHOR",JOHOR
HOE SOON MINI MARKET,HOE SOON MINI MARKET NO.1 & 1A JALAN SRI FAJAR 1 TAMAN SRI FAJAR 83000 BATU PAHAT JOHOR,JOHOR
G-MART SG SDN. BHD. - PLAZA TENOM,"LOT NO. 43 & 44, ORCHARD PLAZA, TENOM SABAH HELD UNDER TITTLE COUNTRY LEASE NO. 0165319737 AND 0165319728 89900 TENOM SABAH",SABAH
D'SAVE,LOT 558 GROUND FLOOR JALAN SUNGAI SELOATING 98450 LAWAS SARAWAK,SARAWAK
BORONG DIN AS CASH & CARRY SDN. BHD. (KOMPLEKS PERNIAGAAN ALOR JANGGUS),"NO 19, 20, 21, 22 & 23 KOMPLEKS PERNIAGAAN ALOR JANGGUS 06250 ALOR SETAR KEDAH",KEDAH
INDARA ENTERPRISE (PASARAYA INDARA),LOT 1216 JALAN TUPAI 34000 TAIPING PERAK,PERAK
MDS MART (JEPAK) SDN BHD - 2,"LOT 6013-6016, BLOCK 31, KAMPUNG JEPAK 97000 BINTULU SARAWAK",SARAWAK
DMART SEGI BUKIT GOH,FELDA BUKIT GOH 26050 KUANTAN PAHANG,PAHANG
PASARAYA WELL-MART KP2,NO. 33 & 35 JALAN PUSAT KEPONG 9/40 TAMAN PUSAT KEPONG 53000 KEPONG SELANGOR,SELANGOR
ECONSAVE CASH & CARRY (TD) SDN BHD (TAMAN DAYA),"LOT PTD 124006 JALAN NIPAH, TAMAN DAYA 81100 JOHOR BAHRU JOHOR",JOHOR
99 SPEEDMART SDN BHD (PUSAT PERNIAGAAN BAHAU) - 1547,"NO:42 & 43, JALAN MAWAR 1, PUSAT PERNIAGAAN BAHAU APARTMENT TAMAN MEDAN JAYA KAMPUNG MASJID LAMA 72100 BAHAU NEGERI SEMBILAN",NEGERI SEMBILAN
AD MOHD SUPERUNCIT,PT 781 KG MANOK MULONG 16010 KOTA BAHRU KELANTAN,KELANTAN
99 SPEEDMART SDN BHD (TAMAN HARMONI GERISEK) - 2044,"NO: 1 (GROUND FLOOR) JALAN HARMONI 1 TAMAN HARMONI , GERISEK 84700 MUAR JOHOR",JOHOR
99 SPEEDMART SDN BHD (PATIKANG POINT) - SBH 31123,"LOT 1 & 2, PATIKANG POINT KAMPUNG PATIKANG ULU NT 133130702 89008 KENINGAU SABAH",SABAH
KHJ FRESH MARKET SDN BHD (TMN DESA RAKYAT PERDANA),"1,3 & 5, JALAN DESA RAKYAT 2, TMN DESA RAKYAT PERDANA 81750 PASIR GUDANG JOHOR",JOHOR
DMART SEGI SELANCAR 01,FELDA SELANCAR 01 26700 MUADZAM SHAH PAHANG,PAHANG
99 SPEEDMART SDN BHD (D'SARA SENTRAL) - 2331,"NO: R-G-28 & R-G-29 (GROUND FLOOR), D’SARA SENTRAL, JALAN WELFARE, KAMPUNG BARU SUNGAI BULOH, SEKSYEN U19, 40160 SHAH ALAM SELANGOR",SELANGOR
EMART (BATU KAWA) SDN BHD - KC,"GROUND FLOOR, SURVEY LOT 11211 OF PARENT LOT 10816 SECTION 64 KUCHING TOWN LAND DISTRICT 93350 KUCHING SARAWAK",SARAWAK
KK SUPER MART (ANGGERIK DESA TANJONG MALIM),"NO.12, JALAN CAHAYA, TAMAN ANGGERIK DESA 35900 TANJONG MALIM PERAK",PERAK
GIANT MINI (DENAI ALAM),NO 55G JALAN ELEKTRON U16/D DENAI ALAM 40150 SHAH ALAM SELANGOR,SELANGOR
99 SPEEDMART SDN BHD (TMN SEJATI INDAH)-2563,NO: C-97 & C-98 (GROUND FLOOR) JALAN INDAH 2 TAMAN SEJATI INDAH 08000 SUNGAI PETANI KEDAH,KEDAH
ECO-SHOP SIMPANG EMPAT,"NO. B-3, B-4, B-5 (GRD, 1ST & 2ND FLR), NO. B-6, B-7 & B-8 (1ST FLR), SUSURAN LADA 1, TAMAN SIMPANG PERDANA, 06650 SIMPANG EMPAT, KEDAH. 06650 SIMPANG EMPAT KEDAH",KEDAH
"FAIR PRICE (KG DATU,SIBU)","48, JALAN KAMPUNG DATU KAMPUNG DATU 96000 SIBU SARAWAK",SARAWAK
KANA HARAPAN JAYA TRADING SDN BHD (TMN PASIR PUTIH),"73 & 75, JALAN ASLI 17, TAMAN PASIR PUTIH 81700 PASIR GUDANG JOHOR",JOHOR
NIRWANA MAJU (KUALA BERANG) SDN BHD,"LOT 3172, JALAN BESAR 21700 KUALA BERANG TERENGGANU",TERENGGANU
99 SPEEDMART SDN BHD (JEMALUANG) - 2242,NO 6156 & 6157 (GROUND FLOOR) JALAN MERSING JEMALUANG 86810 JEMALUANG JOHOR,JOHOR
TMG EXPRESS 3000 SDN BHD (TIMURBAY),"TR2-TR3, TIMURBAY GROUND FLOOR OF THE PODIUM BLOCK JALAN KUANTAN-KEMAMAN, MUKIM SG KARANG BALOK 26100 KUANTAN PAHANG",PAHANG
99 SPEEDMART SDN BHD (KG NAMBAYAN) - SBH 24320,NT NO. 145310908 KAMPUNG NAMBAYAN JALAN KENINGAU-TAMBUNAN 89650 TAMBUNAN SABAH,SABAH
ECO-SHOP SLIM RIVER,"NO.26, JALAN PERDANA 6 PUSAT PERNIAGAAN SLIM PERDANA 35800 SLIM RIVER PERAK",PERAK
B16-PASARAYA SAVE-TAMAN CEMPAKA,"45 & 47, REGAT SRI CEMPAKA TAMAN CEMPAKA 31400 IPOH PERAK",PERAK
HERO MARKET - KAMPUNG BARU PUCHONG,LOT 33946 BANDAR PUCHONG UTAMA PUCHONG 47100 PUCHONG SELANGOR,SELANGOR
99 SPEEDMART SDN BHD (TAMAN SERI CHIN CHIN) - 3023,NO : JB 7320 & JB 7321 (GROUND FLOOR) JALAN SERI CHIN CHIN UTAMA TAMAN SERI CHIN CHIN 77000 JASIN MELAKA,MELAKA
SK MART MINI MARKET,"PT 953-954, JALAN MAK SARA TAMAN D'JAYA 22000 JERTEH TERENGGANU",TERENGGANU
FRESH HUB PEKAN RENGIT,"NO 16 & 16A, NO 18 & 18A, JALAN MADU PEKAN RENGIT 83100 RENGIT JOHOR",JOHOR
ECO-SHOP ALOR SETAR 2,"LOT 535-A, JALAN TELUK WANJAH, 05200 ALOR SETAR, KEDAH 05200 ALOR SETAR KEDAH",KEDAH
22 MART SDN. BHD. (LENGGENG),"MO.29,30 & 31-G, JALAN TASIK SENANGIN 15/3, PUSAT PERNIAGAAN SEKSYEN 15, BANDAR TASIK SENANGIN, 71750 LENGGENG NEGERI SEMBILAN",NEGERI SEMBILAN
BESTAMART SUPERMARKET - ORCHARD PLAZA,"SUPERMARKET LOT, ORCHARD PLAZA W.D.T NO 142 89908 TENOM SABAH",SABAH
JUMBO GROCER (APOLLO),"NO. 93, 95, 97, 99, 111, 113 & 115, JALAN DESHON 96000 SIBU SARAWAK",SARAWAK
SETIA JAYA MINI MARKET,"F-G-5, F-G-8, VALE OF TEMPE TAMAN SRI SETIA TANJUNG BUNGAH 11200 GEORGETOWN PENANG",PENANG
KK SUPER MART (TAMAN BANDAR BARU KAMPAR),"NO.10, JALAN BATU KARANG, TAMAN BANDAR BARU 31900 KAMPAR PERAK",PERAK
GT MART KEN RIMBA,"NO. D-60(1) JALAN LENGKUAS D16/D, KEN RIMBA SEKSYEN 16 40200 SHAH ALAM SELANGOR",SELANGOR
C-MART (ALOR SETAR),LOT 92 JALAN ISTANA KUNING 05000 ALOR SETAR KEDAH,KEDAH
HWA THAI SUPERMARKET (KIP MALL KOTA TINGGI),JLN TUN SRI LANANG TAMAN MAWAI JAYA 81900 KOTA TINGGI JOHOR,JOHOR
CHOP GUAN SENG (GS MART KUKUP),LOT 1937 JALAN KUKUP LAUT KUKUP 82300 PONTIAN JOHOR,JOHOR
KK SUPER MART (BENUT PONTIAN),"NO.21, JALAN MUTIARA 4, PUSAT PERNIAGAAN BENUT, BENUT 82200 PONTIAN JOHOR",JOHOR
KK SUPER MART (BANDAR ENSTEK),"NO.41, JALAN TIMUR 6/1A, TIMUR @ ENSTEK 71700 BANDAR ENSTEK NEGERI SEMBILAN",NEGERI SEMBILAN
99 SPEEDMART SDN BHD (KG BARU MASAI) - 2954,"NO: 1 & 3 (GROUND FLOOR), JALAN JAGUNG KAMPUNG BARU MASAI KAMPUNG MASJID LAMA 81750 MASAI JOHOR",JOHOR
SUGO VILLAGE (TANJUNG BUNGAH),"NO 76-B, JALAN LEMBAH PERMAI, 11200 TANJUNG BUNGAH, PULAU PINANG 11200 TANJUNG BUNGAH PENANG",PENANG
99 SPEEDMART SDN BHD (SG JERIK) - 2680,"NO: 1 & 2 (GROUND FLOOR), LORONG SJ 3, BANDAR BARU SUNGAI JERIK, 27080 SUNGAI JERIK PAHANG",PAHANG
PASARAYA WELL-MART PC3 HQ,"NO. 1, JALAN PUTRA PERDANA 2/2 TAMAN PUTRA PERDANA 47130 PUCHONG SELANGOR",SELANGOR
99 SPEEDMART SDN BHD (BKT PINANG) - 3350,"NO: 251-D (GROUND FLOOR), BANGUNAN EE SENG, BUKIT PINANG TAMAN TENGKU MAHERAN, BANDAR DARULAMAN 06200 KEPALA BATAS KEDAH",KEDAH
MYDIN SUPERMARKET BUKIT JELUTONG,"NO. 2,4,6 & 8, TINGKAT G & TINGKAT 1 JALAN PELAPIK C U8/C, BUKIT JELUTONG, SEKSYEN U8 40150 SHAH ALAM SELANGOR",SELANGOR
PASAR MINI SRI MEENAS,"29-A & 31-A JALAN MERU SETIA 1 TAMAN SRI SAUJANA,MERU 41050 KLANG SELANGOR",SELANGOR
HERO SAVE MART - BANDAR ENSTEK,"NO. 97, 98, 99 & 100 JALAN TIMUR 6/1C TIMUR @ ENSTEK 71760 SEREMBAN NEGERI SEMBILAN",NEGERI SEMBILAN
PASARAYA JAYA GADING (SEMAMBU),LOT 54 KAWASAN PERINDUSTRIAN SEMAMBU 25300 KUANTAN PAHANG,PAHANG
99 SPEEDMART SDN BHD (NS CORAL WALK) - 1569,"NO: 6&7, JALAN CORAL 1 JALAN PANTAI MEDAN CORAL 71050 TELUK KEMANG NEGERI SEMBILAN",NEGERI SEMBILAN
ECO-SHOP PARIT BUNTAR 2,"NO. 9 (GRD & 1ST FLR MEDAN HENTIAN, PUSAT BANDAR BARU, 34200 PARIT BUNTAR PERAK",PERAK
ECONSAVE CASH & CARRY (KM) SDN BHD (PASIR GUDANG),"NO 2, JALAN RUSA, TAMAN SCIENTEX, 81700 PASIR GUDANG JOHOR",JOHOR
SEGI FRESH SAUJANA UTAMA,"16-G, 18-G, 20-G, 22-G, 24-G JALAN BIDARA 9/2 SAUJANA UTAMA 3 47000 SUNGAI BULOH SELANGOR",SELANGOR
99 SPEEDMART SDN BHD (TAMAN PERINDUSTRIAN PEKAN NENAS) - 2916,NO: 75 & 77 (GROUND FLOOR) JALAN INDUSTRI 8 TAMAN PERINDUSTRIAN PEKAN NENAS 81500 PEKAN NENAS JOHOR,JOHOR
GT MART KLANG UTAMA 2,"NO. 18, LORONG SUNGAI KERAMAT 19 TAMAN KLANG UTAMA 42100 KLANG SELANGOR",SELANGOR
HERO SAVE MART - TAMAN SRI SUBANG,NO. 7 & 9 & NO. 13 JALAN PJS 10/32 TAMAN SRI SUBANG PETALING JAYA 46000 PETALING JAYA SELANGOR,SELANGOR
SERVAY EVERGREEN SDN BHD - SJKT,"LORONG2, BUKIT GARAM POINT 90200 KINABATANGAN SABAH",SABAH
BATARAS HYPERMARKET PUTATAN,"MILE 7, JALAN PUTATAN COMMERCIAL CENTRE PUTATAN 88200 KOTA KINABALU SABAH",SABAH
THE STORE (JB-TAMAN JOHOR JAYA),"135, 135A, JALAN DEDAP 4, TAMAN JOHOR JAYA 81100 JOHOR BHARU JOHOR",JOHOR
G-MART SG SDN BHD - BUKIT GARAM,"LOT 1,2&3 GROUND FLOOR, BUKIT GARAM COMMERCIAL BUILDING BUKIT GARAM POINT 90200 KINABATANGAN SABAH",SABAH
99 SPEEDMART SDN BHD (TMN KULAI BESAR) - 2540,"NO :30 & 32 (GROUND FLOOR), JALAN RAYA TAMAN KULAI BESAR KAMPUNG MASJID LAMA 81000 KULAI JOHOR",JOHOR
BATARAS FRESH MART GANANG,JALAN KEPAYAN HIGHWAY KG.GANANG 88300 KOTA KINABALU SABAH,SABAH
THE FRESHMART - BINTULU,"SUBLOT 33-37, JALAN TG. KIDURONG COLUMBIA COMMERCIAL CENTRE 97000 BINTULU SARAWAK",SARAWAK
CKS RETAIL SDN.BHD.,LOT 3311 JALAN BESI UTAMA JALAN AIR HITAM BATU 24 81000 KULAI JOHOR,JOHOR
LONGWAN - SERI ISKANDAR,"NO.36-46,JALAN LESTRARI 1, TAMAN LETARI IUS,32610 SERI ISKANDAR,PERAK 32610 SERI ISKANDAR PERAK",PERAK
H&L RETAIL SDN BHD (SEMARIANG),"LOT 3243 - 3247, BLK A, SULTAN TGH BANDAR BARU SEMARIANG 93250 KUCHING SARAWAK",SARAWAK
PASARAYA WELL-MART KP8,"NO. 2, PERSIARAN KIP2 TAMAN WANGSA PERMAI 52200 KUALA LUMPUR SELANGOR",SELANGOR
DMART SEGI BUKIT KUANTAN,"FELDA BUKIT KUANTAN, BUKIT KUANTAN 26140 KUANTAN PAHANG",PAHANG
99 SPEEDMART SDN BHD (TMN SRI AMAN) - 1728,"MT 1947 & 1948, JALAN SRI AMAN 5 TAMAN SRI AMAN 78300 PAYA RUMPUT MELAKA",MELAKA
99 SPEEDMART SDN BHD (TMN BUKIT JAYA ) - 3582,"NO: 1 (GROUND FLOOR), JALAN DENAI 2, TAMAN BUKIT JAYA, 81800 ULU TIRAM JOHOR",JOHOR
TUNAS MANJA SDN BHD (BATU HITAM),"A1-A21, LORONG SUNGAI KARANG DARAT 46 PERKAMPUNGAN SUNGAI KARANG DAMAI, JALAN KUANTAN-KEMAMAN 26100 KUANTAN PAHANG",PAHANG
MYDIN WHOLESALE EMPORIUM RANTAU PANJANG,PT 333-339 KOMPLEKS PERKEDAIAN BARU 17200 RANTAU PANJANG KELANTAN,KELANTAN
99 SPEEDMART SDN BHD (TAMAN MUDA) - 1180,NO.4 & 6 JALAN BUNGA TANJONG 8A TAMAN MUDA 56100 KUALA LUMPUR SELANGOR,SELANGOR
99 SPEEDMART SDN BHD (PIINGGIRAN DELIMA) - 1587,"NO: 7 & 8. JALAN PINGGIRAN DELIMA 2/5, TMN PINGGIRAN DELIMA, BATU 14, 43100 HULU LANGAT SELANGOR",SELANGOR
LEPAPA SUPERMARKET AIMAN,"LOTS 1094,2298,2299,2302 & 16716,(LOT 1641) BLOCK MUARA TUANG L.D,JALAN DATUK MOHAMMAD MUSA,94300 KOTA SAMARAHAN. 94300 KOTA SAMARAHAN SARAWAK",SARAWAK
OCO MART (WAKAF TAPAI),PT14660-14664 TAMAN TAPAI INDAH WAKAF TAPAI 21040 MARANG TERENGGANU,TERENGGANU
99 SPEEDMART SDN BHD (BDR PUTERI JAYA 1)-2941,NO: 201 & 202 (GROUND FLOOR) JALAN BANDAR PUTERI JAYA 1/2 BANDAR PUTERI JAYA 08000 SUNGAI PETANI KEDAH,KEDAH
BIG A MINI MARKET,"6-G, 9-G, 10-G JALAN BAGAN JERMAL 12300 BUTTERWORTH PENANG",PENANG
G-MART BORNEO RETAIL SDN BHD - PITAS,"G*MART-PITAS, LOT 4 & 5, KAMPUNG TAKA 89100 PITAS SABAH",SABAH
MYDIN HYPERMARKET TAMAN SAGA,"NO. 888, JALAN MENGKUDU, KG ALOR MENGKUDU, 05400 ALOR SETAR KEDAH",KEDAH
TF VALUE-MART SDN BHD (BERA),NO.2 JALAN SENTRAL TRIANG 8 SENTRAL TRIANG 28300 TRIANG PAHANG,PAHANG
PCK FRESH MART - HUTAN MELINTANG,"NO. 1, LORONG 1 TAMAN MESRA, JALAN BAGAN DATOH 36400 HUTAN MELINTANG PERAK",PERAK
99 SPEEDMART SDN BHD (TAMAN IKS REMBIA HUB) - 1897,NO : RM 20-1 & RM 21-1 (GROUND FLOOR) JALAN REMBIA HUB UTAMA TAMAN IKS REMBIA HUB 78000 ALOR GAJAH MELAKA,MELAKA
TUNAS MANJA SDN BHD (PERAMU PEKAN),"NO. 9-23, GROUND FLOOR, SHAHZAN PUTERI GALLERIA PERAMU JAYA INDUSTRIES AREA 26607 PEKAN PAHANG",PAHANG
99 SPEEDMART SDN BHD (TMN DEBUNGA) - 2842,"NO: JB 2868 & JB 2869 (GROUND FLOOR) JALAN DEBUNGA 1, TAMAN DEBUNGA 77300 MERLIMAU MELAKA",MELAKA
99 SPEEDMART SDN BHD (TMN SERULING)-2832,NO: 18 & 19 (GROUND FLOOR) JALAN SERULING 1-A TAMAN SERULING 08000 SUNGAI PETANI KEDAH,KEDAH
LONGWAN - TAIPING,"NO.7-21, SUSUR SIMPANG,34700 SIMPANG,34700 TAIPING,PERAK 34700 TAIPING PERAK",PERAK
99 SPEEDMART SDN BHD (DURIAN TUNGGAL) - 1630,"DT 972, JALAN DURIAN TUNGGAL PEKAN DURIAN TUNGGAL 76100 DURIAN TUNGGAL MELAKA",MELAKA
ECONSAVE CASH & CARRY (SN) SDN BHD (SENAI),"274-1, JALAN UTAMA TAMAN BINTANG UTAMA 81400 SENAI JOHOR",JOHOR
ALI HYPER MARKET,"97A, 97B, 97C, KAMPUNG PADANG MIDIN 20050 KUALA TERENGGANU TERENGGANU",TERENGGANU
JAYA MART,"NO,6 FELDA KEMAHANG 1 JALAN PEGAWAI 17500 TANAH MERAH KELANTAN",KELANTAN
PUBLIC COLDSTORAGE,"LOT 47, BLOCK 26 PUNAN LAND DISTIRCT 96900 BELAGA SARAWAK",SARAWAK
PANTAI SELAMAT (FIKRI) FRESHCHOICE SDN BHD,"PT13818, JALAN JAKAR KAWASAN INDUSTRIAN JAKAR 3, 24000 CUKAI TERENGGANU",TERENGGANU
WLS ENTERPRISE SDN BHD - ML,"LOT 1771, LOT 1772, LOT 1773 16400 KOTA BAHRU KELANTAN",KELANTAN
GIANT HYPERMARKET GHBB (BAYAN BARU),"NO 78, JALAN TENGAH, BAYAN BARU 11900 BAYAN LEPAS PENANG",PENANG
MASLEE EXPRESS SDN BHD (PUTERI COVE (EPC)),"LOT GF-01, 02, 03, 04, 05, 06 & 07, RESIDENSI TELUK PUTERI, PERSIARAN TANJUNG, 79000 ISKANDAR PUTERI, JOHOR 79000 ISKANDAR PUTERI JOHOR",JOHOR
PASARAYA MEGA (GEMENCHEH),"PASARAYA MEGA GEMENCHEH LOT 7048,7049,7050,7051 TAMAN GEMENCHEH BARU, JALAN BATANG MELAKA 73200 GEMENCHEH NEGERI SEMBILAN",NEGERI SEMBILAN
SB MINI MART,KG. SUNGAI BATU DABONG 18200 DABONG KELANTAN,KELANTAN
FRESH N CONVENIENT RETAIL SDN BHD (REMBAU),"PASARAYA-FRESCO NO.36-39, JLN TAMPIN-SEREMBAN 71300 REMBAU NEGERI SEMBILAN",NEGERI SEMBILAN
WLS ENTERPRISE SDN BHD - KB,"PT 72A-75A, TINGKAT BAWAH, JALAN ATAS BANGGOL 15300 KOTA BAHRU KELANTAN",KELANTAN
PASARAYA AURA ALAM ENTERPRISE,"LOT 6782, KAMPUNG TOK DIR 21070 KUALA TERENGGANU TERENGGANU",TERENGGANU
WLS ENTERPRISE SDN BHD - TPT,"LOT 23, NO 1,2,3, BANDAR TUMPAT, JALAN HILIR PASAR 16200 TUMPAT KELANTAN",KELANTAN
SUPER SEVEN (M) SDN BHD (CHERAS JAYA),"LOT 10, JALAN CJ 3, KAWASAN PERUSAHAAN CHERAS JAYA 43200 CHERAS SELANGOR",SELANGOR
96 GROCER,"NO. 1, TAMAN SRI NAKHODA PEKAN SIMPANG 4 BNO 45200 SABAK BERNAM SELANGOR",SELANGOR
PASARAYA HOME U (PALEKBANG),"PT994, 995, 996 & 997 KAMPUNG KEPULAU 16040 PALEKBANG KELANTAN",KELANTAN
ECONSAVE CASH & CARRY (KH) SDN BHD (K. PILAH),PT 9 KOMPLEKS WIRA JAYA JALAN MELANG 72000 KUALA PILAH NEGERI SEMBILAN,NEGERI SEMBILAN
99 SPEEDMART SDN BHD (TMN SRI NAGA) - 3331,"NO:  6 & 7 (GROUND FLOOR), JALAN NAGA INTAN 1 TAMAN SRI NAGA 06200 KEPALA BATAS KEDAH",KEDAH
ECONMART SUPERMARKET (SUNGAI BERTIH) SDN BHD,"NO.213-221, JALAN SG BERTIH, TAMAN EMAS, 41100 KLANG SELANGOR",SELANGOR
MYGROCER (VHE 3162),NO 5 JALAN PTP 1/6 TAMAN PERINDUSTRIAN TASIK PERDANA 47120 PUCHONG SELANGOR,SELANGOR
SUPER GMART MINI MARKET,"8-A, KAMPUNG BARU 02100 PADANG BESAR PERLIS",PERLIS
WLS ENTERPRISE SDN BHD - KL,"PT 1721,TAMAN ARIF, 16450 KOK LANAS KELANTAN. 16450 KOK LANAS KELANTAN",KELANTAN
TARGET SUPERMARKET SDN BHD (BENUT),"12 - 17, JALAN MUTIARA 4, PUSAT PERNIAGAAN BENUT, BENUT 82200 PONTIAN JOHOR",JOHOR
99 SPEEDMART SDN BHD (PLAZA 22) - SBH 28022,"GROUND FLOOR, LOT 38 & LOT 39 BLOCK G, PLAZA 22 JALAN PENGALAT-LOK KAWI 89600 PAPAR SABAH",SABAH
LOTUSS (MUTIARA DAMANSARA),"NO. 8, JALAN PJU 7/4 MUTIARA DAMANSARA 3.1594977221091174, 101.61321105285548 47800 PETALING JAYA SELANGOR",SELANGOR
PASAR MINI DA AI,"NO. 1536 & 1537, RUMAH KEDAI, JALAN BETONG, 33100 PENGKALAN HULU PERAK",PERAK
MASLEE EXPRESS SDN BHD (PASIR GUDANG (EPG)),"NO. 1-1A - 12-12A, JALAN PERSIARAN CENDANA, TAMAN CENDANA, 81700 PASIR GUDANG, JOHOR 81700 PASIR GUDANG JOHOR",JOHOR
NAM LEONG - BEKENU,"LOT 125, BLOCK 10 SIBUTI LAND DISTRICT 98150 MIRI SARAWAK",SARAWAK
99 SPEEDMART SDN BHD (BEAUFORT SQUARE) - SBH 34124,"GROUND FLOOR, UNIT NO. F-043-0 & F-044-0 BLOCK F, BEAUFORT SQUARE AVENUE 3 JALAN BINUNUK 89800 BEAUFORT SABAH",SABAH
USAHA PINTAS TRADING,"LOT 6-A, PEKAN PARIT PANJANG, 09120 BALING, KEDAH 09120 BALING KEDAH",KEDAH
SERVAY EVERGREEN SDN BHD - SJB,"LOT 56-65, BLOCK J, 1BEAUFORT COMMERCIAL CENTRE 89808 BEAUFORT SABAH",SABAH
MAO FATT FATT,"SUBLOT 11, ASAJAYA NEW TOWNSHIP, PHASE 3, 94600 ASAJAYA 94600 ASAJAYA SARAWAK",SARAWAK
99 SPEEDMART SDN BHD (PUTRAJAYA PRECINT 11) - 1593,"NO: 6 & 7, JALAN JATI BUKIT P11/25, PRECINT 11, 62250 PUTRAJAYA SELANGOR",SELANGOR
SYARIKAT YEN'S TRADING,"LOT 5127, GROUND FLOOR, BANDAR BARU PERMJAYA SHOPHOUSE, 98000 MIRI 98000 MIRI SARAWAK",SARAWAK
TL MART SDN BHD (K.B),"LOT 2135, NO. 6 - 8, JALAN BACHOK, KG KEDAI BARU 16150 KOTA BAHRU KELANTAN",KELANTAN
NAM LEONG - PERMYJAYA,LOT 5965-5971 JALAN DESA INDAH 3 BANDAR BARU PERMYJAYA 98000 MIRI SARAWAK,SARAWAK
ST ROSYAM MART SDN BHD (SENAWANG),"LOT A7 & A8, KIPMALL SENAWANG NO 1, JALAN KLS 1 LAVENDER HEIGHTS 70450 SEREMBAN NEGERI SEMBILAN",NEGERI SEMBILAN
ECONSAVE CASH & CARRY (JM) SDN BHD (JERAM),"NO 1, 3, 5, 7, 9 & 11 JALAN DATO TAN TENG KUAY 2 SUNGAI BULOH 45800 JERAM SELANGOR",SELANGOR
LOTUSS (TELUK INTAN),"PT 5017 RAPID MALL SERI INTAN ,JALAN CHANGKAT JONG 36000 TELUK INTAN PERAK",PERAK
99 SPEEDMART SDN BHD (TAMAN LELAYANG) - 1903,NO : PT4 & PT5 (GROUND FLOOR) TAMAN LELAYANG 72120 BANDAR SERI JEMPOL NEGERI SEMBILAN,NEGERI SEMBILAN
DMART SEGI PASARAYA JELAI KOMPLEK,DMART PASARAYA JELAI KOMPLEK GEMAS 73480 GEMAS NEGERI SEMBILAN,NEGERI SEMBILAN
AEON BIG (TUN HUSSEIN ONN),BANDAR TUN HUSSIEN ONN JLN SUARASA 2 MID VALLEY CITY 43200 KAJANG SELANGOR,SELANGOR
M PARADE FAMILY STORE SDN BHD,"LOT B01B BASEMENT MAHKOTA PARADE NO. 1, JALAN MERDEKA 75000 MELAKA MELAKA",MELAKA
THE FRESHMART - MIRI,"GRD FLOOR, SURVEY LOT 9100, 9101, 9102, 9103, 9104, 9105 OF PARENT LOT 9022, BLK 1 LLD ALBANY COMMCENTRE MIRI 98000 MIRI SARAWAK",SARAWAK
AZ MINI MART (LOSONG),"LOT 60173 (TINGKAT BAWAH), WISMA KODIKA, KAMPUNG LOSONG HAJI MAT SHAFIE 20050 KUALA TERENGGANU TERENGGANU",TERENGGANU
KK SUPER MART (MELATI SQUARE PUTRA NILAI),"NO.46, JALAN MELATI SQUARE, MELATI SQUARE PUTRA NILAI 71800 NILAI NEGERI SEMBILAN",NEGERI SEMBILAN
INDAI MINIMART SDN.BHD. - PAKAN,NO 5 JALAN PAKAN 96510 PAKAN SARAWAK,SARAWAK
PERNIAGAAN PAK TORI - PENDANG,"NO 1, 2, 3, 4 & 5 PERSIARAN DAHLIA 06700 PENDANG KEDAH",KEDAH
EVERWIN SUPERMARKET (KROKOP) SDN BHD,"LOT 2067, BLOCK 4, MCLD, JLN CATTLEYA 2 98000 MIRI SARAWAK",SARAWAK
99 SPEEDMART SDN BHD (UJONG PASIR) - 1747,"NO: 70 JALAN UJONG PASIR TAMAN DIMENSI, LENDU 75050 ALOR GAJAH MELAKA",MELAKA
MY MINIMARKET SDN BHD (TANGKAK JAYA),"NO 1415, 1416 & 1417, TAMAN TANGKAK JAYA, 84000 TANGKAK, JOHOR",JOHOR
MDS MART (TATAU) SDN BHD,"LOT 471, BLOCK 22, BUAN LAND DISTRICT 97000 BINTULU SARAWAK",SARAWAK
TUNAS MANJA SDN BHD (BENTONG PERTING POINT),"PT529-PT534, GROUND FLOOR, JALAN PERTING POINT 28600 BENTONG PAHANG",PAHANG
SEGI FRESH PUCHONG ABADI,"NO. 9-G, 11-G & 13-G, JALAN ABADI 2/1, ABADI HEIGHTS, ABADI HEIGHTS, 47120 PUCHONG SELANGOR",SELANGOR
LIM CHING SENG (2018),NO. 6 PASAR JULAU 96600 JULAU SARAWAK,SARAWAK
HOME SMART GROCERY ENTERPRISE,"GROUND FLOOR, SUBLOT 10 (SURVEY LOT 11116) SECTION 64, KTLD, JALAN PENDING (CITY SQUARE PHASE 1) 93450 KUCHING SARAWAK",SARAWAK
BOULEVARD HYPERMARKET (KUCHING) SDN BHD,"BOULEVARD SHOPPING MALL, LOT 9324 BLOCK 16, KCLD JALAN DATUK TAWI SLI, 93250 KUCHING SARAWAK",SARAWAK
99 SPEEDMART SDN BHD (TMN DORANI PERDANA) – 3047,"NO : 29 & 31 (GROUND FLOOR), JALAN DP 5, TAMAN DORANI PERDANA, 45300 SUNGAI BESAR SELANGOR",SELANGOR
ECONSAVE CASH & CARRY (BSB) SDN BHD (BANDAR SERI BOTANI),"NO. A-1 MEDAN BOTANI (PUSAT KOMERSIAL BOTANI VILLAGE) MEDAN BOTANI 1A, BANDAR SERI BOTANI 31350 IPOH PERAK",PERAK
TMG EXPRESS 3000 SDN BHD (SRI JAYA),"NO.12A-15A, GROUND FLOOR LORONG DAGANGAN SRI JAYA EMAS, PEKAN SRI JAYA 26500 MARAN PAHANG",PAHANG
AEON BIG (PALM MALL),"G-16 PALM MALL SEREMBAN, LEBUHRAYA SEREMBAN - BUKIT NENAS KEMAYAN SQUARE 70200 SEREMBAN NEGERI SEMBILAN",NEGERI SEMBILAN
ABU TEGUH ENTERPRISE (UKHWAH MART),"NO. 77, BAWAH, JALAN SIMPANG 34000 TAIPING PERAK",PERAK
99 SPEEDMART SDN BHD (BDR PERMATA LUNAS)-2506,NO : 35 & 36 (GROUND FLOOR) LORONG PERMATA 1/1 BANDAR PERMATA LUNAS 09600 LUNAS KEDAH,KEDAH
G-MART SG SDN BHD - LABUK SANDAKAN,"BATU 34-36, JALAN LABUK SANDAKAN KAMPUNG BATU 30/32, JALAN LABUK 90200 KOTA KINABATANGAN SABAH",SABAH
99 SPEEDMART SDN BHD (LABUK BC) - SBH 30423,"GROUND FLOOR, LOT A-4 & A-5 BLOCK A, LABUK COMMERCIAL & BUSINESS CENTRE MILE 12, JALAN LABUK 90000 SANDAKAN SABAH",SABAH
EVERRISE DEPARTMENTAL STORE (PLAZA MERDEKA) SDN BHD,"PLAZA MERDEKA,LG 18,NO.88,PEARL STREET 93000 KUCHING SARAWAK",SARAWAK
ZHONG MINIMART,"LOT 560, TINGKAT BAWAH, JALAN SUNGAI SLOATING, 98850 98850 LAWAS SARAWAK",SARAWAK
