Store,Address,state
GIANT HYPERMARKET (SEKSYEN 7 SHAH ALAM),"GROUND FLOOR, PUSAT KOMERSIAL BLOK A NO 2, JALAN PLUMBUM T7/T SEKSYEN 7 40000 SHAH ALAM SELANGOR",SELANGOR
MEMPAGA FRESH SDN BHD (KUALA KRAU),"NO. 1,3,5,7,9 & 11 JALAN TKI 2 TAMAN KRAU INDAH 28000 TEMERLOH PAHANG",PAHANG
SEN SEN DEPARTMENTAL STORE (BATU 10),GROUND FLOOR SUBLOT 1-10 LOT 2210 M 10 COMMERCIAL CENTRE BATU 10 JALAN KUCHING SERIAN 93250 KUCHING SARAWAK,SARAWAK
SY MINI MARKET,"P.L 136200256 KG PATIKANG P.O BOX 163 89008, SABAH 89008 KENINGAU SABAH",SABAH
SEGI FRESH JALAN KEBUN,"NO.9, 11, 13, 15 & 17 JALAN SG RASAU F32/F SEKSYEN 32, TAMAN BERJAYA 40460 SHAH ALAM SELANGOR",SELANGOR
SABASUN ETEK (GONG BADAK),"LOT 13818, HADAPAN UNISZA JALAN GONG BADAK 21300 KUALA TERENGGANU TERENGGANU",TERENGGANU
TF VALUE MART (MENTAKAB 2),28. PT 7213 JALAN MOK HEE KIANG MENTAKAB 28400 MENTAKAB PAHANG,PAHANG
KEDAI RUNCIT 77,KAMPUNG KALIPUON 89100 PITAS 89100 PITAS SABAH,SABAH
99 SPEEDMART SDN BHD (BANDAR COUNTRY HOMES 1) - 1244,NO: 26 & 28 JALAN PUSAT BCH 1/3 BANDAR COUNTRY HOMES 48000 RAWANG SELANGOR,SELANGOR
HALIMATUS 1998 MART SDN BHD,"BATU 30, JALAN BINTULU-MIRI 97000 BINTULU SARAWAK",SARAWAK
99 SPEEDMART SDN BHD (PEKAN BAHARU) - 2668,"NO: 18, 19 & 20 (GROUND FLOOR) JALAN PARIT YUSOF PEKAN BAHARU 83600 SEMERAH JOHOR",JOHOR
99 SPEEDMART SDN BHD (TAMAN WAWASAN) - 2871,NO: 164 & 166 (GROUND FLOOR) JALAN WAWASAN 3 TAMAN WAWASAN 86800 MERSING SELANGOR,SELANGOR
FRESH HUB PAGOH,"NO.1,3,5,7 & 9 JALAN SRI PAGOH 1/1 TAMAN SRI PAGOH 84600 MUAR JOHOR",JOHOR
KK SUPER MART (LAHAT MINES),"NO.47, PERSIARAN LAHAT MINES 1, PUSAT PERNIAGAAN BANDAR LAHAT MINES 31500 LAHAT PERAK",PERAK
MYDIN MITC,"NO. 12, MYDIN MALL MTC HANG TUAH JAYA 75450 AYER KEROH MELAKA",MELAKA
MU SUPERFRESH MIDTOWN 1,"LOT 39,40 & 41 BLOK F TINGKAT BAWAH MIDTOWN PLAZA FASA 1 BATU 4 JALAN LINTAS UTARA 90000 SANDAKAN SABAH",SABAH
99 SPEEDMART SDN BHD (MACHAP ) - 3212,"NO: 1 & 3 (GROUND FLOOR), JALAN MCA 1, MACHAP, 86200 SIMPANG RENGGAM JOHOR",JOHOR
MING CHENG TRADING CO.,"LOT 22, BLOCK 20, TINJAR LAND DISTRICT 98050 BARAM SARAWAK",SARAWAK
DOREMART KUCHING KOTA SAMARAHAN,"LOT 1293-1297, BLOCK 25, MTLD, G89 & G93 TAMAN SAMARINDAH BARU 94300 KOTA SAMARAHAN SARAWAK",SARAWAK
DOREMART SIBU SUNGAI MERAH,"NO.7, GROUND FLOOR, SG. MERAH 2D 96000 SIBU SARAWAK",SARAWAK
CKS GROCER RUGADING,"LOT 8 & LOT 9, LORONG RUGADING 1, RUGADING COMMERCIAL CENTRE KM19, JLN TUARAN 89257 TELIPOK SABAH",SABAH
PASARAYA TOP OPAL (BUKIT PASIR),"NO. 3,5,7 & 9 JALAN PERDAGANAGAN PUSAT PERDANGANAGAN 84000 BUKIT PASIR JOHOR",JOHOR
TUNAS MANJA SUPERMARKET SDN BHD (TMN MEDAN MEWAH),"NO. 228-233, TAMAN MEDAN MEWAH 26700 MUADZAM SHAH PAHANG",PAHANG
M MART ENTERPRISE,"LOT 2855, BLOCK 7, PUYUT LAND DISTRICT 98050 BARAM SARAWAK",SARAWAK
BAN ENG HUAT,"NO. 312-B, SIMPANG PASIR JENIANG, 08700 GURUN, KEDAH 08700 JENIANG KEDAH",KEDAH
99 SPEEDMART SDN BHD (TMN JERAI MAJU)-2976,NO: 22 (GROUND FLOOR) JERAI MAJU 2 TAMAN JERAI MAJU 08300 GURUN KEDAH,KEDAH
SRI KASSIM SUPERMART SDN BHD SEKINCHAN,NO-16-18 JALAN INDAH 2/1 SEKINCHAN 45400 SELANGOR SELANGOR,SELANGOR
HANAN MART,"LOT 6220, JALAN KEMAMAN/DUNGUN KG BARU 24300 KERTEH TERENGGANU",TERENGGANU
99 SPEEDMART SDN BHD (TMN BERSATU) - 3302,"NO: 352 & 353 (GROUND FLOOR), TAMAN BERSATU, JALAN BATAS PAIP KOMPLEKS PERNIAGAAN PELANGI, JALAN KUALA KEDAH 06600 KUALA KEDAH KEDAH",KEDAH
PASARAYA WELL-MART SA5,"NO. 122-G, JALAN SETIA GEMILANG BJ U13/BJ SETIA ALAM 40170 SHAH ALAM SELANGOR",SELANGOR
SIN LIANG SUPERMARKET SDN BHD,"LOT 312 - 315 JALAN NAHKODA GAMPAR, 98000 MIRI 98000 MIRI SARAWAK",SARAWAK
99 SPEEDMART SDN BHD (PP LIPIS JAYA) - 2671,"NO: 17 & 18 (GROUND FLOOR), JALAN LIPIS JAYA 2, PUSAT PERNIAGAAN LIPIS JAYA, 27200 KUALA LIPIS PAHANG",PAHANG
99 SPEEDMART SDN BHD (NZX ARA JAYA) - 1096,"A-G-3A & A-G-5, BLOCK A, NO:2 JALAN PJU 1A/41B PUSAT DAGANGAN NZX 47301 PETALING JAYA SELANGOR",SELANGOR
PASARAYA PANTAI TIMOR (PASIR MAS) SDN BHD - PASIR MAS,"PT308-PT314, SEKSYEN 1, BANDAR PASIR MAS 17000 PASIR MAS KELANTAN",KELANTAN
FUNG MING MINI MARKET SDN BHD,"CL 075169881 BATU 16 JALAN LABUK SANDAKAN, PPM 599 ELOPURA, 90000 SANDAKAN SABAH 90000 SANDAKAN SABAH",SABAH
MY MIX MART SDN. BHD. (TMN NUSANTARA),"NO 28, 30 & 32, JALAN NUSARIA 1 J/1, TAMAN NUSANTARA 81550 GELANG PATAH JOHOR",JOHOR
ECO-SHOP LANGKAWI,"GRD FLOOR, NO 1, 3, 5, 7, 9, 11, 13, 15, 17, JALAN PANDAK MAYAH 7, PUSAT BANDAR KUAH, 07000 LANGKAWI, KEDAH 07000 LANGKAWI KEDAH",KEDAH
CHOP WONG POH LEONG,NO. 3 JULAU BAZAAR 96600 JULAU SARAWAK,SARAWAK
B29-PASARAYA SAVE-SIMPANG PULAI 2,NO.23 & 25 PERSIARAN SENGAT BARU 14 TAMAN BERSATU 31300 SIMPANG PULAI PERAK,PERAK
PASAR MINI SEKINCHAN MINIMARKET SDN BHD,"NO 146 JALAN RADIN 3.5069916189112686, 101.10462173936394 45400 SEKINCHAN SELANGOR",SELANGOR
MU CITY FRESHMART,LOT 15 TINGKAT BAWAH CENTRE POINT MALL JALAN EDINBURGH 90000 SANDAKAN SABAH,SABAH
FAMILY W MINIMART (ROBAN),"16A -21A, GF PEKAN ROBAN, ROBAN NEW BAZAAR 95300 ROBAN SARAWAK",SARAWAK
PASARAYA TAWAKKAL,"NO. 19 (GROUND FLOOR), JALAN SEROJA, TAMAN PERTAMA, 45200 SABAK BERNAM SELANGOR",SELANGOR
EVERRISE DEPARTMENTAL STORE (TABUAN JAYA) SDN BHD,"GROUND FLOOR, SUBLOT 1-9, LOT 20738-20746, BLOCK 11 MTLD, JALAN BAYOR BUKIT 93350 KUCHING SARAWAK",SARAWAK
99 SPEEDMART SDN BHD (JEMENTAH) - 2007,"NO : 6 & 7 (GROUND FLOOR), JALAN PADANG KAMPUNG BARU, JEMENTAH 85200 SEGAMAT JOHOR",JOHOR
ECONSAVE CASH & CARRY (SK) SDN BHD (S.KEMBANGAN),LG 35 LOWER GROUND FLOOR SOUTH CITY PLAZA PERSIARAN SERDANG PERDANA TAMAN SERDANG PERDANA SEKSYEN 1 43300 SERI KEMBANGAN SELANGOR,SELANGOR
99 SPEEDMART SDN BHD (SPRINGHILL 2) - 2586,NO: 43A (GROUND FLOOR) JALAN SPRINGHILL 1/1 BANDAR SPRINGHILL 71010 PORT DICKSON NEGERI SEMBILAN,NEGERI SEMBILAN
99 SPEEDMART SDN BHD (TMN SEMARAK API TIGA) - 3217,"NO: 229 & 230 (GROUND FLOOR), SUSURAN SEMARAK API FASA 3, TAMAN SEMARAK API 3, 06010 CHANGLOON KEDAH",KEDAH
99 SPEEDMART SDN BHD (PEKAN ALOR GAJAH) - 1767,"KM 3052 & KM 3053, JALAN BESAR, BANGUNAN PRIMA PEKAN ALOR GAJAH SEK II 78000 ALOR GAJAH MELAKA",MELAKA
BIG SUPERMART SDN BHD (PUCHONG),"PP-UG-27, KOMPLEKS PUCHONG PERDANA, JALAN KEKWA 3/1, TAMAN PUCHONG PERDANA 47100 PUCHONG SELANGOR",SELANGOR
HERO MARKET - BUKIT JELUTONG,"LOT G-37, G-38, G-40, G-41, G-42, G-43, G-43A, G45, UG-40, UG-41, UG-42 & UG-43 KOMERSIAL RADIA, PERSIARAN ARKED BUKIT JELUTONG U8 40150 SHAH ALAM SELANGOR",SELANGOR
TAI CHUNG MARKETING SDN BHD,"LOT 630, 631 & 632 SARATOK BAZAAR, 95400 SARATOK SARATOK BAZAAR 95400 SARATOK SARAWAK",SARAWAK
PASARAYA WELL-MART SA4,"NO. 7-1, JALAN ELEKTRON D U16/D EBOULEVARD DENAI ALAM 40160 SHAH ALAM SELANGOR",SELANGOR
JIT SIANG (LUBOK ANTU),NO 47&48 PEKAN LUBOK ANTU 95900 LUBOK ANTU SARAWAK,SARAWAK
99 SPEEDMART SDN BHD (TAMAN CHENG BARU) - 2567,NO: 45 & 47 (GROUND FLOOR) JALAN SERI 7 TAMAN CHENG BARU 75250 MELAKA MELAKA,MELAKA
ICON MART (BP) SDN. BHD. (TMN SRI JAYA),"NO. 130, JALAN ROTAN BATU, TAMAN SRI JAYA, 83000 83000 BATU PAHAT JOHOR",JOHOR
K GROCER KRUBONG,"NO. 125,127 & 129 JLN SATU KRUBONG TMN SATU KRUBONG 75260 KRUBONG MELAKA",MELAKA
PASARAYA E FAMILY STORE (DURIAN TUNGGAL) SDN BHD,"DT10&DT10-1, DT11&DT11-1, DT12&DT12-1, DT13&DT13-1, DT14&DT14-1 DT15&DT15-1, DT16&DT16-1, PUSAT PERNIAGAAN DURIAN TUNGGAL 2, PUSAT PERNIAGAAN DURIAN TUNGGAL 76100 DURIAN TUNGGAL MELAKA",MELAKA
HARI2 SUPERMART (TAMAN MUTIARA INDAH),NO 7 & 9 JLN MUTIARA INDAH 1 TAMAN MUTIARA INDAH 81100 JOHOR BAHRU JOHOR,JOHOR
ALFA INDAH (JAYA GADING),PASAR AWAM JAYA GADING JALAN GAMBANG 26070 JAYA GADING PAHANG,PAHANG
EMAN GROCER,"LOT 2279, HADAPAN MASJID KG KENOR 18000 KUALA KRAI KELANTAN",KELANTAN
ECONSAVE CASH & CARRY (KLU) SDN BHD (KLUANG),"LOT 1307 & KLUANG MUKIM, 1308, JALAN MERSING, 86000 KLUANG JOHOR",JOHOR
WU YIN TRADING,"LOT 702 OF PARENT LOT 699, GROUND FLOOR BLOOK 8, PANDARUAN LAND DISTRICT 98700 LIMBANG SARAWAK",SARAWAK
LUCKY MART KERTEH,LOT 809-(4-7) JALAN BESAR KG. BARU 24300 KERTEH TERENGGANU,TERENGGANU
GIANT HYPERMARKET (SENAWANG),LOT 1571 JALAN SENAWANG TMN KOMERSIAL SENAWANG SENAWANG 70400 SEREMBAN NEGERI SEMBILAN,NEGERI SEMBILAN
PASAR MINI SAMA MAJU TRADING (BONGAWAN),"UNIT 3,4&5 BLOCK E, BONGAWAN PLAZA PAPAR , 89708 PAPAR 89708 PAPAR SABAH",SABAH
99 SPEEDMART SDN BHD (JLN LEONG YONG) - 2633,"NO: 1 & 2 (GROUND FLOOR), JALAN LEONG YONG BANDAR SEGAMAT 85000 SEGAMAT JOHOR",JOHOR
HERO MARKET - KIP MALL,"B2AT - 01, GAT -01, KIPMALL BANGI NO.1, JALAN MEDAN BANGI OFF PERSIARAN KEMAJUAN 43650 BANDAR BARU BANGI SELANGOR",SELANGOR
SEGI FRESH SURIAN MANTIN,NO. 1G & 2G JALAN SURIAN 11 TAMAN SURIAN 71700 MANTIN NEGERI SEMBILAN,NEGERI SEMBILAN
99 SPEEDMARRT SDN BHD (AIR MAWANG) - 1962,NO: 2 & 3 (GROUND FLOOR) JALAN MAWAR 1 TAMAN AIR MAWANG 73100 JOHOL NEGERI SEMBILAN,NEGERI SEMBILAN
CAMERON BAZAAR SDN BHD,"NO. D-171, JALAN BESAR KUALA TERLA 39010 CAMERON HIGHLANDS PAHANG",PAHANG
GUAN WENG HUAT ENTERPRISE SDN BHD (SABAK BERNAM),"NO. 8, 10, 12, TKT BWH JALAN PPBT 40, PUSAT PERNIAGAAN BATU 40 45200 SABAK BERNAM SELANGOR",SELANGOR
KOPERASI PENEROKA-PENEROKA FAT 5 BERHAD,1 & 2 KEDAI KOPERASI 81920 KOTA TINGGI JOHOR,JOHOR
NEW WORLD GROCER (STAPOK),"NO. G-01-04 & G-12-G13 LOT 3641, GROUND FLOOR, BLOCK 217 KNLD, HK SQUARE, JALAN STAPOK UTAMA 93250 KUCHING SARAWAK",SARAWAK
DUYONG FAMILY STORE SDN BHD,"NO 2-2-1 JALAN TDB 1 2.2034073310324382, 102.30926620455291 TAMAN DUYONG BESTARI 75460 DUYONG MELAKA",MELAKA
99 SPEEDMART SDN BHD (RICKETTS CC) -SWK 35024,"LOT 2064 & LOT 2065 RICKETTS COMMERCIAL CENTRE JALAN TARAP, LIMBANG TOWN DISTRICT 98700 LIMBANG SARAWAK",SARAWAK
TMG EXPRESS 3000 SDN BHD (MARAN),"NO.A4-A16, GROUND FLOOR JALAN MARAN-KUANTAN, JALAN PERSEKUTUAN 26500 MARAN PAHANG",PAHANG
THE STORE ( KUALA KANGSAR),"71A - 71D, JALAN KANGSAR 33000 KUALA KANGSAR PERAK",PERAK
JASA KHJ ENTERPRISE (PEKAN NENAS),"63, JALAN UTAMA 2, TAMAN UTAMA 81500 PEKAN NENAS JOHOR",JOHOR
XIRI (K.BERANG) JERTEH,"PT 2866-2868, SEBELAH HOSPITAL BESUT JALAN PASIR AKAR, KAMPUNG BALIK BUKIT 22000 JERTEH TERENGGANU",TERENGGANU
ISHAH BINTONG (JEJAWI),"NO. 170 JALAN JEJAWI SEMATANG, 02600 ARAU,PERLIS 02600 ARAU PERLIS",PERLIS
99 SPEEDMART SDN BHD (PORT KLANG2) - 1195,"NO.38 & 40, JALAN SUNGAI AUR, 42000 PELABUHAN KLANG SELANGOR",SELANGOR
KANA HARAPAN JAYA TRADING SDN BHD (BDR BARU PERMAS),"C-01-12, JALAN EJ 4/1, TAMAN EHSAN JAYA 81100 JOHOR BAHRU JOHOR",JOHOR
PASARAYA ECONO SUNGAI LALANG 1,"NO.189,190,191,192 & 193,JALAN MELOR 1/6,PERSIARAN AMANJAYA 5, 08000 SUNGAI PETANI KEDAH",KEDAH
PASARAYA DM SDN BHD,"LOT 2325, KAMPUNG SUNGAI BAJAR 21700 KUALA BERANG TERENGGANU",TERENGGANU
SERVAY EXPRESS - SEKP,"LOT 13 - 15, GRD FLOOR, BLOCK C, KEPAYAN POINT, JALAN PENAMPANG BYPASS 88200 PENAMPANG SABAH",SABAH
MU MARKET GUM GUM,TL.077558537 LOT 3 BLOK A PEKAN BARU GUM-GUM BATU 16 JALAN LABUK 90000 SANDAKAN SABAH,SABAH
BILLION MART (TANJUNG CHAT) SDN BHD - TANJUNG CHAT,"LOT 1537-1544, WISMA YUSMAH TAMAN SRI TANJUNG, JALAN LONG YUNUS 15200 KOTA BHARU KELANTAN",KELANTAN
FAMILY W MART (KANOWIT),LOT 241-244 (SUBLOT 1 TO 4) CINEMA ROAD 96700 KANOWIT SARAWAK,SARAWAK
KK SUPER MART (ACACIA AVENUE NILAI),"B7-G, ACACIA AVENUE, JALAN JATI 9, TAMAN DESA JATI 71800 NILAI NEGERI SEMBILAN",NEGERI SEMBILAN
99 SPEEDMART SDN BHD (TAMAN INTAN SETIA) - 1585,"NO: 1, JALAN INTAN SETIA 1 TAMAN INTAN SETIA 2 PERSONA HEIGHT, BUKIT TINGGI 35900 TANJUNG MALIM PERAK",PERAK
ECO-SHOP BANDAR TAIPING,"NO 12, 14 & 16 GROUND AND MEZZANIE FLOOR JALAN KELAB CINA 34000 TAIPING PERAK",PERAK
ECONSAVE CASH & CARRY (BH) SDN BHD (BAHAU),"NO 18,26 JALAN DATO' BESAR PUSAT PERNIAGAAN 72100 BAHAU NEGERI SEMBILAN",NEGERI SEMBILAN
99 SPEEDMART SDN BHD (BULOH KASAP) - 2370,"NO: 23B & 23C (GROUND FLOOR) LOT 306, JALAN IBRAHIM BULOH KASAP 85010 SEGAMAT JOHOR",JOHOR
CKS SUPERMARKET MENGGATAL,"LOT C, CL.015358942, CL.015358951 & CL.015358960, MENGGATAL PLAZA, MILE 8 TUARAN ROAD 88400 KOTA KINABALU SABAH",SABAH
RIA MART (KUALA TERENGGANU),"PT3599-PT3608, JALAN ALAM MUTIARA 2/1, TOK MOLOR 21100 KUALA TERENGGANU TERENGGANU",TERENGGANU
99 SPEEDMART SDN BHD (PINGGIRAN PEDAS) - 1683,"NO. 13 & 14, LORONG PP14 TAMAN PINGGIRAN PEDAS 71400 PEDAS NEGERI SEMBILAN",NEGERI SEMBILAN
NSK TRADE CITY (MELAKA) SDN BHD,"NO. 19395, JALAN TTC 26, TAMAN TEKNOLOGI CHENG 75250 CHENG MELAKA",MELAKA
KEDAI BERKAT TAWAKKAL,"NO.1, JALAN DATO SHAH BANDAR, FELDA KERATONG 04 26900 BANDAR TUN RAZAK PAHANG",PAHANG
ECONSAVE CASH & CARRY (KJW) SDN BHD (SHAH ALAM),LOT 9900 JALAN BATU EMPAT SEKSYEN 36 40470 SHAH ALAM SELANGOR,SELANGOR
ECO-SHOP ONE BORNEO,"LOT F600, 1 BORNEO HYPERMALL JLN SULAMAN 88400 KOTA KINABALU SABAH",SABAH
ECONSAVE CASH & CARRY (PK) SDN BHD (AULONG),PT 9527 JALAN AU 1 34000 TAIPING PERAK,PERAK
99 SPEEDMART SDN BHD (ARENA CURVE) - 2984,"NO: 72-1-27 & 72-1-28 (GROUND FLOOR), JALAN MAHSURI, ARENA CURVE, 11950 BAYAN LEPA SELANGOR",SELANGOR
GT CASH & CARRY ENTERPRISE (PANCHOR),"S/44 LOT 1274, JALAN PANCHOR 16100 KOTA BAHRU KELANTAN",KELANTAN
99 SPEEDMART SDN BHD (TMN DESA DAMAI) - 3392,"NO: 132 & 133 (GROUND FLOOR), JALAN DESA DAMAI TAMAN DESA DAMAI 06000 JITRA KEDAH",KEDAH
BATARAS FRESH MART HILLTOP,"NO.2. LOT 3, (CL.015414561) LORONG GUNUNG JUO 2 OFF JALAN LINTAS 88300 LUYANG SABAH",SABAH
99 SPEEDMART SDN BHD (BDR SATELIT) - 2291,"NO: 1 (GROUND FLOOR), JALAN MAKMUR 8, BANDAR SATELIT, 26700 MUADZAM SHAH PAHANG",PAHANG
S AND K SHOP (TAIPING),"179, 181, 183 JALAN TAMAN MAS 2, TAMAN MAS JALAN AIR KUNING 34000 TAIPING PERAK",PERAK
99 SPEEDMART SDN BHD (DESA MENTARI 1) - 1028,"NO.1, JALAN PJS 6/5F, DESA MENTARI GERBANG NUSAJAYA KAMPUNG MASJID LAMA 46000 PETALING JAYA SELANGOR",SELANGOR
SEGI FRESH (DENGKIL),"SEGI FRESH DENGKIL G-03, G-2A & G-05, JALAN DENGKIL CENTRE POINT TAMAN DENGKIL CENTRE POINT 43800 DENGKIL SELANGOR",SELANGOR
HENG TEIK CHAN (PASAR MINI HENG TEIK CHAN),NO. 1G & 2G PUSAT PENJAJA PUTRA JALAN PUTRA 36000 TELUK INTAN PERAK,PERAK
99 SPEEDMART SDN BHD (LANCHANG) - 2047,"NO: 11 & 13 (GROUND FLOOR), JALAN LANCHANG INDAH, TAMAN LANCHANG INDAH, 28500 LANCHANG PAHANG",PAHANG
99 SPEEDMART SDN BHD (BANDAR COUNTRY HOMES 2) - 1496,NO : 37 & 39 JLN DESA 9/6 BDR COUNTRY HOMES 48000 RAWANG SELANGOR,SELANGOR
GIANT SUPERSTORE (PRIMA SAUJANA),"PLOT 8, JALAN PRIMA SAUJANA 2/F TAMAN PRIMA SAUJANA 43000 KAJANG SELANGOR",SELANGOR
99 SPEEDMART SDN BHD (BDR SERI ALAM 2) - 2208,"NO: 24 & 26 (GROUND FLOOR), JALAN SURIA 66 BANDAR SERI ALAM KAMPUNG MASJID LAMA 81750 MASAI JOHOR",JOHOR
AEON BIG (KLANG),2 JALAN HARMONI 3/KU3 SUNGAI PINANG 41400 KLANG SELANGOR,SELANGOR
BILLION SHOPPING CENTRE (BALING) SDN BHD,"PLAZA BALING, NO 93, PERSISIRAN KOTA 3/5 KOTA BALING JAYA, BATU 42 PULAI 09100 BALING KEDAH",KEDAH
WLS ENTERPRISE SDN BHD - PKL,"PT 5055-5059,KOMPLEKS PERNIAGAAN SAIDINA ALI,JALAN KUALA KRAI,16450 KETEREH KELANTAN. 16450 KUALA KRAI KELANTAN",KELANTAN
CKS SUPERMARKET PAPAR,"LOT 4-9, GRD & 1ST FLR, PAPAR COMMERCIAL CENTRE JALAN KG. SURATI 89500 PAPAR SABAH",SABAH
RIA MART (DUNGUN),"NO.25-28, BLOCK C, GROUND FLOOR KOMPLEKS PERNIAGAAN SURA GATE, JALAN BESAR SURA GATE 23000 DUNGUN TERENGGANU",TERENGGANU
99 SPEEDMART SDN BHD (KAMPUNG DAMAT BANTAYAN) - SBH 27221,"NT SERIAL NO.4785 KG DAMAT, JALAN KAMPUNG BANTAYAN DAMAT SAWAH JLN KOTA BELUD – KUDAT 89250 TAMPARULI SABAH",SABAH
MS MEMPAGA SEGAR (LANCHANG 1) SDN BHD,"NO 1, GROUND FLOOR, JLN LANCHANG INDAH 6/1 28500 KARAK PAHANG",PAHANG
MAXXBILL TRADING SDN BHD,"LPF 10018, LOT 1 DANUM LAND DISTRICT 96900 BELAGA SARAWAK",SARAWAK
99 SPEEDMART SDN BHD (LUBOK CHINA) - 1718,"NO, 222 & 223 JALAN WIRA INDAH 2 TAMAN WIRA INDAH 78100 LUBOK CHINA MELAKA",MELAKA
TARGET SUPERMARKET SDN BHD (CAWANGAN MASAI),"LS 1, PTD 163160, JALAN SERANGKAI 1, TAMAN BUKIT DAHLIA, 81700 PASIR GUDANG JOHOR",JOHOR
WN BERKAT JAYA ENTERPRISE,"LOT 2007, BANDAR BARU JELI 17600 JELI KELANTAN",KELANTAN
ECO-SHOP TAPAH,"H.S. (D) 17794, OFF JALAN BALDWIN, BANDAR TAPAH 35000 TAPAH PERAK",PERAK
ECONSAVE CASH & CARRY (PDS) SDN BHD (PANDAMARAN),LOT 218 & 219 JALAN BANTING KS/05 TAMAN PERINDUSTRIAN SOBENA JAYA 42000 PORT KLANG SELANGOR,SELANGOR
TRELEAF MART (KEDAI BULOH),"LOT 1005, KAMPUNG KEDAI BULOH, 21070 KUALA TERENGGANU TERENGGANU",TERENGGANU
SEGI FRESH (ASSAM JAWA),"SEGI FRESH ASSAM JAWA NO.3,5 & 7, JALAN GAYA MERAK TAMAN GAYA MERAK 45700 BUKIT ROTAN SELANGOR",SELANGOR
FAMILY W GROCER (BINTAWA),"LOT 421, 422, 423 & 424, GROUND FLOOR SECTION 66, KTLD, JALAN BINTAWA 96000 SIBU SARAWAK",SARAWAK
PASAR RAYA LAPAN LAPAN (BENTONG) SDN BHD,"87, 88, TAMAN KETARI 28700 BENTONG PAHANG",PAHANG
DMART SEGI KERATONG 03,DMART FELDA KERATONG 03 BANDAR TUN RAZAK 26900 BANDAR TUN RAZAK PAHANG,PAHANG
SEGI FRESH KUALA SELANGOR,"1,3,5,7 & 9 JALAN BENDAHARA 1/2B TAMAN BENDAHARA 45000 KUALA SELANGOR SELANGOR",SELANGOR
PASARAYA WELL-MART KP1,"NO. 110, JALAN MIRI TAMAN BERINGIN JINJANG 53000 KEPONG SELANGOR",SELANGOR
PASARAYA ECONO (TAMAN SELASIH),"NO.3626, 3627, 3628, 3629, 3630 & 3631, JALAN SELASIH 2 TAMAN SELASIH 09000 KULIM KEDAH",KEDAH
99 SPEEDMART SDN BHD (TAMAN SERI AIR HITAM) - 1942,NO :2 & 3 (SINGLE STOREY) JALAN THAIM 1 TAMAN SERI AIR HITAM 72120 BANDAR SERI JEMPOL NEGERI SEMBILAN,NEGERI SEMBILAN
AA MY GENERATION LEGACY,"NO.64 NO.64 KAMPUNG BUKIT JERING, KUALA BALAH 17600 JELI KELANTAN",KELANTAN
EVERRISE DEPARTMENTAL STORE (CITY ONE) SDN BHD,"MG7-12, GROUND FLOOR, MALL 1 CITYONE MEGAMALL, JALAN SONG 93350 KUCHING SARAWAK",SARAWAK
DMART SEGI LURAH BILUT,FELDA LURAH BILUT BENTONG 28700 BENTONG PAHANG,PAHANG
99 SPEEDMART SDN BHD (TMN PENDAMARAN PERMAI) - 1349,"NO: 66 & 68, JALAN PERMAI 1B/KS09, TAMAN PENDAMARAN PERMAI, 42000 PELABUHAN KLANG SELANGOR",SELANGOR
PASAR RAYA QIMART (PONTIAN),"23G, JALAN EMAS 2 PUSAT PERNIAGAAN KOTA EMAS 82000 PONTIAN JOHOR",JOHOR
HWA THAI SUPERMARKET (KIP MALL MASAI),A3A/MA3A JALAN PERSIARAN 2 TAMAN BUKIT DAHLIA 81750 PASIR GUDANG JOHOR,JOHOR
PASARAYA TOP OPAL (PAGOH JAYA),"NO. 15,17,19,21 JALAN JAYA 1/5B TAMAN PAGOH JAYA, MUAR 84600 PAGOH JOHOR",JOHOR
99 SPEEDMART SDN BHD (TMN INTAN KLUANG) - 2415,"NO: 40 (GROUND FLOOR), JALAN INTAN 2/5 TAMAN INTAN 86000 KLUANG JOHOR",JOHOR
B26-PASARAYA SAVE-MERU PERDANA,NO 11 & 13 JALAN MERU PERDANA 1 TAMAN MERU PERDANA 31200 CHEMOR PERAK,PERAK
SEGI FRESH (BIDOR),"SEGI FRESH BIDOR NO. 1-G, 2-G & 3-G, JALAN BOTANI 1 TAMAN BIDOR BOTANI 35500 BIDOR PERAK",PERAK
UMART PASIR MAS,"LOT 660 (1265), JALAN SETOR JKR 17000 PASIR MAS KELANTAN",KELANTAN
MU SUPERFRESH MAWAR,LOT D-2 BLOK D TINGKAT BAWAH MAWAR CENTRE TAMAN MAWAR JALAN LINTAS SIBUGA 90000 SANDAKAN SABAH,SABAH
THARWA MARKET,"LOT 1,2,3,4,5,6 & 7 SHOPLOTS MILE 7 KAMPUNG DESA BAJAU, JALAN TENGAH NIPAH, 91100 LAHAD DATU SABAH 91100 LAHAD DATU SABAH",SABAH
99 SPEEDMART SDN BHD (TMN KOMERSIAL EMAS) - 2137,"NO: 1 & 2 (GROUND FLOOR), JALAN EMAS 2A, TAMAN KOMERSIAL EMAS, 28200 BANDAR BERA PAHANG",PAHANG
JOO ONN,"NO. 26 & 27, ASAJAYA NEW TOWNSHIP 94600 ASAJAYA SARAWAK",SARAWAK
PULAU KETAM MINI MARKET,"NO. 23K, JALAN BESAR 42940 PULAU KETAM SELANGOR",SELANGOR
SEGI FRESH SIKAMAT,"207, 208, 209, 210 & 211, JALAN PERSIARAN BUKIT CORAL 1 TAMAN BUKIT CORAL 70400 SIKAMAT NEGERI SEMBILAN",NEGERI SEMBILAN
DESA RIA ECO MART,JALAN INFORMASI RUMBIA KASUGIRA 89747 89747 KUALA PENYU SABAH,SABAH
ECO-SHOP AEON STATION 18,"1ST FLR, LOT F73A NO. 2, SUSUNAN STESEN 18 STATION 18 31650 IPOH PERAK",PERAK
99 SPEEDMART SDN BHD (TAMAN PAYA RUMPUT PERDANA) - 1628,"NO: 1 & 3, JALAN ANGGERIK 1 TAMAN PAYA RUMPUT PERDANA 76450 PERDANA MELAKA",MELAKA
YONG FATT MART,"NO 1 & 1A 2&2A 3&3A, JLN BAGAN JAYA TAMAN BAGAN JAYA 83000 BATU PAHAT JOHOR",JOHOR
I MART XCEL SDN BHD HQ (SONG),"GROUND FLOOR & FIRST FLOOR LOT 313, SONG TOWN DISTRICT 96850 SONG SARAWAK",SARAWAK
BATARAS SUPERSTORE KEPAYAN,"CENTRAL SHOPPING PLAZA, GROUND FLOOR, JALAN BANJARAN KEPAYAN RIDGE 88200 KOTA KINABALU SABAH",SABAH
ECONSAVE CASH & CARRY (ML) SDN BHD (MALIM),1-15 JALAN PPM 3 PLAZA PANDAN MALIM BUSINESS PARK 75250 BALAI PANJANG MELAKA,MELAKA
99 SPEEDMART SDN BHD (BANDAR PUTERI) - 1035,"NO. 39, LORONG SANGGUL 1A BANDAR PUTERI 42000 KLANG SELANGOR",SELANGOR
99 SPEEDMART SDN BHD (TMN PERINDUSTRIAN TANJUNG PELEPAS) - 2937,"NO: 2 (GROUND FLOOR), JALAN PELEPAS 2/2 TAMAN PERINDUSTRIAN TANJUNG PELEPAS 81550 GELANG PATAH JOHOR",JOHOR
PASARAYA POK ENG TIN,"LOT 71296&71297, BANGUNAN POK ENG TIN, JALAN YAHYA AHMAD 23000 DUNGUN TERENGGANU",TERENGGANU
SING KWONG SUPERMARKET (MEDAN RAYA) SDN BHD,"BLOCK G, NO 50 - 60, JALAN TANJUNG KIDURONG, 97000 BINTULU 97000 BINTULU SARAWAK",SARAWAK
PANJI MAKMUR TRADING SDN BHD (CAW. JPJ),LOT 911 916 C & D JALAN HOSPITAL 15200 KOTA BHARU KELANTAN,KELANTAN
EVERWIN CENTRE (KOTA SAMARAHAN) SDN BHD,"NO.14 TO 27 (G/F) & 17-28(1ST FFOOR), UNI MEDIA COMMERCIAL CENTRE JALAN UNI MEDIA, KOTA SAMARAHAN EXPRESSWAY 94300 KOTA SAMARAHAN SARAWAK",SARAWAK
CHIONG SOON TRADING,NO. 2 NEW BAZAAR MATU 96250 MUKAH SARAWAK,SARAWAK
NAHMEE TRADING (M) SDN BHD - BATU 32ND,"SL-20, LOT 10 BAKI JUNCTION, 32ND MILE, JALAN KUCHING-SERIAN 94700 SERIAN SARAWAK",SARAWAK
99 SPEEDMART SDN BHD (TMN SRI UTAMA)-2643,NO: 25 & 26 (GROUND FLOOR) LORONG LINDUNGAN 2 TAMAN SRI UTAMA 08300 GURUN KEDAH,KEDAH
C-MART (CHANGLUN) SDN BHD,"C-MART (CHANGLUN) SDN BHD NO 1, PEKAN CHANGLUN 06010 CHANGLUN KEDAH",KEDAH
MEGAMART SDN BHD (TANGKAK 2),"NO 4, 4-1,5, 5-1,6 JALAN PAYAMAS BANDAR IOI 84900 TANGKAK JOHOR",JOHOR
KUMPULAN PASARAYA PANTAI TIMOR SDN BHD - RAUB,"PT 27607, JALAN PUTRA RAUB, PUSAT PERNIAGAAN PUTRA RAUB 27600 RAUB PAHANG",PAHANG
MY MART GOLDEN GLOBE (PARIT BETAK) SDN BHD,"NO 125.10, JLN JAYA DIRI, BELAHAN TAMPOK PARIT BETAK 83100 RENGIT JOHOR",JOHOR
REZEKI FOODSTUFF ENTERPRISE,LOT 942 JALAN BESAR SUNGAI PELEK SELANGOR 43950 SUNGAI PELEK SELANGOR,SELANGOR
NSK TRADE CITY (RAWANG JAYA) SDN BHD,"LOT 647 & 682, JALAN RAWANG, RAWANG JAYA, 48000 RAWANG SELANGOR",SELANGOR
PASAR MINI THONG HING,"F1698, JALAN BESAR BATU ARANG 48100 BATU ARANG SELANGOR",SELANGOR
99 SPEEDMART SDN BHD (DESA PINGGIRAN PUTRA) - 1524,"NO: 7 & 9, JALAN PINGGIRAN PUTRA 4A/4 DESA PINGGIRAN PUTRA SG MERAB 43000 KAJANG SELANGOR",SELANGOR
PASARAYA SINAR MEGA,"8920, 8921, 8922, 8923 BANDAR MARANG 21600 MARANG TERENGGANU",TERENGGANU
99 SPEEDMART SDN BHD (TMN SURIA INDAH) - 2174,"NO: 5 & 7 (GROUND FLOOR), JALAN INDAH 1 TAMAN SURIA INDAH 86000 KLUANG JOHOR",JOHOR
99 SPEEDMART SDN BHD (KOTA BAYU EMAS1) - 1584,"NO: 14-1 & 16-1 , JALAN BAYU IMPIAN 10/KS 9, KOTA BAYU EMAS, PANDAMAR, 41200 PELABUHAN KLANG SELANGOR",SELANGOR
WLS ENTERPRISE SDN BHD - KR,"PT 378, KEDAI KETEREH 16450 KETEREH KELANTAN",KELANTAN
CHEN SIANG ECONOMY MARKET,NO.34 DEBAK BAZAAR 95500 BETONG SARAWAK,SARAWAK
MYDIN MUTIARA RINI,LOT PTD 181611 MUKIM PULAI 81300 JOHOR BAHRU JOHOR,JOHOR
SUPER NYAN NYAN MINI MARKET (PASAR MINI SUPER NYAN NYAN MINI MARKET),"NO. 1, JALAN HARMONI PUSAT BANDAR 34300 BAGAN SERAI PERAK",PERAK
BATARAS FRESH MART INANAM,"LOT 17, GROUND FLOOR, MILE 6, TUARAN ROAD INANAM NEW TOWNSHIP 88450 KOTA KINABALU SABAH",SABAH
FAIZAH MIZI ENTERPRISE,"NO.7B KEDAI DONG, PEKAN RAUB 27600 RAUB PAHANG",PAHANG
AZ MINI MART (PULAU MUSANG),"LOT 1009B, KAMPUNG BUKIT KUBANG JAMBU, JALAN PULAU MUSANG 20050 KUALA TERENGGANU TERENGGANU",TERENGGANU
99 SPEEDMART SDN BHD (PEKAN GADEK) - 1765,"NO: GD 855 & GD 856, JALAN SERI PULASAN TAMAN SERI PULASAN, GADEK 78000 ALOR GAJAH MELAKA",MELAKA
TF VALUE-MART SDN BHD (JERANTUT),LOT 7801-7811 & LOT 7816 - 7826 BANDAR INDERAPURA 27000 JERANTUT PAHANG,PAHANG
CHOP MIN SENG,"NO. 31 MARUDI BAZAAR, MARUDI BARAM 98050 MARUDI SARAWAK",SARAWAK
99 SPEEDMART SDN BHD (TMN DENGKIL JAYA) - 2269,"NO: 39 & 41 (GROUND FLOOR), JALAN KENANGA 2, TAMAN DENGKIL JAYA, 43800 DENGKIL SELANGOR",SELANGOR
PASARAYA WORLDCOME G-MART (TANJUNG AGAS),"NO. 2 & 3 JALAN MERAK KG KENANGAN TUN SYED NASIR, TANJUNG AGAS 84000 MUAR JOHOR",JOHOR
99 SPEEDMART SDN BHD (BANDAR WARISAN PUTERI) - 2991,NO :1793 & 1794 (GROUND FLOOR) JALAN WARISAN PUTRI A62 BANDAR WARISAN PUTERI 70400 SEREMBAN NEGERI SEMBILAN,NEGERI SEMBILAN
RESTU FRESH MART - PPRA,"RESTU FRESH MART GROUND FLOOR, LOT 18, SEDCO KUNDASANG SHOPHOSES, PHASE II, PEKAN KUNDASANG, 89300 RANAU, SABAH 89300 RANAU SABAH",SABAH
PASARAYA ECONO (KAMUNTING),"47,49 & 51,JALAN MEDAN KAMUNTING 1,MEDAN KAMUNTING,34600 KAMUNTING,PERAK 34600 KAMUNTING PERAK",PERAK
MELIGAI MINI MARKET - SELANGAU,"LOT 459, 460, 461, JALAN PASAR BARU SELANGAU 96000 SELANGAU SARAWAK",SARAWAK
99 SPEEDMART SDN BHD (TMN SERI BEDENA) - 2355,"NO: PT 6803 & 6804 (GROUND FLOOR), JALAN BEDENA 1, TAMAN SERI BEDENA, 45300 SUNGAI BESAR SELANGOR",SELANGOR
PASARAYA BERKAT YUSRI (BESUT),"LOT 467, SIMPANG EMPAT JALAN TEMBILA, KAMPUNG RAJA 22200 BESUT TERENGGANU",TERENGGANU
TUNAS MANJA SUPERMARKET SDN BHD (RAUB),LOT 16773 MUKIM GALI RAUB 27600 RAUB PAHANG,PAHANG
TF VALUE-MART SDN BHD (IPOH TAMBUN),"NO. 2, JALAN SCI 2/2 BANDAR SUNWAY IPOH 31150 ULU KINTA PERAK",PERAK
ECONSAVE CASH & CARRY (TT) SDN BHD (TITI),"NO. 1-8, JALAN MERBAU 1 TAMAN MERBAU 71650 TITI NEGERI SEMBILAN",NEGERI SEMBILAN
BILLION MART (TANJUNG CHAT) SDN BHD - BACHOK,"NO.463-467, BANDAR BACHOK 16300 BACHOK KELANTAN",KELANTAN
PASARAYA MINAT (KAMPAR) SDN BHD,25-29 JALAN BALAI 31900 KAMPAR PERAK,PERAK
MYDIN BAZAR MELAKA,"1ST FLOOR, BAZAAR MELAKA SENTRAL JALAN TUN ABDUL RAZAK 75400 KAMPONG TENGAH MELAKA",MELAKA
WLS ENTERPRISE SDN BHD - TPN,"PT 3863,3867 JALAN SETIA 5,BANDAR BARU TUMPAT 16200 TUMPAT KELANTAN",KELANTAN
KIM HOCK SUPERMARKET (MUKAH) SDN BHD,"SUBLOTS 1 TO 10, BLOCK F LOT 613, BLOCK 76 MUKAH LAND DISTRICT 96400 MUKAH SARAWAK",SARAWAK
SERVAY EVERGREEN - SHPP,"LOT 57, PAPAR SQUARE, KG.LINGAN, JALAN PAPAR SPUR 89600 PAPAR SABAH",SABAH
ECONSAVE CASH & CARRY (KK) SDN BHD (KUBANG KERIAN),"S/54, LOT PT 1640 & PT 1685, JALAN RAJA PEREMPUAN ZAINAB II 16150 KOTA BAHRU KELANTAN",KELANTAN
MEGAMART SDN BHD (BUKIT PASIR),"NO 2,2-1,6,8 JALAN PERDAGANGAN PUSAT PERDAGANGAN BUKIT PASIR 84300 MUAR JOHOR",JOHOR
SERVAY EXPRESS - SEKV,"114, JALAN PENAMPANG TAMBUNAN KAMPUNG KIVATU 89500 PENAMPANG SABAH",SABAH
NAHMEE TRADING (M) SDN BHD - KOTA SENTOSA,"GR, FL, SL 5-6 BLOCK 18, JALAN TAPANG KOTA SENTOSA, COMM CENTRE 93250 KUCHING SARAWAK",SARAWAK
SERVAY EXPRESS - SEMB,"KG RAGANAN, JALAN TIMBOK 89200 TUARAN SABAH",SABAH
