Store,Address,State,Latitude,Longitude
99 SPEEDMART SDN BHD (SINDUMIN TOWN) - SBH 17818,"LOT 10 & 11, BANGUNAN KEDAI SOSIO EKONOMI SEDCO PEKAN BARU SINDUMIN JALAN TUN HUSSIEN ONN 89850 SINDUMIN SABAH",SABAH,4.987916,115.5270949
SBM SYUKUR ENTERPRISE,"NO 249, SIMPANG GONG KASSIM, MERCHANG 21610 MARANG TERENGGANU",TERENGGANU,4.9904889,103.3066648
SEYRA EMPIRE VENTURES,NO.10. KEDAI MDGM PASAR CHIKU 18300 GUA MUSANG KELANTAN,KELANTAN,4.9908151,102.2015262
PASARAYA SERAI MUTIARA (BATU KURAU) SDN BHD,"25, 27, 29, 31, LORONG PERMAI 1, TAMAN KURAU PERMAI, 34520 BATU KURAU, TAIPING, PERAK 34520 BATU KURAU PERAK",PERAK,4.9967362,100.8049735
SEGI FRESH BATU KURAU,"NO. 57, 59 & 61, LORONG DAMAI 1, TAMAN KURAU DAMAI, 34500 BATU KURAU PERAK",PERAK,4.9969865,100.8050784
SEGI FRESH TAMAN SERI RABAN,"NO 19-G, 19-A, 20-G, 20A TAMAN SERI RABAN LENGGONG 33400 LENGGONG PERAK",PERAK,5.0027761,100.9515585
PASAR MINI KUALA KURAU 88 ENTERPRISE,"NO.1 & 2, JALAN BESAR 34350 KUALA KURAU PERAK",PERAK,5.0079997,100.4235034
SK FRESH SUPER MART (HQ) SDN BHD (BAGAN SERAI),"NO.89, 90 & 99B, JALAN PASAR, 34300 BAGAN SERAI, PERAK. 34300 BAGAN SERAI PERAK",PERAK,5.0110485,100.5348584
ECONSAVE CASH & CARRY (BW) SDN BHD (BAGAN SERAI),LOT 9855 JALAN MAHARAJA TAMAN BAGAN SERAI 34300 BAGAN SERAI PERAK,PERAK,5.0112221,100.5304789
SUPER NYAN NYAN MINI MARKET (PASAR MINI SUPER NYAN NYAN MINI MARKET),"NO. 1, JALAN HARMONI PUSAT BANDAR 34300 BAGAN SERAI PERAK",PERAK,5.0129822,100.5354433
PASAR RAYA ANAK KURAU,NO. 1 & 3 GROUND FLOOR LINTANG AMAN 1 TAMAN KURAU AMAN 34350 KUALA KURAU PERAK,PERAK,5.0164241,100.4267173
ENG HOCK TONG TRADING,"NO. 9, JALAN PRIMA 2 PUSAT PERNIAGAAN SERAI PRIMA 34300 BAGAN SERAI PERAK",PERAK,5.0181027,100.5071526
YEW SOO TIONG,"NO 29, JALAN SERAI PERMAI 2 TAMAN SERAI PERMAI 34300 BAGAN SERAI PERAK",PERAK,5.0182185,100.5065488
HAIRUN TRADING,"KAWASAN PERNIAGAAN FELDA ANJUNG TEDUH NO LOT 21, 91150, LAHAD DATU 91150 LAHAD DATU SABAH",SABAH,5.0217779,118.3300922
PEMBORONG LASAAKU STORE,"BLOK 0, LOT 2, FASA 4 PUSAT KOMERSIAL CENDERAWASIH, PETI SURAT 60415, 91113 LAHAD DATU, SABAH 91113 LAHAD DATU SABAH",SABAH,5.0217779,118.3300922
MINI MARKET NADIA,"LOT NO 02,03,09,10 BLOK S FASA 6 PUSAT KOMERSIAL BANDAR CENDERAWASIH, 91150 LAHAD DATU 91150 LAHAD DATU SABAH",SABAH,5.0217779,118.3300922
ECONSAVE CASH & CARRY (EM) SDN BHD (LAHAD DATU 2),NO.18B JALAN GELUGOR FINANCIAL SQUARE 41050 LAHAD DATU SABAH,SABAH,5.0217779,118.3300922
TAQWA FRESH MART,"NO 6 BLOK K, FASA 2 BANDAR CENDERAWASIH, 91150 LAHAD DATU 91150 LAHAD DATU SABAH",SABAH,5.0217779,118.3300922
LABIAN MART,"KG TANJUNG LABIAN 91100, LAHAD DATU SABAH 91100 LAHAD DATU SABAH",SABAH,5.022427,118.328334
SERVAY JAYA SUPERMARKET - SJLD,"GROUND FLOOR, 2ND FLOOR, LOT 1-4, CIRCULAR BLOCK C, HARBOUR TOWN JALAN PANTAI 91100 LAHAD DATU SABAH",SABAH,5.0231168,118.3230677
PEMBORONG WANGSA GLOBAL SDN BHD,"PALM CITY CENTRE, LOT 2,3,4,5, BLOK A, JALAN PANTAI, 91100 LAHAD DATU, SABAH 91100 LAHAD DATU SABAH",SABAH,5.0234697,118.3228065
SERVAY EXPRESS - ELLR,"SHOPLOTS NOS. 2 AND 3 MILE 12, 91100 LAHAD DATU, SABAH 91100 LAHAD DATU SABAH",SABAH,5.02564,118.2971702
SERVAY HYPERMARKET - SHLD,"BANDAR SRI PERDANA PH3, JALAN SILAM 91100 LAHAD DATU SABAH",SABAH,5.0260023,118.2945669
ECONSAVE CASH & CARRY (LD) SDN BHD (LAHAD DATU),"LOT S1, SECOND FLOOR DARVEL BAY PLAZA, 91100 LAHAD DATU SABAH",SABAH,5.0291126,118.3275579
SERVAY EXPRESS SDN BHD - SELDB,"SX.KG. DESA BAJAU, BATU 4.5, JALAN TENGAH NIPAH, 91100 LAHAD DATU, SABAH. 91100 LAHAD DATU SABAH",SABAH,5.0300712,118.3401451
THARWA MARKET,"LOT 1,2,3,4,5,6 & 7 SHOPLOTS MILE 7 KAMPUNG DESA BAJAU, JALAN TENGAH NIPAH, 91100 LAHAD DATU SABAH 91100 LAHAD DATU SABAH",SABAH,5.0301954,118.3403049
MR BERJAYA BAKTI ENT,"KAMPUNG SAPAGAYA, LAHAD DATU, SABAH 91100, SABAH 91100 LAHAD DATU SABAH",SABAH,5.0324958,118.2885963
ENG HOCK TONG,NO. 4 JALAN BESAR 34300 BAGAN SERAI PERAK,PERAK,5.0339875,100.5231471
ASSALAM (SM),"BLOK A, LOT 4, PEKAN TUNGKU 91100 LAHAD DATU SABAH",SABAH,5.0343704,118.3515388
WANGSA SUPERMARKET,"MDLD 8322-MDLD 8327, LOT 16-LOT 21, LAYUN INDUSTRIAL, KM 5 JALAN TENGAH NIPAH 91100 LAHAD DATU 91100 LAHAD DATU SABAH",SABAH,5.0373818,118.3691689
TERAS JAYA,KG. MURNI NABAWAN TERAS JAYA LOT 05 89957 NABAWAN SABAH,SABAH,5.0390879,116.4322153
MESRA GROCER SDN BHD,"LOT 9 & 10 BLOCK B, GROUND FLOOR SEDCO SHOPHOUSE NABAWAN 89950 NABAWAN SABAH",SABAH,5.0436159,116.4357424
GOOD LUCK TRADING COMPANY,"KEDAI SEDCO, BLOK C, LOT NO 7, P.O BOX 12, 89957 NABAWAN 89957 NABAWAN SABAH",SABAH,5.0436159,116.4357424
PASAR MINI C & Q,"NO. 13 & 15, JALAN SRI PONGSU TAMAN SRI PONGSU 34300 BAGAN SERAI PERAK",PERAK,5.051038,100.5886139
THYE SENG MINI MARKET,NO. 9 PEKAN ALOR PONGSU 34300 BAGAN SERAI PERAK,PERAK,5.0512097,100.5897468
99 SPEEDMART SDN BHD (NABAWAN) - SBH 23319,"NT. 153033786 KG. MALINJA, NABAWAN JALAN TAWAU -KENINGAU 89957 NABAWAN SABAH",SABAH,5.0513547,116.4517246
99 SPEEDMART SDN BHD (KEMABONG) - SBH 26621,"NT. NO. 165329635 KEMABONG, JALAN TENOM – KUALA TOMANI JALAN RANAU - SANDAKAN 89900 TENOM SABAH",SABAH,5.0538605,115.9446329
ECO-SHOP PARIT BUNTAR 2,"NO. 9 (GRD & 1ST FLR MEDAN HENTIAN, PUSAT BANDAR BARU, 34200 PARIT BUNTAR PERAK",PERAK,5.0607103,100.5802623
99 SPEEDMART SDN BHD (KAMPUNG TANJUNG NIPIS) - SBH 30223,NT SERIAL NO. 193008230 KG. TANJUNG NIPIS JALAN SIPITANG – TENOM 89850 SIPITANG SABAH,SABAH,5.0693608,115.5473699
KUALA BERANG EKONOMI MINI MARKET,"461-B, JALAN AJIL - KUALA BERANG, KAMPUNG BATU 24 21700 KUALA BERANG TERENGGANU",TERENGGANU,5.073243,103.0559662
XIRI (K.BERANG) JALAN PETANI,"104-106, JALAN PETANI 21700 KUALA TERENGGANU TERENGGANU",TERENGGANU,5.0739586,103.0182177
ZHONG MINIMART,"LOT 560, TINGKAT BAWAH, JALAN SUNGAI SLOATING, 98850 98850 LAWAS SARAWAK",SARAWAK,5.0741437,115.5542606
G-MART BORNEO RETAIL SDN BHD - SIPITANG,"G*MART-SIPITANG, BLOCK C, LOT 36-40, PUSAT MEMBELI BELAH SIPITANG 89850 SIPITANG SABAH",SABAH,5.0750338,115.5484596
99 SPEEDMART SDN BHD (SIPITANG TOWN) - SBH 17718,"LOT NO. 3 & 4, BLOCK A LPPB, PHASE 3 LORONG DURIAN 89850 SIPITANG SABAH",SABAH,5.0754238,115.5498145
99 SPEEDMART SDN BHD (TENOM TOWN) - SBH 17017,"LOT NO.7 & 8, GROUND FLOOR TENOM COMMERCIAL CENTRE PHASE 2, JALAN TENOM KEMABONG 89907 TENOM SABAH",SABAH,5.0764817,115.9480306
D'SAVE,LOT 558 GROUND FLOOR JALAN SUNGAI SELOATING 98450 LAWAS SARAWAK,SARAWAK,5.0774383,115.5547957
NIRWANA MAJU (KUALA BERANG) SDN BHD,"LOT 3172, JALAN BESAR 21700 KUALA BERANG TERENGGANU",TERENGGANU,5.0777004,103.0167269
PASARAYA DM SDN BHD,"LOT 2325, KAMPUNG SUNGAI BAJAR 21700 KUALA BERANG TERENGGANU",TERENGGANU,5.0777004,103.0167269
FASME MINI MARKET,LOT 3117 KG KEPAH JALAN SUNGAI TONG 21700 KUALA BERANG TERENGGANU,TERENGGANU,5.0777004,103.0167269
ASREE MART ENTERPRISE,LOT PT 5312 KAMPUNG LANGGAR 21700 KUALA BERANG TERENGGANU,TERENGGANU,5.0777004,103.0167269
XIRI (K.BERANG) KUALA BERANG,"LOT 6811 - 6820, SUNGAI BAJAR 21700 HULU TERENGGANU TERENGGANU",TERENGGANU,5.0777004,103.0167269
BORONG MART,"LOT 8962 & 8963, HADAPAN SEK. MEN, AJIL JALAN JERANGAU 21800 AJIL TERENGGANU",TERENGGANU,5.0793716,103.089015
SABASUN HYPERRUNCIT SDN BHD (PEKAN AJIL),"NO 39-47, BLOK E, PUSAT DAGANGAN AJIL, JALAN KUALA BERANG, PEKAN AJIL, 21800 HULU TERENGGANU TERENGGANU",TERENGGANU,5.0799313,103.0817636
SK FRESH SUPER MART (KERIAN),"NO 6, 2A & 2, LINTANG BERLIAN 1, TAMAN BERLIAN, 34200 PARIT BUNTAR, PERAK. 34200 PARIT BUNTAR PERAK",PERAK,5.0847138,100.4872933
WANGSA SUPERMARKET SEGAMA,"JALAN SEGAMA, BATU 3 1/2, 91100 LAHAD DATU, SABAH 91100 LAHAD DATU SABAH",SABAH,5.0857385,118.2872859
ECO-SHOP SIPITANG,"LOT 1,2,3,4 (GROUND & FIRST FLOOR) BLOCK E SIPITANG COMMERCIAL CENTRE 89850 SIPITANG SABAH",SABAH,5.0858831,115.5518328
DMART SEGI JERANGAU,FELDA JERANGAU 21800 AJIL TERENGGANU,TERENGGANU,5.087537,103.0892866
PASAR MINI BERSATU GEMILANG,"NO.285, 285A JALAN BESAR, TANJUNG PIANDANG 34250 TANJUNG PIANDANG PERAK",PERAK,5.0902052,100.431434
ECONSAVE CASH & CARRY (PB) SDN BHD (PARIT BUNTAR),"LOT PT 140, JALAN PERUSAHAAN 1, KAWASAN PERINDUSTRIAN SIMPANG 5, 34200 PARIT BUNTAR PERAK",PERAK,5.0951864,100.4904743
CP 91 TRADING (KEDAI RUNCIT CP 91 TRADING),NO. 19. 19A JALAN TITI SERONG JALAN ATAS 34250 TANJUNG PIANDANG PERAK,PERAK,5.1032875,100.4633838
99 SPEEDMART SDN BHD (MERINTAMAN) - SBH 25920,NT SERIAL NO. 3606 KAMPUNG MERINTAMAN JALAN MERINTAMAN 89850 SIPITANG SABAH,SABAH,5.1046829,115.5595015
KEDAI RUNCIT TEMALA TANJUNG,"A25, KAMPUNG TEMALA TANJUNG 21040 MARANG TERENGGANU",TERENGGANU,5.1073001,103.1346968
LIENG HUNG INDUSTRIES SDN BHD,"CL 195055308, 9-12KM, KG SUNGAI BAULAR, NALUYA MESAPOL, 89850, SIPITANG 89850 SIPITANG SABAH",SABAH,5.1094742,115.5921228
99 SPEEDMART SDN BHD (MESAPOL TOWN) - SBH 18018,"TL 18, JALAN PEKAN MESAPOL SIPITANG P.O.BOX 18 89857 SIPITANG SABAH",SABAH,5.1099019,115.5899899
ZAINAL ABDUL HALIM ENTERPRISE,LOT 14781B JALAN TAIPING 34300 BAGAN SERAI PERAK,PERAK,5.1102759,100.4753915
SK FRESH & FROZEN SUPER MART (PARIT BUNTAR),"NO.1, 3, 5 & 7, JALAN BESTARI, PUSAT BANDAR FASA 2, 34200 PARIT BUNTAR, PERAK. 34200 PARIT BUNTAR PERAK",PERAK,5.1102759,100.4753915
99 SPEEDMART SDN BHD (TAMAN TEN SAN) - SBH 19618,LOT NO 2 & 3 (GROUND FLOOR) TAMAN TEN SAN JALAN TENOM-SAPONG 89900 TENOM SABAH,SABAH,5.110278,115.9405617
MAZNIRA TRADING,"NO.141, RKT KESEDAR, PALOH 2 18300 GUA MUSANG KELANTAN",KELANTAN,5.1111695,102.2308914
ECO-SHOP PARIT BUNTAR,"NO. 49, JALAN WAWASAN 1, TAMAN WAWASAN JAYA 34200 PARIT BUNTAR PERAK",PERAK,5.1135746,100.4828847
99 SPEEDMART SDN BHD (LINTANG BESTARI) - 2202,NO : 4 & 6 (GROUND FLOOR) LINTANG BESTARI 1 PUSAT BANDAR FASA 2 34200 PARIT BUNTAR PERAK,PERAK,5.1137035,100.4847224
LONGWAN - PARIT BUNTAR,"NO.1,JALAN WAWASAN 5,TAMAN WAWASAN JAYA,34200 PARIT BUNTAR,PERAK 34200 PARIT BUNTAR PERAK",PERAK,5.114116,100.4831348
CHOON CHEONG DEPARTMENTAL STORE (SIPITANG) SDN BHD,"LOT NO 19-21, JALAN DATUK HJ MOHD YASSIN, 89857 SIPITANG 89857 SIPITANG SABAH",SABAH,5.1153086,115.4869089
G-MART SG SDN. BHD. - PLAZA TENOM,"LOT NO. 43 & 44, ORCHARD PLAZA, TENOM SABAH HELD UNDER TITTLE COUNTRY LEASE NO. 0165319737 AND 0165319728 89900 TENOM SABAH",SABAH,5.1194629,115.9458312
BESTAMART SUPERMARKET - ORCHARD PLAZA,"SUPERMARKET LOT, ORCHARD PLAZA W.D.T NO 142 89908 TENOM SABAH",SABAH,5.1194629,115.9458312
99 SPEEDMART SDN BHD (TAMAN PEKAN BARU) - 2499,NO: LOT 4297 (GROUND FLOOR) JALAN MERBUK TAMAN PEKAN BARU 34200 PARIT BUNTAR PERAK,PERAK,5.1208023,100.4909569
99 SPEEDMART SDN BHD (KAMPUNG SIMPANGAN) - SBH 27321,CL SERIAL NO.165320454 KG. TUAN 89907 TENOM SABAH,SABAH,5.1234357,115.9437318
G-MART BORNEO RETAIL SDN BHD - TENOM,"G*MART-TENOM, TL183, PERSIMPANGAN JALAN ELEZEBETH DAN JALAN CHARLES, PEKAN TENOM 89908 TENOM SABAH",SABAH,5.1236928,115.9427108
PEMBORONG AI ZHEN 88,"KG PADAS VALLEY, JALAN SIPITANG, BEAUFORT 89800 BEAUFORT SABAH",SABAH,5.1253559,115.6306265
MYDIN WHOLESALE HYPERMARKET PARIT BUNTAR,"KERIAN SENTRAL MALL LOT 23252, JALAN SEKOLAH 34200 PARIT BUNTAR PERAK",PERAK,5.1263522,100.4827202
OCO MART (WAKAF TAPAI),PT14660-14664 TAMAN TAPAI INDAH WAKAF TAPAI 21040 MARANG TERENGGANU,TERENGGANU,5.1266447,103.0854472
99 SPEEDMART SDN BHD (SETIA JAYA) - 2743,NO 6 & 8 (GROUND FLOOR) JALAN ASUHAN PUSAT PERNIAGAAN SETIA JAYA 34200 PARIT BUNTAR PERAK,PERAK,5.1267854,100.4840593
BATARAS SUPERSTORE TENOM,TL 167501340 89907 TENOM SABAH,SABAH,5.127087,115.943932
EASY MART TRADING,"LOT 12285, BATU 13 KG DURIAN GULING, JALAN KUALA BERANG 21040 MARANG TERENGGANU",TERENGGANU,5.1290773,103.085145
ZAMREE RUNCIT & FROZEN (DURIAN GULING),LOT 11580 KAMPUNG DURIAN GULING 21040 MARANG TERENGGANU,TERENGGANU,5.1290773,103.085145
99 SPEEDMART SDN BHD (KAMPUNG PAAL) - SBH 28322,CL. NO. 165274091 KAMPUNG PAAL JALAN TENOM - KEMABONG 89900 TENOM SABAH,SABAH,5.1301456,115.9425006
ECONSAVE CASH & CARRY (LG) SDN BHD (LENGGONG),"NO. 1, JALAN L/8 UTAMA PUSAT PERNIAGAAN LENGGONG 8 33400 LENGGONG PERAK",PERAK,5.1304895,100.9846035
ZAMREE FROZEN MART (WAKAF TAPAI),"LOT 7577 & 7578, TINGKAT BAWAH, PERKEDAIAN WAKAF TAPAI 21040 MARANG TERENGGANU",TERENGGANU,5.1343137,103.0859696
99 SPEEDMART SDN BHD (SOOK) - SBH 26421,NT SERIAL NO. 85130847 SOOK BATU 24 ½ JLN NABAWAN TWU 89009 KENINGAU SABAH,SABAH,5.1452056,116.3059592
JN SHOP'S,"BLOCK H, LOT 2, KEDAI SEDCO FASA 111, PEKAN SOOK, 89000 KENINGAU 89000 KENINGAU SABAH",SABAH,5.1452056,116.3059592
LS SUPERMARKET,"JALAN TULID 0.5KM, PEKAN KECIL SOOK 89000 KENINGAU 89000 KENINGAU SABAH",SABAH,5.1458904,116.3068865
BESTAMART SDN BHD - TENOM,"LOT 1-9, TENOM COMMERCIAL CENTRE 89900 TENOM SABAH",SABAH,5.150215,115.9538176
SMS MAJU SOLUTIONS,KAMPUNG JEREK BARU 18300 GUA MUSANG KELANTAN,KELANTAN,5.1573999,102.0220512
PASARAYA XIRI SDN BHD (WAKAF TAPAI),"LOT 52502, JALAN KUALA BERANG, WAKAF TAPAI 21040 MARANG TERENGGANU",TERENGGANU,5.1618309,103.0853057
PASARAYA SINAR MEGA,"8920, 8921, 8922, 8923 BANDAR MARANG 21600 MARANG TERENGGANU",TERENGGANU,5.166154,103.194486
SULIANA SHOP ENTERPRISE,"C4 RUMAH KEDAI, DARAT PAKCHAN 21600 MARANG TERENGGANU",TERENGGANU,5.166154,103.194486
MINI MART AWAK (KELULUT),"LOT 10861, TAMAN KOPERAT PERDANA, KAMPUNG KELULUT 21600 MARANG TERENGGANU",TERENGGANU,5.166154,103.194486
SEGI FRESH NIBONG TEBAL,NO. 2G & 6G LORONG SERI EMAS INDAH 2 TAMAN SERI EMAS INDAH 14300 NIBONG TEBAL PENANG,PENANG,5.1718395,100.4634971
ECONSAVE CASH & CARRY (JW) SDN BHD (JAWI),LOT 326 LORONG INDUSTRI 7 14300 SEBERANG PERAI SELAT PENANG,PENANG,5.172434,100.4918777
TRELEAF MART (RHU MUDA),"LOT 1039 AZ2, AZ3, AZ4 JALAN DUNGUN, KG RHU MUDA 21600 MARANG TERENGGANU",TERENGGANU,5.1815429,103.2245098
C-MART (NIBONG TEBAL),"KOMPLEK INDUSTRI CENDERAWASIH JALAN BESAR, MUKIM 11 SEBERANG PERAI SELATAN 14300 NIBONG TEBAL PENANG",PENANG,5.1830431,100.4848404
PASARAYA AWAK,LOT 1032-F KAMPUNG RHU MUDA 21600 MARANG TERENGGANU,TERENGGANU,5.1883059,103.2165875
SERVAY EXPRESS SDN BHD - SETN,"C-STORE SETN PARCEL OF THE LAND HELD UNDER CL1651298222 LOCATED 6 KM, JALAN LAGUD TENOM KENINGAU IN THE DISTRICT OF TENOM, 89907 TENOM 89907 TENOM SABAH",SABAH,5.1983316,115.9764003
ECO-SHOP SERDANG AVENUE,"10A, 11A & 12A (GRD FLR, JALAN TENGAH, SERDANG AVENUE, 09800 SERDANG, KEDAH 09800 SERDANG KEDAH",KEDAH,5.2104279,100.6131967
99 SPEEDMART SDN BHD (TMN SERULING EMAS) - 2618,"NO: 103 & 105 (GROUND FLOOR), JALAN SUNGAI DURI TAMAN SERULING EMAS 14200 SUNGAI JAWI PENANG",PENANG,5.2112185,100.5086193
99 SPEEDMART SDN BHD (SERDANG AVENUE) – 3119,"NO : 13A & 14A (GROUND FLOOR) JALAN TENGAH, SERDANG AVENUE, 09800 SERDANG KEDAH",KEDAH,5.2116622,100.6133373
PASARAYA MARANG,LOT 435 KIJING 21600 MARANG TERENGGANU,TERENGGANU,5.213321,103.2008977
SUCCESS SUPERMARKET,NO. 1 JALAN SRI PERMAI TAMAN SRI PERMAI 34100 SELAMA PERAK,PERAK,5.2139303,100.6952224
SELAMA FRESH & FROZEN FOOD MARKET,"NO. 7 JALAN MENTARI, LINTASAN RELAU 34100 SELAMA PERAK",PERAK,5.2192131,100.6949483
HOME MART FRESH & FROZEN SDN BHD - SELAMA,"LOT 5862 & 9710, TITI SUNGAI KERIAN, JALAN SIR CHULAN 34100 SELAMA PERAK",PERAK,5.2230346,100.6878237
SEGI FRESH SELAMA,"N0. 15, 16, 17 & 18 PERSIARAN IXORA PUSAT PERNIAGAAN IXORA 34100 SELAMA PERAK",PERAK,5.2249754,100.6892268
PERNIAGAAN KASMADI,"LOT 974-A, JALAN RAWAI, KAMPUNG RAWAI BUKIT PAYONG 21400 MARANG TERENGGANU",TERENGGANU,5.2291169,103.0982511
PASARAYA SERI INTAN SDN BHD,"LOT 8222 JALAN KUALA BERANG, BATU 8 1/2, PEKAN BUKIT PAYONG 21400 MARANG TERENGGANU",TERENGGANU,5.2320628,103.1023649
MINI MART AWAK (BUKIT PAYONG),"NO.3,4,5,5A, RUMAH KEDAI LOT 38 PEKAN BUKIT PAYONG, JLN BUKIT PAYONG 21400 MARANG TERENGGANU",TERENGGANU,5.233012,103.1017463
OCO MART (MARANG),LOT 413C KAMPUNG BINJAI BONGKOK 21400 MARANG TERENGGANU,TERENGGANU,5.2348933,103.0972906
ZURAINA ENTERPRISE (PASAR MINI MAK LANG FROZEN),NO. 18 JALAN BESAR RANTAU PANJANG 34140 RANTAU PANJANG PERAK,PERAK,5.2365067,100.7285151
TRELEAF MART (BUKIT PAYONG 2),"LOT 14433, UNIT C, D, E, F, G, JALAN SURAU HAJI MAT ZIN BUKIT PAYONG 21400 MARANG TERENGGANU",TERENGGANU,5.2390593,103.1026733
99 SPEEDMART SDN BHD (TMN RASA RIA) - 3028,"NO : 1337 & 1338 (GROUND FLOOR), JALAN PUNGGUK, TAMAN RASA RIA, 14200 SUNGAI JAWI PENANG",PENANG,5.2401706,100.4937648
IZR MULTINIAGA ENTERPRISE,LOT 5783 BELAKANG DEVAN KAMPUNG KUALA SUNGAI RAMBUTAN 34140 RANTAU PANJANG PERAK,PERAK,5.2402941,100.7304785
URBAN PANTRY GROCERIES AND PROVISIONS,"LOT G.52 - G.56, DESIGN VILLAGE OUTLET MALL, 733, JALAN CASSIA BARAT 2, 14110 BATU KAWAN, PULAU PINANG 14110 BATU KAWAN PENANG",PENANG,5.2440117,100.4382786
PASARAYA EKONOMI A-WANG (GERIK) SDN BHD - LAWIN,"LOT 3078, MUKIM KENERING 33300 LAWIN PERAK",PERAK,5.2454625,101.0705918
TRELEAF MART (KEDAI BULOH),"LOT 1005, KAMPUNG KEDAI BULOH, 21070 KUALA TERENGGANU TERENGGANU",TERENGGANU,5.247485,103.135212
PASARAYA AURA ALAM ENTERPRISE,"LOT 6782, KAMPUNG TOK DIR 21070 KUALA TERENGGANU TERENGGANU",TERENGGANU,5.2477922,103.1329212
TRELEAF MART (RUSILA),"LOT 9495-A, 9495-B, 9495-C KAMPUNG RHU RENGGEH RUSILA 21080 MARANG TERENGGANU",TERENGGANU,5.2508403,103.1813278
Q MART (SURAU PANJANG),"LOT 1577-F, RUMAH KEDAI, KG. SURAU PANJANG 21070 KUALA TERENGGANU TERENGGANU",TERENGGANU,5.2510702,103.1389299
ZAMREE MART (LIMBAT),"NO.1A & 2A, TINGKAT BAWAH PERKEDAIAN MDM DATARAN SRI LIMBAT 21040 MARANG TERENGGANU",TERENGGANU,5.2540812,103.09303
TRELEAF MART (BUKIT PAYONG),"LOT 10066-10068, KUBANG TANJUNG, BUKIT PAYONG, 21400 MARANG TERENGGANU",TERENGGANU,5.256801,103.095891
XIRI (K.BERANG) BUKIT PAYUNG,"LOT 70006-70008, TAMAN PERUMAHAN BUKIT PAYUNG PUTERA BUKIT PAYUNG 21400 MARANG TERENGGANU",TERENGGANU,5.256801,103.095891
SYARIKAT MERBAU JAYA,"LOT 4853 B,KAMPUNG TASEK, WAKAF DUA BUKIT PAYONGG 21400 MARANG TERENGGANU",TERENGGANU,5.256801,103.095891
OCO MART (BUKIT PAYONG),"LOT 11309 (NO.5), JALAN KUALA BERANG BANGUNAN, KEDAI TAMAN SAFIAH MURNI BUKIT PAYONG 21400 MARANG TERENGGANU",TERENGGANU,5.256801,103.095891
TRELEAF MART (BINJAI RENDAH),"PT 8911-G, 8912-G, RUMAH KEDAI TAMAN MEWAH, BINJAI RENDAH, BUKIT PAYONG 21400 MARANG TERENGGANU",TERENGGANU,5.256801,103.095891
OCO MART,NO-14-A(1670) TINGKAT BAWAH JALAN SATU TAMAN PADANG MIDIN 21400 KUALA TERENGGANU TERENGGANU,TERENGGANU,5.263959,103.099515
TMG EXPRESS 3000 (CHENDERING) SDN BHD,"PT 3425, 3426 & 3427, GROUND FLOOR CHENDERING HEIGHT 21080 KUALA TERENGGANU TERENGGANU",TERENGGANU,5.2654636,103.1776258
IQI MINI MART,"78-A, KAMPUNG BELADAU SELAT 20050 KUALA TERENGGANU TERENGGANU",TERENGGANU,5.2673911,103.0849537
PACIFIC GROCER & DEPARTMENT STORE (KTCC MALL),"G888 & 1 888, KTCC MALL, MUARA SELATAN 20000 KUALA TERENGGANU TERENGGANU",TERENGGANU,5.2737636,103.1669407
TRELEAF MART (KAMPUNG LAUT),"LOT 8341, KAMPUNG LAUT, MUKIM PENGADANG BULUH 21080 KUALA TERENGGANU TERENGGANU",TERENGGANU,5.2743755,103.1429014
PASAR RAYA DESA SEGAR (KUALA TERENGGANU),"LOT 1927, 1928 & 1929, BANGUNAN PERKASA, MUKIM GELUGOR KEDAI, JALAN KUALA BERANG, KAMPUNG PENGADANG BARU, 21400 KUALA TERENGGANU TERENGGANU",TERENGGANU,5.2761638,103.1166761
BATARAS SUPERSTORE FINANCIAL PARK,"UNIT E011, GROUND FLOOR, FINANCIAL PARK LABUAN COMPLEX, JALAN MERDEKA 87000 LABUAN W.P LABUAN",W.P LABUAN,5.2764306,115.249388
TRELEAF MART (CHENDERING),"PT 2025K, PT 2026K & PT 2027K, KAW. PERUMAHAN CENDERING, KUALA IBAI 20400 KUALA TERENGGANU TERENGGANU",TERENGGANU,5.2764666,103.1714635
LAWAS SUPERMARKET & HARDWARE SDN BHD,"LOT 425, 430 & 431, JALAN MASJID BARU 98850 LAWAS SARAWAK",SARAWAK,5.276952862,100.2691909
TELIPOT TRADING,"LOT 427 BATU 5, JALAN KEPONG, PENGADANG BARU 20050 KUALA TERENGGANU TERENGGANU",TERENGGANU,5.2770406,103.1016133
SUNYALA - LABUAN SUPERMARKET,"LOT 35-38,JALAN MUHIBBAH 87000 LABUAN W.P LABUAN",W.P LABUAN,5.2785603,115.242376
SUNYALA - MILIMEWAH SUPERSTORE,"LOT 22-27,LAZENDA COMMERCIAL CENTRE,PHASE II 87000 LABUAN W.P LABUAN",W.P LABUAN,5.2789437,115.246853
C-MART 7 SDN BHD (SIMPANG AMPAT),"NO 1720,PERSIARAN MUTIARA 4 PUSAT KOMERSIAL BANDAR TASEK MUTIARA 14120 SIMPANG AMPAT PENANG",PENANG,5.2835124,100.4921512
MYDIN EMPORIUM KUALA IBAI,"LOT 1584, JALAN TOK ADIS KUALA IBAI 20400 KUALA TERENGGANU TERENGGANU",TERENGGANU,5.2849392,103.1665634
PASARAYA IKHWAN (WATIKAH ILHAM SDN BHD),"NO. 2, MUKIM 9 TINGKAT TELUK KUMBAR 4 BANDAR BARU PERDA 11920 BAYAN LEPAS PENANG",PENANG,5.2877441,100.2786579
TRELEAF MART (GONG TOK NASEK),"NO. 1246-A & 1246-B, KG GONG TOK NASEK, JALAN PANJI ALAM 21100 KUALA TERENGGANU TERENGGANU",TERENGGANU,5.2899855,103.1501315
ALI HYPER MARKET,"97A, 97B, 97C, KAMPUNG PADANG MIDIN 20050 KUALA TERENGGANU TERENGGANU",TERENGGANU,5.2907326,103.1241697
Q MART (BUKIT BAYAS),"LOT 68 & 69, JALAN PASIR PANJANG 21100 KUALA TERENGGANU TERENGGANU",TERENGGANU,5.2907589,103.131463
RIA MART (KUALA TERENGGANU),"PT3599-PT3608, JALAN ALAM MUTIARA 2/1, TOK MOLOR 21100 KUALA TERENGGANU TERENGGANU",TERENGGANU,5.2915891,103.1501259
MESRA MUSLIM (M) SDN BHD,"843-A & 843-B, KG MERBAU PATAH 20050 KUALA TERENGGANU TERENGGANU",TERENGGANU,5.2955933,103.1090418
99 SPEEDMART SDN BHD (KAMPUNG KILUGUS) - SBH 28722,NT SERIAL NO. 184927044 KAMPUNG KILUGUS JALAN BEAUFORT-MENUMBOK 89740 KUALA PENYU SABAH,SABAH,5.2964836,115.3496143
AZ MINI MART (KP PERDANA),"PT 1898, TK BAWAH RUMAH KEDAI, TAMAN KP PERDANA, KG KUBANG PARIT 20050 KUALA TERENGGANU TERENGGANU",TERENGGANU,5.2971635,103.1144387
TRELEAF MART (TELUK MENARA),"LOT 12051, (GM8778), TELUK MENARA, MUKIM MANIR 21020 KUALA TERENGGANU TERENGGANU",TERENGGANU,5.3014247,103.0844036
99 SPEEDMART SDN BHD (BATU 27) - SBH 29623,CL SERIAL NO. 135109616 BATU 27 JALAN TENOM – KENINGAU 89000 KENINGAU SABAH,SABAH,5.3025039,116.0728349
PASARAYA ECONO (SERDANG),"NO.1, 2 & 3, SERDANG MART TAPAK PASAR MALAM LAMA 09800 SERDANG KEDAH",KEDAH,5.3033123,100.7044557
SEGI FRESH SERDANG KEDAH,"NO.10-G, 11-G & 12-G KOMPLEKS UMNO JALAN RAYA 09800 SERDANG KEDAH",KEDAH,5.3033123,100.7044557
PASAR MINI SING KEAN JOO,"NO. 21, 22, 23, JALA RAYA LUBOK BUNTAR, 09800 SERDANG, KEDAH 09800 SERDANG KEDAH",KEDAH,5.3033123,100.7044557
AZ MINI MART (PULAU MUSANG),"LOT 1009B, KAMPUNG BUKIT KUBANG JAMBU, JALAN PULAU MUSANG 20050 KUALA TERENGGANU TERENGGANU",TERENGGANU,5.3035078,103.0978864
TRELEAF MART (PASIR PANJANG),"LOT 3440B, JALAN BUKIT BESAR, 21000 KUALA TERENGGANU TERENGGANU",TERENGGANU,5.3049959,103.1307841
SERVAY EVERGREEN SDN BHD - SJTLK,"NT133068461, LOT 1, KAMPUNG TULID 89007 KENINGAU SABAH",SABAH,5.3076571,116.1656589
99 SPEEDMART SDN BHD (KG TUARID TAUD) - SBH 23819,CL SERIAL NO. 135334959 LOT 1 NO. 135334968 LOT 2 TUARID TAUD 89007 KENINGAU SABAH,SABAH,5.3076571,116.1656589
BATARAS HYPERMARKET LABUAN,"SU3588, KG. BATU ARANG JALAN TUN MUSTAPHA 87000 LABUAN W.P LABUAN",W.P LABUAN,5.3104294,115.2345011
GIANT HYPERMARKET (KUALA TERENGGANU),H.S (D) LOT PT 1485 MUKIM CABANG TIGA JALAN PADANG HILIRAN 21100 KUALA TERENGGANU TERENGGANU,TERENGGANU,5.3107546,103.131596
MYDIN HYPERMARKET KUALA TERENGGANU,LOT 1547 & 1548 JALAN SULTAN MOHAMAD 21000 KUALA TERENGGANU TERENGGANU,TERENGGANU,5.3107819,103.1264477
SAVEMORE SUPERMARKET PLT,LOT 8-14 BUKIT GARDEN KG BUKIT KALAM JALAN MOHD SALLEH 87000 LABUAN W.P LABUAN,W.P LABUAN,5.3109549,115.2244853
SABASUN HYPERRUNCIT SDN BHD (BUKIT KECIL),"1125, JALAN BUKIT KECIL, 21100 KUALA TERENGGANU TERENGGANU",TERENGGANU,5.3147494,103.1362258
TRELEAF MART (CABANG TIGA),"NO. 8, NO. 9 & NO. 10, TINGKAT BAWAH, PUSAT KOMERSIAL CABANG TIGA, 21000 KUALA TERENGGANU TERENGGANU",TERENGGANU,5.3149632,103.1223931
AZ MINI MART (LOSONG),"LOT 60173 (TINGKAT BAWAH), WISMA KODIKA, KAMPUNG LOSONG HAJI MAT SHAFIE 20050 KUALA TERENGGANU TERENGGANU",TERENGGANU,5.3163723,103.1134278
99 SPEEDMART SDN BHD (MENUMBOK TOWN) - SBH 21019,"CL. 185121975 PEKAN MENUMBOK, PETI SURAT 16 JALAN KASTAM, MENUMBOK 89767 KUALA PENYU SABAH",SABAH,5.3165794,115.3696844
GIANT HYPERMARKET GHBB (BAYAN BARU),"NO 78, JALAN TENGAH, BAYAN BARU 11900 BAYAN LEPAS PENANG",PENANG,5.3207073,100.2841641
G-MART SG SDN BHD - KG TULID,"LOT 4, TULID POINT, KAMPUNG TULID, KENINGAU SABAH MEASURING APPROXIMATELY 2000SQ.FT. HELD UNDER NT.133068461 IN THE DISTRICT OF KENINGAU. 89000 KENINGAU SABAH",SABAH,5.3226488,116.4205802
TRELEAF MART (KUBANG JELA),"LOT 8267, GM1000, KAMPUNG KUBANG JELA, MUKIM MANIR, 21200 KUALA TERENGGANU TERENGGANU",TERENGGANU,5.3240533,103.0801231
XIRI (K.BERANG) MUKIM MANIR,"LOT 8217, MUKIM MANIR, KAMPUNG KUBANG JELA 21200 KUALA TERENGGANU TERENGGANU",TERENGGANU,5.3240533,103.0801231
SERVAY EVERGREEN SDN BHD - SJTNK,"LOT NO 1&2, LOCATED AT BATU 27, KENINGAU-TENOM ROAD IN THE DISTRICT OF KENINGAU 89000 KENINGAU SABAH",SABAH,5.3249764,116.1182199
SUNSHINE SQUARE,"1, JALAN MAYANG PASIR BAYAN BARU 11950 BAYAN LEPAS PENANG",PENANG,5.3249938,100.2852255
HAP HUAT SUPERSTORE SDN BHD,"LOT 13-18, BLOCK B, COURT INDUSTRIAL PARK KAMPUNG DURIAN TUNJONG 87000 LABUAN W.P LABUAN",W.P LABUAN,5.3253769,115.2338891
ECONO EXPRESS (SUNGAI ARA),"NO. 1022, GROUND FLOOR, JALAN DATO ISMAIL HASHIM SUNGAI ARA 11900 BAYAN LEPAS PENANG",PENANG,5.3260897,100.2716524
CKS SUPERMARKET KENINGAU,"LOT 1-9, 16-23, GRD FLOOR, THE PAMPANG COVE KG LIMBAWAN, JALAN KENINGAU-TENOM HIGHWAY 89000 KENINGAU SABAH",SABAH,5.3303373,116.1511186
THE STORE (PLAZA PAYA BUNGA),GROUND FLOOR & 1ST FLOOR PLAZA PAYA BUNGA JALAN TOK LAM 20100 KUALA TERENGGANU TERENGGANU,TERENGGANU,5.3324566,103.1386682
PACIFIC HYPERMARKET (KTCC MALL),"G-888 & 1-888 TINGKAT BAWAH & TINGKAT SATU,KTCC MALL JALAN SULTAN ZAINAL ABIDIN 20000 KUALA TERENGGANU TERENGGANU",TERENGGANU,5.3325563,103.1500288
SERVAY EXPRESS - SEAN,"NT 133062512, JALAN APIN-APIN KENINGAU 89008 KENINGAU SABAH",SABAH,5.3329711,116.1534486
99 SPEEDMART SDN BHD (APIN-APIN) - SBH 19818,NATIVE TITLE NO.133054636 APIN-APIN JALAN TAMBUNAN-KENINGAU 89000 KENINGAU SABAH,SABAH,5.3329711,116.1534486
PASARAYA BARAKAH,"NO. 36 & 38 G, JALAN SUNGAI NIPAH TAMAN NIPAH MAS 11000 BALIK PULAU PENANG",PENANG,5.3335788,100.216225
ANWARDEEN MINI & FRESH MART,"24-G, LEBUH RELAU 2, TAMAN DESA RELAU, 11900 BAYAN LEPAS, PULAU PINANG 11900 BAYAN LEPAS PENANG",PENANG,5.3338178,100.2658073
