Store,Address,State,Latitude,Longitude
NAHMEE TRADING (M) SDN BHD - GEDONG,"SL-1-4, LOT 399-402 BLOCK 18, MELIKIN LAND DISTRICT SERIAN - SRI AMAN ROAD 94700 SERIAN SARAWAK",SARAWAK,1.0333333,110.7666667
NAHMEE TRADING (M) SDN BHD - MELIKIN,"SL-1-4, LOT 399-402 BLOCK 18, MELIKIN LAND DISTRICT SERIAN - SRI AMAN ROAD 94700 SERIAN SARAWAK",SARAWAK,1.0333333,110.7666667
JIT SIANG (LUBOK ANTU),NO 47&48 PEKAN LUBOK ANTU 95900 LUBOK ANTU SARAWAK,SARAWAK,1.0429341,111.8328377
LIK SENG MARKETING SDN BHD,"LOT 167, LUBOK ANTU BAZAAR, LUBOK ANTU, 95900 LA, SARAWAK 95900 LUBOK ANTU SARAWAK",SARAWAK,1.0429341,111.8328377
TAN KIANG SENG,NO. 11 LUBOK ANTU BAZAAR 95900 LUBOK ANTU SARAWAK,SARAWAK,1.0429341,111.8328377
SIN JEE FATT,"NO. 10, 91 MILE KUCHING, SERIAN ROAD, LACHAU BAZAAR 95000 LACHAU SARAWAK",SARAWAK,1.084645,111.1854611
JAP TRADING,"NO 5 PASAR ENGKILILI 95800, ENGKILILI 95800 ENGKILILI SARAWAK",SARAWAK,1.134467,111.6400354
TECK HENG,"NO 57, ENGKILILI BAZAAR, 95800 ENGKILILI 95800 ENGKILILI SARAWAK",SARAWAK,1.134467,111.6400354
D&J MINI MARKET,"NO. 44, ENGKILILI BAZAAR, 95800 ENGKILILI 95800 ENGKILILI SARAWAK",SARAWAK,1.134467,111.6400354
YAK HENG,"NO. 54, PASAR ENGKILILI 95800 ENGKILILI SARAWAK",SARAWAK,1.1354764,111.653083
CHOP JIN SHIN,"NO 32, ENGKILILI BAZAAR 95800 ENGKILILI SARAWAK",SARAWAK,1.1354764,111.653083
CC MART,"GF, S/LOT 260 NO. 61 JALAN PASAR ENGKILILI 95800 ENGKILILI SARAWAK",SARAWAK,1.1499379,111.6467952
ECO-SHOP SERIAN,"NO. 67, 68, 69, 70 LOT 1397 BUKAR SADONG LAND DISTRICT 94700 SEIAN SARAWAK",SARAWAK,1.158326,110.570571
NAHMEE TRADING (M) SDN BHD - BATU 11,"NO.254-255, LOT 2584-2585 GR FL 26-27, BLOCK 83 KCLD TAMAN EDEN FIELDS BATU 94700 SERIAN SARAWAK",SARAWAK,1.167035,110.5665059
PASARAYA SIN JOON MIAW,NO. 102-106 SERIAN BAZAAR 94700 SERIAN SARAWAK,SARAWAK,1.167672,110.567197
SYN LIAN SHIN COMPANY,"NO. 22, SERIAN BAZAAR 94700 SERIAN SARAWAK",SARAWAK,1.167672,110.567197
CHUN LIAN CO.,"NO. 2 TARAT BAZAAR, JALAN KUCHING/SERIAN 94700 SERIAN SARAWAK",SARAWAK,1.1725047,110.5745883
SEN SEN DEPARTMENTAL STORE (SERIAN PIAZZA),LOT 1363 TO 1368 SERIAN PIAZZA JALAN DATUK MICHEAL BEN 94700 SERIAN SARAWAK,SARAWAK,1.1740265,110.5657631
SYN LIAN SHIN SDN BHD,"LOT 852, LORONG 2, JALAN INDUSTRIAL SERIAN BAHAGIAN SERIAN 94700 SERIAN SARAWAK",SARAWAK,1.1815602,110.568722
EVERWIN CENTRE (SERIAN) SDN BHD,"GF & 1ST FLOOR, SL 2-15, LOT 1270 & 1271, STLD, JALAN SERIAN BY-PASS 94700 SERIAN SARAWAK",SARAWAK,1.1815701,110.5686501
NAM LEONG - SRI AMAN,"LOT 1075 & 1076 BLOCK 4, STD ,JALAN SABU 95000 SRI AMAN SARAWAK",SARAWAK,1.1996748,111.4719172
DOREMART SRI AMAN OLD TOWN,"NO.29-31, LOT 1519, BLOCK 2, SIMANGGANG TOWN DISTRICT 95000 SRI AMAN SARAWAK",SARAWAK,1.2163304,111.4848759
WANG FATT COLDSTORAGE,"NO 36, LOT 719, 2S-TRH, ELO 8 NEW BAKI BAZAAR AREA, SERIAN 94700 SERIAN SARAWAK",SARAWAK,1.226696,110.5123862
NAHMEE WHOSALE (M) SDN BHD - SERIAN,"GR FL SL 1-9, LOT 1004, BLOCK 14 SSLD SOUTHLAND COMMERCIAL CENTRAL CENTRE 22ND MILE, KUCHING-SERIAN ROAD 94200 SERIAN SARAWAK",SARAWAK,1.229613,110.504993
ALDI SUPERMARKET SDN. BHD.,"LOT 20 - 27 BLOCK 3, JALAN HOSPITAL 95000 SRI AMAN SARAWAK",SARAWAK,1.23465,111.462827
FAMILY W GROCER (SIMANGGANG),"G1 TO G6, LOT 1660 SIMANGGANG TOWN DISTRICT 95000 SRI AMAN SARAWAK",SARAWAK,1.2368874,111.4605756
ECO-SHOP SRI AMAN,SECOND FLOOR LOT 532 BLOCK 3 SRIMANGGANG TOWN DISTRICT 95000 SRI AMAN SARAWAK,SARAWAK,1.2368874,111.4605756
DOREMART SRI AMAN NEW TOWN,"BLOCK C, LOT 1660 BLOCK 2, SIMANGGANG TOWN DISTRICT 95000 SRI AMAN SARAWAK",SARAWAK,1.237031,111.462079
DAY 2 DAY CONVENIENCE STORE,"GRD FLOOR OF SUBLOT 409 OF PARENT, LOT 362 BLOCK 8 BUKAR SADONG LAND DISTRICT JALAN KUCHING SERIAN 94700 SERIAN SARAWAK",SARAWAK,1.242061,110.4954322
COOPMART KPGB,D/A ANJUNG USAHAWAN GEDONG 94800 SIMUNJAN SARAWAK,SARAWAK,1.2420707,110.6857468
LACHAU MINI MART,NO.8 PASAR BARU LANCHAU 95000 SRI AMAN SARAWAK,SARAWAK,1.2466673,111.4573224
H&L RETAIL SDN BHD (KS),"PARCEL NO.100, LVL 1 KUCHING CENTRAL, JALAN PENRISSEN 93250 KUCHING SARAWAK",SARAWAK,1.2959949,110.4133028
CHOP KWEK HUA,NO 33 NEW BAZAAR 94800 SIMUNJAN SARAWAK,SARAWAK,1.2999035,110.7340245
LYH VALUE ENTERPRISE,"NO.3, BAZAAR LINGGA LINGGA 94900 SRI AMAN SARAWAK",SARAWAK,1.30561,111.196352
GUAN SING TRADING,NO.11 LINGGA BAZAAR LINGGA SRI AMAN 94900 LINGGA SARAWAK,SARAWAK,1.30561,111.196352
BS SUPERMART SDN BHD (TAPAH),"SHOPLOT NO.9-12 OF PARENT LOT 1028, BLOCK 12, SENTAH SEGU LAND DISTRICT, BATU 22, JALAN KUCHING-SERIAN 94500 TAPAH SARAWAK",SARAWAK,1.3056853,110.4065123
GMART BETONG,"LOT 382, BETONG TOWN DISTRICT, BETONG BAZAAR 95700 BETONG SARAWAK",SARAWAK,1.3060428,111.6183755
MEDAN DEPARTMENTAL STORE SDN BHD,"LOTS 1971-1977, BLOCK 9, BATU API LAND DISTRICT, BETONG NEW TOWNSHIP 95700 BETONG SARAWAK",SARAWAK,1.3060428,111.6183755
KELUARGA BETONG,"SUBLOT NO. 1 (SURVEY LOT 1470) PARENT LOT 558, BETONG TOWN DISTRICT 95700 BETONG SARAWAK",SARAWAK,1.3060428,111.6183755
GS MART (KUKUP LAUT),NO 11-G & 13- G JALAN ZAMRUD 1 PUSAT DAGANGAN KUKUP 82300 KUKUP JOHOR,JOHOR,1.3248256,103.4445703
GS MART (HQ),"LOT. 1937, JALAN KUKUP LAUT KUKUP JOHOR DARUL TAKZIM 82300 KUKUP JOHOR",JOHOR,1.3368022,103.4624933
KUKUP GUAN SENG SDN.BHD. (HQ),"LOT. 1937, JALAN KUKUP LAUT KUKUP JOHOR DARUL TAKZIM 82300 PONTIAN JOHOR",JOHOR,1.3368022,103.4624933
CHOP GUAN SENG (GS MART KUKUP),LOT 1937 JALAN KUKUP LAUT KUKUP 82300 PONTIAN JOHOR,JOHOR,1.3368022,103.4624933
GS MART (PERMAS KUKUP),"NO 35& 36, JALAN LAKSAMANA SATU TAMAN LAKSAMANA 82300 KUKUP JOHOR",JOHOR,1.3410954,103.4614714
KK SUPER MART (BATU 17 KUCHING),"NO.71, SIBURAN BAZAAR, LOT 914, SENTAH SEGU DISTRICT 94200 KUCHING SARAWAK",SARAWAK,1.3512168,110.3865463
ECONSAVE CASH & CARRY (AD) SDN BHD (TELUK RAMUNIA),"NO 1-11, LOT 741 TELUK RAMUNIA 81600 SUNGAI RENGIT JOHOR",JOHOR,1.3535204,104.2251287
FRESH HUB (PENGERANG),"NO C,D,E & F JALAN TELUK RAMUNIA SUNGAI RENGIT 81620 PENGERANG JOHOR",JOHOR,1.3572169,104.2299345
SIN KIT HIN,"23,17TH MILE BAZAAR,KUCHING/SERIAN ROAD, 94200, SIBURAN 94200 SIBURAN SARAWAK",SARAWAK,1.3637463,110.4042805
ECO-SHOP SIBURAN,"SUBLOT 61-65 OF LOT 1968 BLOCK 6 SENTAH-SEGU LAND DISTRICT 17TH MILE, JALAN KUCHING-SERIAN, ROAD 94200 KUCHING SARAWAK",SARAWAK,1.3657564,110.4029068
EVERWIN CENTRE (11 MILES) SDN BHD,"NO.6, LOT 118, BLOCK 82 KCLD, JALAN KUCHING/SERIAN, BATU 11 93250 KUCHING SARAWAK",SARAWAK,1.3727703,110.3896134
WAN HO 55 MART,"1, PTD 7129 JLN PERSIARAN BAYU DAMAI 1/3 TAMAN BAYU DAMAI 81600 PENGERANG JOHOR",JOHOR,1.3865362,104.2749596
HAKRI FOOD MARKETING SDN.BHD.,NO 72-75 LOTS 910-915.STD SIBURAN BAZAAR BATU 17 JALAN KUCHING/SERIAN 94200 KUCHING SARAWAK,SARAWAK,1.3887715,110.3626512
B.J.S TRADING,"NO.29, PASAR BARU, SIMUNJAN 94800 KUCHING SARAWAK",SARAWAK,1.3955284,110.7502449
SIN KIAN SENG,"NO. 10, PASAR BARU SIMUNJAN 94800 SIMUNJAN SARAWAK",SARAWAK,1.3955284,110.7502449
SING PING PING,NO.3 PASAR BARU 94800 SIMUNJAN SARAWAK,SARAWAK,1.3955284,110.7502449
CHOP SIN SENG,"NO. 17 & NO. 18, PASAR BARU SIMUNJAN 94800 SIMUNJAN SARAWAK",SARAWAK,1.3955284,110.7502449
NSK TRADE CITY (NUSAJAYA) SDN BHD,"LOT G-01, PUSAT KOMERSIAL SUNWAY MARKETPLACE, PERSIARAN MEDINI 6, SUNWAY ISKANDAR, BANDAR MEDINI ISKANDAR 79250 ISKANDAR PUTERI JOHOR",JOHOR,1.3968784,103.6306476
DOREMART BETONG,"LOT 12-19, BETONG NEW TOWNSHIP (PHASE 3) 95700 BETONG SARAWAK",SARAWAK,1.4038476,111.5404809
LEPAPA SUPERMARKET JAMBUSAN BAU,"SL 24-27,LOT 1229-1301,BLOCK 12,SPLD TAMAN MUTIARA SHOPHOUSE,JALAN JAMBUSAN 94000 BAU 94000 BAU SARAWAK",SARAWAK,1.4065928,110.1693266
EVERWIN CENTRE (7 MILES) SDN BHD,"GF & 1F, LOT 2561-2570(SL31-40), BLK 233 KNLD, JALAN KUCHING/SERIAN 93250 KUCHING SARAWAK",SARAWAK,1.409293,110.3354461
NAM LEONG - BETONG,LOTS 627-629 JALAN SIE KWANG NGAK 95700 BETONG SARAWAK,SARAWAK,1.4104871,111.5287576
MING MING SUPERMARKET SDN BHD,"LOT 335, BAU BAZAAR, KUCHING 94000 BAU SARAWAK",SARAWAK,1.415382,110.152358
EVERWIN CENTRE (BAU) SDN BHD,"SL 9-16, PL 864, BLOCK 9, SENGGI-POAK LAND DISTRICT 94000 BAU SARAWAK",SARAWAK,1.4157901,110.1550419
BS SUPERMART SDN BHD (BAU),"LOT 268-272, BLOCK B JALAN MARKET BAU, BAU TOWN DISTRICT 94000 BAU SARAWAK",SARAWAK,1.4165698,110.1550204
KK SUPER MART (BAU KUCHING),"NO.66, JALAN DATUK TEMENGGONG SALAU 94000 BAU SARAWAK",SARAWAK,1.417888,110.1559113
UPWELL SUPERMARKET SDN BHD - BAU,"LOT 704, BAU TOWN DISTRICT SUBLOT 1-7, JALAN SERINGGOK 94000 BAU SARAWAK",SARAWAK,1.4187399,110.156369
MYDIN ANJUNG BAZAAR NUSAJAYA,"LOT 25, ANJUNG NEIGHBOURHOOD CENTRE NO 5, PERSIARAN LEDANG HEIGHTS 79250 NUSAJAYA JOHOR",JOHOR,1.4239048,103.61728
SEN SEN DEPARTMENTAL STORE (BATU 10),GROUND FLOOR SUBLOT 1-10 LOT 2210 M 10 COMMERCIAL CENTRE BATU 10 JALAN KUCHING SERIAN 93250 KUCHING SARAWAK,SARAWAK,1.4247391,110.3284085
EVERBEST CENTRAL ENTERPRISE,"GROUND FLOOR, LOT 2439-2440, BLOCK 71, KCLD (S/L 12-13), 238-237, PEKAN BATU 10 (KOTA PADAWAN) JALAN KOTA PADAWAN, LORONG KOTA PADAWAN 10B1A2 93250 KOTA PADAWAN SARAWAK",SARAWAK,1.4263246,110.3263886
H&L RETAIL SDN BHD (KOTA PADAWAN MALL),"LOT 2382, BLK 71 KCLD 148, PEKAN BARU BATU 10 KOTA PADAWAN, JALAN PADAWAN 93250 KUCHING SARAWAK",SARAWAK,1.4263246,110.3263886
TRIMAJU COLDSTORAGE (PADAWAN) SDN BHD,"NO.46,LOT 2513,BLOCK 71,KCLD,GROUND FLOOR 93250 KOTA PADAWAN SARAWAK",SARAWAK,1.426621,110.3265119
H&L RETAIL SDN BHD (MJC),"NO.33, H-K KOTA PEDAWAN 10TH MILE BAZAAR, PENRISSEN RD 93250 KUCHING SARAWAK",SARAWAK,1.4268167,110.3264162
H&L RETAIL SDN BHD (10TH MILE),"NO.33, H-K KOTA PEDAWAN 10TH MILE BAZAAR, PENRISSEN RD 93250 KUCHING SARAWAK",SARAWAK,1.4268167,110.3264162
KK SUPER MART (KOTA SENTOSA KUCHING),"NO.14, KOTA SENTOSA, JALAN PENRISSEN 93250 KUCHING SARAWAK",SARAWAK,1.4268167,110.3264162
H&L RETAIL SDN BHD (SERIAN),"NO.33, H-K KOTA PEDAWAN 10TH MILE BAZAAR, PENRISSEN RD 93250 KUCHING SARAWAK",SARAWAK,1.4268167,110.3264162
NAHMEE TRADING (M) SDN BHD - BATU 32ND,"SL-20, LOT 10 BAKI JUNCTION, 32ND MILE, JALAN KUCHING-SERIAN 94700 SERIAN SARAWAK",SARAWAK,1.4330202,110.3284071
LEPAPA HYPERMARKET SERIAN,"NO 113.LOT 1456,SERIAN PIAZZA,JALAN DATUK MICHEAL BEAN ,94700 SERIAN 94700 SERIAN SARAWAK",SARAWAK,1.4347731,110.3282515
DOREMART KUCHING KOTA SAMARAHAN,"LOT 1293-1297, BLOCK 25, MTLD, G89 & G93 TAMAN SAMARINDAH BARU 94300 KOTA SAMARAHAN SARAWAK",SARAWAK,1.4353313,110.3942253
H&L RETAIL SDN BHD (17TH MILE),"LOT 1968, BLOCK 6, SENTAH SAGU LAND DISTRICT, JALAN KUCHING - SERIAN 94200 KUCHING SARAWAK",SARAWAK,1.4393954,110.3291113
99 SPEEDMART SDN BHD (TMN EKO BOTANI) - 2490,"NO: 35 & 37 (GROUND FLOOR), JALAN EKO BOTANI 3/5 TAMAN EKO BOTANI KAMPUNG MASJID LAMA 79100 NUSAJAYA JOHOR",JOHOR,1.439608,103.6187882
SEN SEN DEPARTMENTAL STORE SDN.BHD. (KOTA SAMARAHAN),SUBLOT 50-56 LOT 3022 BLOCK 1 SAMARAHAN LAND DISTRICT JALAN DATUK MOHD MUSA 94300 KOTA SAMARAHAN SARAWAK,SARAWAK,1.4399764,110.3618765
ECO-SHOP AIMAN MALL,"G32, G33, G59, G60 & PART CORRIDOR (GROUND FLOOR) & F3 (1ST FLOOR LOT 125, BLK 26 MTLD, JALAN DATO' MOHD MUSA 94300 KOTA SEMARAHAN SARAWAK",SARAWAK,1.4399764,110.3618765
FRESH HUB (KAMPUNG PASIR PUTIH),"NO.35, 37, 39 & 41 JALAN PENGKALAN 5, TAMAN PASIR MAS KAMPUNG PASIR PUTIH 81700 PASIR GUDANG JOHOR",JOHOR,1.4405661,103.9320014
LEPAPA SUPERMARKET SINIAWAN,"S/L NO.2-8. SINIAWAN TOWN DISTRICT, JALAN KUCHING -BAU,94000 BAU 94000 BAU SARAWAK",SARAWAK,1.4410513,110.2272916
99 SPEEDMART SDN BHD (NUSA PUNCAK) - 2764,"NO: 7 (GROUND FLOOR), JALAN NUSA PUNCAK 1 TAMAN NUSA PUNCAK 81550 GELANG PATAH JOHOR",JOHOR,1.4427569,103.5984148
MY MIX MART SDN. BHD. (TMN PASIR EMAS),"NO 6,8,10 JALAN PENGKALAN 5, TAMAN PASIR EMAS 81700 PASIR GUDANG JOHOR",JOHOR,1.4429555,103.9314357
KK SUPER MART (SINIAWAN CENTRAL KUCHING),"GROUND FLOOR, SUBLOT 19 (SURVEY LOT 1542), LOT 411 BLOCK 10 SPLD, NO.94, SINIAWAN CENTRAL 94000 BAU SARAWAK",SARAWAK,1.4441841,110.2313601
H&L RETAIL SDN BHD (AIMAN MALL),"GROUND FLOOR NO.29, AIMAN MALL JALAN DATO MOHD MUSA 94300 KOTA SAMARAHAN SARAWAK",SARAWAK,1.4443786,110.335441
TUNG MIN TRADING SDN BHD,"SUBLOT 15, 16 & 17 LOT 142 & 143, BLOCK 10 TAMAN SENGGI SHOPHOUSE, JALAN SINIAWAN BYPASS 94000 KUCHING SARAWAK",SARAWAK,1.4446879,110.2116201
LEPAPA SUPERMARKET AIMAN,"LOTS 1094,2298,2299,2302 & 16716,(LOT 1641) BLOCK MUARA TUANG L.D,JALAN DATUK MOHAMMAD MUSA,94300 KOTA SAMARAHAN. 94300 KOTA SAMARAHAN SARAWAK",SARAWAK,1.4459739,110.384754
KANA HARAPAN JAYA TRADING SDN BHD (TMN TANJUNG PUTERI),"2, JALAN SELUANG 35, TAMAN TANJUNG PUTERI 81700 PASIR GUDANG JOHOR",JOHOR,1.4506786,103.9340034
SEN SEN DEPARTMENTAL STORE (MUARA TUANG),SUBLOT NO 9-16 BLOCK 26 MUARA TUANG LAND DISTRICT JALAN DATUK MOHD MUSA 94300 JALAN DATUK MOHD MUSA SARAWAK,SARAWAK,1.4520974,110.4390161
PASAR RAYA KANA HARAPAN JAYA TRADING SDN BHD (BDR NUSA JAYA),"2, JALAN NUSA PERINTIS 12, TAMAN NUSA PERINTIS 3, BANDAR NUSA JAYA 81550 GELANG PATAH JOHOR",JOHOR,1.4528542,103.5899162
99 SPEEDMART SDN BHD (TMN NUSA PERINTIS) - 2819,"NO: 12 & 14 (GROUND FLOOR), JALAN MEDAN NUSA PERINTIS 12 TAMAN NUSA PERINTIS 3 81550 GELANG PATAH JOHOR",JOHOR,1.452883,103.595255
GS MART (NUSA SENTRAL),NO 25 & 27 & 29 JALAN SENTRAL 2 TAMAN NUSA SENTRAL 79100 ISKANDAR PUTERI JOHOR,JOHOR,1.453353,103.593521
KK SUPER MART (KOTA SAMARAHAN 2 KUCHING),"GROUND FLOOR, SUBLOT 3, IMAN, KOTA SAMARAHAN, JALAN DATUK MUHAMMAD MUSA 94300 KUCHING SARAWAK",SARAWAK,1.4542101,110.4098756
FRESH HUB AIR BIRU,"NO 4,6,8&10 JALAN 10/28 AIR BIRU 81700 PASIR GUDANG JOHOR",JOHOR,1.4546339,103.9110514
99 SPEEDMART SDN BHD (TMN NUSA SENTRAL 1) - 2247,"NO 182 & 184 (GROUND FLOOR), JALAN SENTRAL 1 TAMAN NUSA SENTRAL KAMPUNG MASJID LAMA 79100 NUSAJAYA JOHOR",JOHOR,1.458025,103.633
RED MART (TMN AIR BIRU) SDN BHD,"NO. 5 & 6, JALAN 9/23, TAMAN AIR BIRU 81700 PASIR GUDANG JOHOR",JOHOR,1.4580841,103.9183544
TRIMAJU COLDSTORAGE (SAMARAHAN) SDN BHD,GF LOT 3162 BLK 1 SAMARAHAN LAND DISTRICT(PLOT 5) G/1 TAMAN DESA ILMU 94300 KOTA SAMARAHAN SARAWAK,SARAWAK,1.4592643,110.4889601
INDAI MART (SPAOH),NO. 4 PASARA SPAOH 95600 SPAOH SARAWAK,SARAWAK,1.4593878,111.4806964
TKK AGRICULTURE DEVELOPMENT SDN BHD,"LOT 433, BLOCK 32 MUARA TUANG LAND DISTRICT, ASAJAYA 1.5433140222777557, 110.60687370454968 95600 KUCHING SARAWAK",SARAWAK,1.459522,110.490601
KK SUPER MART (MUARA TUANG KUCHING),"LOT:13, BLOCK 26, MUARA TUANG LAND DISTRICT 93400 KOTA SAMARAHAN SARAWAK",SARAWAK,1.459522,110.490601
GS MART (NUSARIA),"NO 5,7 & 9 JALAN NUSARIA 4/7 TAMAN NUSANTARA 79200 ISKANDAR PUTERI JOHOR",JOHOR,1.4596118,103.5803462
MY MIX MART SDN BHD (TMN AIR BIRU) (HQ),"NO 12, 14,16,18 JALAN 10/28, TAMAN AIR BIRU 81700 PASIR GUDANG JOHOR",JOHOR,1.4598288,103.906719
EVERWIN CENTRE (KOTA SAMARAHAN) SDN BHD,"NO.14 TO 27 (G/F) & 17-28(1ST FFOOR), UNI MEDIA COMMERCIAL CENTRE JALAN UNI MEDIA, KOTA SAMARAHAN EXPRESSWAY 94300 KOTA SAMARAHAN SARAWAK",SARAWAK,1.461425,110.417946
PASARAYA JIASON SDN BHD (PASIR GUDANG),"17-24, JALAN 10/17, PERCEDAIAN PERJIRANAN 8, 81700 PASIR GUDANG JOHOR",JOHOR,1.4651957,103.9066428
GOLDEN DRAGON CITY ENTERPRISE (KOTA SAMARAHAN),LOT 5597-5603 UNI SQUARE COMMERCIAL CENTRE KUCHING-SAMARAHAN EXPRESSWAY 94300 KOTA SAMARAHAN SARAWAK,SARAWAK,1.4695546,110.4068601
BS SUPERMART SDN BHD (BT7),"NO 300-306 LOT 703 (BLK 2), BLOCK 17, KCLD, KOTA SENTOSA (UNIT 4-10 BLOCK 2 GROUND FLOOR) LOT 640, JALAN TAPANG, K/S COMMERCIAL CENTRE 93250 KOTA SENTOSA SARAWAK",SARAWAK,1.469816,110.3315929
FRESH HUB (GELANG PATAH),"NO.7,9,11,13 & 15 JALAN NUSARIA 3 TAMAN NUSANTARA 79200 ISKANDAR PUTERI JOHOR",JOHOR,1.4701181,103.5827327
DOREMART KUCHING KOTA SENTOSA,"GROUND FLOOR, LOT 1958-1964, BLOCK 233 KNID, NO.208-215 PEKAN BATU 7 (KOTA SENTOSA) 93250 KUCHING SARAWAK",SARAWAK,1.4705057,110.3306576
H&L RETAIL SDN BHD (7TH MILE),"LOT 3243 - 3247, BLK A, LVL 1 NGEE FAH THEATRE BUILDING 7TH MILE, JLN PENRISSEN 93250 KUCHING SARAWAK",SARAWAK,1.4706295,110.3317455
NAHMEE TRADING (M) SDN BHD - KOTA SENTOSA,"GR, FL, SL 5-6 BLOCK 18, JALAN TAPANG KOTA SENTOSA, COMM CENTRE 93250 KUCHING SARAWAK",SARAWAK,1.47068,110.33055
99 SPEEDMART SDN BHD (TMN DENAI NUSANTARA) - 2400,"NO: 36 & 38 (GROUND FLOOR), JALAN DENAI 1 TAMAN DENAI NUSANTARA 81550 GELANG PATAH JOHOR",JOHOR,1.4707135,103.5836036
MY MIX MART SDN. BHD. (TMN NUSANTARA),"NO 28, 30 & 32, JALAN NUSARIA 1 J/1, TAMAN NUSANTARA 81550 GELANG PATAH JOHOR",JOHOR,1.4716025,103.5841264
KHJ FRESH MARKET SDN BHD (TMN PASIR PUTIH),"19, JALAN SIAKAP 3/1, TAMAN PASIR PUTIH 81700 PASIR GUDANG JOHOR",JOHOR,1.472386,103.9319528
LOTUSS (BUKIT INDAH),"NO. 1, JALAN INDAH 15 BUKIT INDAH 81200 JOHOR BHARU JOHOR",JOHOR,1.473143,103.649543
KANA HARAPAN JAYA TRADING SDN BHD (TMN PASIR PUTIH),"73 & 75, JALAN ASLI 17, TAMAN PASIR PUTIH 81700 PASIR GUDANG JOHOR",JOHOR,1.4748952,103.9308607
GS MART (NUSANTARA),NO 20 & 22 & 24 JALAN NUSARIA 11/4 TAMAN NUSANTARA 79200 ISKANDAR PUTERI JOHOR,JOHOR,1.4751727,103.5834427
ECONSAVE CASH & CARRY (JEB) SDN BHD (PEKAN NANAS),LOT 2665 & 2666 MUKIM JERAM BATU 81500 PEKAN NANAS JOHOR,JOHOR,1.475179,103.514327
RED MART SDN BHD,"30,32,34,36, JALAN TEMBIKAI 8 TAMAN KOTA MASAI 81700 PASIR GUDANG JOHOR",JOHOR,1.4754897,103.9558233
GS MART (KOTA EMAS),NO 9-G & 10 JALAN EMAS 2 PUSAT PERDAGANGAN KOTA EMAS 82000 PONTIAN JOHOR,JOHOR,1.4761619,103.39899
99 SPEEDMART SDN BHD (TAMAN PELANGI 2) - 2676,NO: 51 & 53 (GROUND FLOOR) JALAN KUNING TAMAN PELANGI 80400 JOHOR BAHRU JOHOR,JOHOR,1.4764541,103.769198
TARGET SUPERMARKET SDN BHD (PONTIAN),"NO 7, JALAN EMAS 4 PUSAT PERNIAGAAN KOTA EMAS 82000 PONTIAN JOHOR",JOHOR,1.4771418,103.3987102
ECONSAVE CASH & CARRY (PT) SDN BHD (PONTIAN),"NO 23 JALAN KOTA EMAS 2, OFF TAMAN KOTA EMAS, JALAN JOHOR KANAN, 82000 PONTIAN JOHOR",JOHOR,1.4771418,103.3987102
99 SPEEDMART SDN BHD (TMN PERLING JB 2 ) - 2279,"NO: 6 & 8 (GROUND FLOOR), JALAN PERSISIRAN PERLING, TAMAN PERLING, 81200 SKUDAI JOHOR",JOHOR,1.4775662,103.6732194
99 SPEEDMART SDN BHD (TMN SIERRA PERDANA 1) - 2176,"NO: 53 & 55 (GROUND FLOOR), JALAN SIERRA PERDANA 2/1 TAMAN SIERRA PERDANA KAMPUNG MASJID LAMA 81750 MASAI JOHOR",JOHOR,1.4785333,103.8726544
KK SUPER MART (PASIR GUDANG),"NO.23, JALAN SEJAMBAK 14, TAMAN BUKIT DAHLIA 81700 PASIR GUDANG JOHOR",JOHOR,1.4788155,103.8937695
99 SPEEDMART SDN BHD (TMN SIERRA PERDANA 2) - 3013,"NO : 35 & 37 (GROUND FLOOR), JALAN SIERRA PERDANA 6/3 TAMAN SIERRA PERDANA KAMPUNG MASJID LAMA 81750 MASAI JOHOR",JOHOR,1.4794274,103.8667391
99 SPEEDMART SDN BHD (PP KOTA EMAS)-2138,"NO: 6 & 7 (GROUND FLOOR), JALAN EMAS 3 PUSAT PERNIAGAAN KOTA EMAS 82000 PONTIAN JOHOR",JOHOR,1.4799005,103.3970905
99 SPEEDMART SDN BHD (TMN KOTA MASAI 2) - 2209,"NO: 16 & 18 (GROUND FLOOR), JALAN TEMBIKAI 4 TAMAN KOTA MASAI KAMPUNG MASJID LAMA 81700 PASIR GUDANG JOHOR",JOHOR,1.4802141,103.9543928
MASLEE EXPRESS SDN BHD (KOTA MASAI (KM)),"11-11A - 25-25A, JALAN TEMBIKAI1, TAMAN KOTA MASAI, 81700 PASIR GUDANG, JOHOR 81700 PASIR GUDANG JOHOR",JOHOR,1.4802223,103.9534428
FRESH HUB (TAMAN KOTA MASAI),NO. 10 & 12 (GF) JALAN TEMBIKAI 8 KOTA PASIR GUDANG 81700 JOHOR JOHOR,JOHOR,1.48076,103.9531381
ECO-SHOP KUCHING - SENTRAL,LOT 300 (2ND FLR) KUCHING SENTRAL 6TH MILES JALAN PENRISSEN 93250 KUCHING SARAWAK,SARAWAK,1.481769,110.331728
HWA THAI SUPERMARKET (KIP MALL MASAI),A3A/MA3A JALAN PERSIARAN 2 TAMAN BUKIT DAHLIA 81750 PASIR GUDANG JOHOR,JOHOR,1.4817748,103.8923524
MY MIX MART SDN. BHD. (TMN SIERRA PERDANA),"NO 1, JALAN SIERRA PERDANA 2/1, TAMAN SIERRA PERDANA 81750 MASAI JOHOR",JOHOR,1.4817785,103.8680005
CHAI HONG SENG SDN BHD (PONTIAN),"709, JALAN BAKEK, 82000 PONTIAN JOHOR",JOHOR,1.481879,103.3910332
99 SPEEDMART SDN BHD (TMN PELANGI 1 ) - 2296,"NO: 33 & 35 (GROUND FLOOR), JALAN KUNING 2, TAMAN PELANGI, 80400 JOHOR BAHRU JOHOR",JOHOR,1.4829215,103.7770305
LOTUSS KSL CITY,"LOTUSS KSL CITY LG-26, KSL CITY NO. 33 JALAN SELADANG, TAMAN CENTURY 80250 JOHOR BAHRU JOHOR",JOHOR,1.4837208,103.7626206
EVERWIN CENTRE (17 MILES) SDN BHD,"9-18, GOLDEN SQUARE, BATU17, JLN KUCHING/SERIAN 94200 SIBURAN SARAWAK",SARAWAK,1.4838272,110.3335172
TARGET SUPERMARKET SDN BHD (CAWANGAN MASAI),"LS 1, PTD 163160, JALAN SERANGKAI 1, TAMAN BUKIT DAHLIA, 81700 PASIR GUDANG JOHOR",JOHOR,1.4841179,103.8909981
KK SUPER MART (TAMAN KOTA MASAI),"NO.91, JALAN MANGGA 1, TAMAN KOTA MASAI 81700 PASIR GUDANG JOHOR",JOHOR,1.4841485,103.9459689
TPG MIX MART SDN. BHD. (TMN KOTA MASAI),"NO 39, 41, 43 JALAN TEMBIKAI 2, TAMAN KOTA MASAI, 81700 PASIR GUDANG JOHOR",JOHOR,1.4841876,103.9542797
99 SPEEDMART SDN BHD (TMN KOTA MASAI 1) - 2153,"NO: 61 & 63 (GROUND FLOOR), JALAN MANGGA 1 TAMAN KOTA MASAI KAMPUNG MASJID LAMA 81700 PASIR GUDANG JOHOR",JOHOR,1.4841917,103.9426757
GIANT SUPERMARKET (PERLING MALL),"GROUND FLOOR, PERLING MALL LOT 28650, JALAN PESIARAN PERLING 1 TAMAN PERLING 81200 JOHOR BAHRU JOHOR",JOHOR,1.4843105,103.6865575
GIANT HYPERMARKET (LEISURE MALL),"LOT 1.01&B1.01,PELANGI LEISURE MALL JALAN SERAMPANG TAMAN PELANGI 80400 JOHOR BAHRU JOHOR",JOHOR,1.4846397,103.7779917
LOTUSS ECO TROPICS,"LOTUSS ECO TROPICS PTD 117754, JALAN EKO PERNIAGAAN 7 TAMAN KOTA MASAI 81700 PASIR GUDANG JOHOR",JOHOR,1.4847163,103.937109
MASLEE EXPRESS SDN BHD (PASIR GUDANG (EPG)),"NO. 1-1A - 12-12A, JALAN PERSIARAN CENDANA, TAMAN CENDANA, 81700 PASIR GUDANG, JOHOR 81700 PASIR GUDANG JOHOR",JOHOR,1.4871934,103.9104964
MY MIX MART SDN. BHD. (TMN CENDANA),"NO 15, 17 JALAN CENDANA 9/1, TAMAN CENDANA 81700 PASIR GUDANG JOHOR",JOHOR,1.4877784,103.9141195
MYDIN WHOLESALE HYPERMARKET TAMAN RINTING,"PTD 92368 JALAN RINTING, MUKIM PLENTONG TAMAN RINTING 81750 MASAI JOHOR",JOHOR,1.487931,103.8640593
HARI2 SUPERMART (TAMAN CENDANA),NO. 3 & 5 JL. CENDANA 9/1 TAMAN CENDANA 81700 PASIR GUDANG JOHOR,JOHOR,1.4881771,103.9102115
CHOP GUAN SENG (GS MART PONTIAN),"PTD 7916 TAMAN PONTIAN JAYA BATU 34, JALAN JOHOR 82000 PONTIAN JOHOR",JOHOR,1.48835,103.390732
GS MART (PARIT MESJID),"NO 100, 101 & 102 JALAN PARIT MESJID TAMAN SRI AMAN 82000 PONTIAN JOHOR",JOHOR,1.48835,103.390732
99 SPEEDMART SDN BHD (TMN PONTIAN JAYA) - 2431,"NO: 50 & 51 (GROUND FLOOR), JALAN JAYA 4 TAMAN PONTIAN JAYA 82000 PONTIAN JOHOR",JOHOR,1.488487247,103.427662
99 SPEEDMART SDN BHD (TMN RINTING 1) - 2529,"NO: 95 & 97 (GROUND FLOOR), JALAN CENDANA 1 TAMAN RINTING KAMPUNG MASJID LAMA 81750 MASAI JOHOR",JOHOR,1.48849,103.8718111
MY MIX MART SDN. BHD. (TMN RINTING),"NO 10 & 12, JALAN SENA 9, TAMAN RINTING 81750 MASAI JOHOR",JOHOR,1.4888791,103.8698171
99 SPEEDMART SDN BHD (TAMAN SIAPU INDAH) - 2244,NO: 2 & 3 (GROUND FLOOR) JALAN INDAH 1 TAMAN SIAPU INDAH 86800 MERSING JOHOR,JOHOR,1.4891561,103.6561507
BB SUPERMARKET,"NO, 121-128 (SL13122-13129) FRD & 1ST FLR, CENTRAL CITY PHASE 19, JALAN KUCHING-SAMARAHAN EXPRESSWAY, 94300 KOTA SAMARAHAN 94300 KOTA SAMARAHAN SARAWAK",SARAWAK,1.4893401,110.4054369
HERO MARKET - ANGSANA MALL,"L1-12, ANGSANA JOHOR BHARU MALL ANGSANA JOHOR BHARU MALL PUSAT BANDAR TAMPOI 81200 TAMPOI JOHOR",JOHOR,1.48999,103.705399
99 SPEEDMART SDN BHD (TMN MEGAH RIA 1) - 2266,"NO: 3 & 5 (GROUND FLOOR), JALAN API-API 9 TAMAN MEGAH RIA KAMPUNG MASJID LAMA 81750 MASAI JOHOR",JOHOR,1.4903575,103.8594735
THE STORE (KOMPLEK LEIN HOE),"LOT 1-15, BLOCK H, PLAZA SENTOSA, JALAN SUTERA,TAMAN SENTOSA 80150 JOHOR BHARU JOHOR",JOHOR,1.4905828,103.767741
SMART BEE GROCER@SRI YAACOB,"NO 68,70 JALAN UDA UTAMA 4/1 BANDAR UDA UTAMA 81200 JOHOR BAHRU JOHOR",JOHOR,1.4906358,103.6701096
99 SPEEDMART SDN BHD (TMN MEGAH RIA 2) - 3015,"NO : 27 & 29 (GROUND FLOOR), JALAN KEMPAS 17 TAMAN MEGAH RIA KAMPUNG MASJID LAMA 81750 MASAI JOHOR",JOHOR,1.4911687,103.8496455
HWA THAI SUPERMARKET (BANDAR BARU UDA),"NO. 19, 21, 23, 25, 27 JALAN JAGONG 1 BANDAR BARU UDA 81200 TAMPOI JOHOR",JOHOR,1.4921213,103.7151494
LOTUSS (SERI ALAM),LOTUSS SERI ALAM PTD 111515 JALAN RINTING MASAI 81750 JOHOR BAHRU JOHOR,JOHOR,1.4923693,103.8791386
99 SPEEDMART SDN BHD (TMN CAHAYA KOTA PUTERI 1) - 2253,"NO: 7 & 9 (GROUND FLOOR), BLOK D, JALAN KOTA 1/1 TAMAN CAHAYA KOTA PUTERI KAMPUNG MASJID LAMA 81750 MASAI JOHOR",JOHOR,1.4924645,103.8386674
ECO-SHOP BATU 10,"THE SOLARIES, 10TH MILES BAZAAR GL, FL SL 9, LT 480 JALAN PENRISSEN 93350 KUCHING SARAWAK",SARAWAK,1.4928541,110.3308191
KK SUPER MART (TAMAN SENTOSA),"NO.33, JALAN SUTERA, TAMAN SENTOSA 80150 JOHOR BAHRU JOHOR",JOHOR,1.4930538,103.7684873
MASLEE EXPRESS SDN BHD (PONTIAN (EPT)),"BLOK 1 (GF & LEVEL 1), BLOK 2 & 3 (GF), NO. 99, JALAN PARIT MESJID, 82000 PONTIAN, JOHOR 82000 PONTIAN JOHOR",JOHOR,1.4932558,103.4064342
ECONSAVE CASH & CARRY (KM) SDN BHD (PASIR GUDANG),"NO 2, JALAN RUSA, TAMAN SCIENTEX, 81700 PASIR GUDANG JOHOR",JOHOR,1.4935838,103.9133324
MASLEE EXPRESS SDN BHD (SRI STULANG (SS)),"NO. 8, 8-01, 9, 9-01 & 10, JALAN SRI STULANG 1/1, TAMAN SRI STULANG, 80150 JOHOR BAHRU, JOHOR 80150 JOHOR BAHRU JOHOR",JOHOR,1.4945038,103.790389
99 SPEEDMART SDN BHD (BDR SERI ALAM 2) - 2208,"NO: 24 & 26 (GROUND FLOOR), JALAN SURIA 66 BANDAR SERI ALAM KAMPUNG MASJID LAMA 81750 MASAI JOHOR",JOHOR,1.4945382,103.8809828
MASLEE EXPRESS SDN BHD (LARKIN IDAMAN (LK)),"LOT 22, 24, 26, 28, 30 & 32, JALAN IDAMAN 2, TAMAN LARKIN IDAMAN, 80350 JOHOR BAHRU, JOHOR 80350 JOHOR BAHRU JOHOR",JOHOR,1.4946794,103.7522806
99 SPEEDMART SDN BHD (TAMAN PERINDUSTRIAN PEKAN NENAS) - 2916,NO: 75 & 77 (GROUND FLOOR) JALAN INDUSTRI 8 TAMAN PERINDUSTRIAN PEKAN NENAS 81500 PEKAN NENAS JOHOR,JOHOR,1.4949877,103.5254029
MY MIX MART SDN. BHD. (BDR SERI ALAM),"NO 18. 20 JALAN SURIA 67, BANDAR SERI ALAM 81750 MASAI JOHOR",JOHOR,1.4952998,103.8801486
99 SPEEDMART SDN BHD (KG PASIR) - 2815,NO: 16 & 18 (GROUND FLOOR) JALAN MATA KUCHING KAMPUNG PASIR 81200 JOHOR BAHRU JOHOR,JOHOR,1.4955184,103.7025299
KK SUPER MART (KUCHING CITY MALL),"ROUND FLOOR, LOT 5503 (SL.7), KUCHING CITY MALL PH.5, PENRISSEN/STEPHEN YONG LINK ROAD 93250 KUCHING SARAWAK",SARAWAK,1.4965431,110.3319987
MASLEE EXPRESS SDN BHD (BANDAR BARU UDA (BBU),"2, 3 & 4, JALAN PADI MAHSURI 12, BANDAR BARU UDA, 81200 JOHOR BAHRU, JOHOR 81200 JOHOR BAHRU JOHOR",JOHOR,1.4967847,103.7166795
99 SPEEDMART SDN BHD (TMN KOTA MASAI 3) - 2570,"NO :16 & 18 (GROUND FLOOR), JALAN BACANG 38 TAMAN KOTA MASAI KAMPUNG MASJID LAMA 81700 PASIR GUDANG JOHOR",JOHOR,1.4968066,103.9257797
